author,created_utc,id,link_id,parent_id,body
spookyjohnathan,2020-01-05 13:31:52,fd9bo9o,t3_ek8p9v,t3_ek8p9v,"Forgive my canned responses. There's a lot to cover here. Some of it is only tangentially related to your question but I think it brings up some interesting points that should be covered nonetheless.  *[copy/paste]*  [Social ownership of the means of production](https://en.wikipedia.org/wiki/Socialism) never killed anyone, so the policy that all socialists advocate in common is responsible for precisely zero deaths.  The public has a right to use public resources to build a public means of production so they can [work for themselves and keep the fruit of their labor to themselves,](https://en.wikipedia.org/wiki/To_each_according_to_his_contribution) just like we build public military to protect ourselves, and public education to educate ourselves.  If reactionaries try to infringe this right, we have the right to defend ourselves from them, the same as anyone has any right to defend himself from an aggressor, so socialists who fought for this right are responsible for precisely zero deaths; those deaths lie at the feet of [the aggressors, who resorted to violence to stop us from exercising our rights, and forced us to defend ourselves.](https://en.wikipedia.org/wiki/United_States_involvement_in_regime_change#Cold_War_Era)  Policies that have nothing to do with the implementation of social ownership of the means of production, like [the eradication of sparrows under Mao](https://en.wikipedia.org/wiki/Four_Pests_Campaign) which backfired, causing crops to fail when it turned out that the sparrows did more to protect crops than harm them, may have caused many deaths, but they have absolutely nothing to do with socialism. Chinese farmers had considered sparrows pests for generations, [and many capitalist countries still do](https://en.wikipedia.org/wiki/Eurasian_tree_sparrow#Relationships_with_humans) - if China had been a capitalist country during its industrialization and modernization, the result would have been the same. Eradicating pest species, even ones that turn out to be beneficial, is not unique to socialist countries. In this regard, socialism is responsible for precisely zero deaths.  For deaths in socialist countries that were the result of the actions of non-socialists, I have this to say. It's something I discuss a lot, so forgive the canned response.  *[copy/paste]*  [Russia experienced severe famine on average every decade under the Tsars.](https://en.wikipedia.org/wiki/Droughts_and_famines_in_Russia_and_the_Soviet_Union) The USSR inherited a society that was still largely un-industrialized in the 30s. They modernized it, and at every point after that, [they produced more food than the US.](https://artir.files.wordpress.com/2016/05/compar1.png?w=640) Even during the crash before the dissolution, the worst part in the modern era, they were producing more food than the US during every point before 1975. [These facts come from no other source than the US government itself.](https://www.cia.gov/library/readingroom/docs/DOC_0000498133.pdf)  There were famines every decade under the Czars, after the Nazi invasion the Soviets rebuilt their country and they ended famines in the USSR permanently. The famines didn't return to North and Central Asia until the adoption of capitalism; [there have been three major food shortages since then, with the old pattern apparently resuming.](https://en.wikipedia.org/wiki/Droughts_and_famines_in_Russia_and_the_Soviet_Union#Post-Soviet_Russia)  *[copy/paste]*  The last famines in the USSR were during the Nazi [Siege of Leningrad](https://en.wikipedia.org/wiki/Siege_of_Leningrad) and in [1946-47, when the country was trying to rebuild after the Nazis invaded the heartland and destroyed hundreds of miles of agricultural development.](https://en.wikipedia.org/wiki/Soviet_famine_of_1946%E2%80%9347) There were only two other major famines before that; the first during the Russian Civil War, [which ended as soon as the Bolsheviks won and took power,](https://en.wikipedia.org/wiki/Droughts_and_famines_in_Russia_and_the_Soviet_Union#cite_note-7) and the famine in Ukraine between 1932-33, when [the landowning class in Ukraine hoarded and then destroyed nearly 90 million head of cattle and immeasurable amounts of grain.](https://books.google.com/books?id=Bp31GmfH-6YC&amp;pg=PA159#v=onepage&amp;q&amp;f=false) That's about 7 million tons of meat from cattle and likely twice as much grain, between [two and four tons of food for every person who died during the famine.](https://lb.ua/news/2010/01/14/19793_nalivaychenko_nazval_kolichestvo_zh.html)  This is not my argument. It's the argument of a fervent capitalist who made it his mission in life to discredit the USSR at every turn, [the professional anti-Communist propagandist Robert Conquest,](https://en.wikipedia.org/wiki/Robert_Conquest#The_IRD_years) and even according to him, the pro-capitalist landowning class in the Ukraine destroyed literally tons of food for every starving person in the USSR.  It's ridiculous to blame socialism for the deaths caused by the devastation of a Nazi invasion, or the deliberate and willful destruction of food by landowners to keep the peasant class hungry and dependent. In these cases, socialism is responsible for precisely zero deaths.  *[copy/paste]*  &gt;...Soviet executions?  A quick rundown of some terms I think most people here will agree with, so that we can address the question of exactly what it means to be anti-communist in a communist society.  [A communist society is a classless, stateless, moneyless society](https://en.wikipedia.org/wiki/Communism) built on a socialist economy, [a socialist economy being one where the means of production is socially owned](https://en.wikipedia.org/wiki/Socialism) so that workers can use it to [work for themselves and keep the value of what they produce for themselves.](https://en.wikipedia.org/wiki/To_each_according_to_his_contribution)  This is opposed to [capitalism, where the means of production is privately owned so that workers use it to work for the private owner who keeps the value of what was produced](https://en.wikipedia.org/wiki/Capitalism) and pays the workers [a wage, which by definition, is less than the value of what was produced, so the owner can extract profit from the work of others.](https://en.wikipedia.org/wiki/Wage_labour)  So, to oppose allowing people to work for themselves on a socially owned means of production, and to wish to re-create conditions that require them to sell themselves to the rich in order to survive is a serious problem.  An even more serious problem are the monarchist loyalists and other people who wanted to return the USSR to its previous state, which is hardly even a step removed from abject feudalism, and the fascists who wanted to turn the USSR into something even worse than the monarchists.  Does that mean all of these people deserved to die? No, of course not. Unfortunately, when you have the entire world against you, just waiting to exploit any weakness, and malicious groups working from within to destabilize the fragile society you're trying to build and spread the influence of those who wish to re-enslave you, not to mention fascists gaining strength and amassing an army at your borders like the USSR did, drastic measures are necessary.  That said, the purges only affected a minority of people in the party or working in government. It wasn't a problem that affected the average person at all, and even among the people who were charged, the overwhelming majority weren't executed for their crimes. Many served punitive sentences and most were rehabilitated. I think that's the least we could do, to give everyone at least a chance of being part of the new, better world we're trying to build.  &gt; ...Stalin dictator/political repression?  One of Stalin's closest advisers and the person who eventually filled his role after his death, [Nikita Krushchev, was anti-Stalin,](https://en.wikipedia.org/wiki/Nikita_Khrushchev) so I don't think the situation in the USSR was anything like capitalist propagandists have made it out to be.  Krushchev had this to say about Stalin -  ""And here was something interesting (which was also characteristic of Stalin): this man, in a flairup of anger, could do a lot of harm. But when you demonstrated to him that you were right and if  you adduced good facts, he would understand in the end that this was a man who was defending a useful cause, and would support you... Yes, there were cases when you could firmly disagree with him and if he was convinced you were right, then he would yield his own point of view and take the point of view of his interlocutor.""  Here is a man who opposed Stalin, debated, argued, and deliberated with him to his face on a regular basis, and still went on to lead the USSR after Stalin's death. Stalin simply isn't the dictator he's made out to be.  All of this isn't to say that I have no criticism of the USSR. I think there were times when mistakes were made, and some of them had disastrous consequences. After Stalin the gradual liberalization of the USSR is by far the most egregious one, but there are also examples that other users here might bring up, things I'm still learning about and may still be on the fence about, but presented above are the specific subjects being discussed in the OP, and my opinions on them as I understand them based on the facts I've presented.  It's worth noting that although I'm glad to discuss this information here, I don't think much of it has very much to do with the concept of social ownership of the means of production. Stalin might have preferred apples to oranges, but that doesn't mean eating apples is an inherent part of socialism.  tl;dr - The starvation trope is a myth and miss-attribution of causes, and socialist ""authoritarianism"" is an act of self-defense to protect the rights of the proletariat against those aggressors who wish to undermine it."
SpunkyDred,2020-01-05 13:32:16,fd9bpo2,t3_ek8p9v,t1_fd9bo9o,&gt; apples to oranges  But you can still compare them.
Kangodo,2020-01-05 14:13:26,fd9i4no,t3_ek8p9v,t1_fd7p6po,"&gt; whom he felt were plotting against him  He didn't ""felt"" it, there were trials. Hundreds of pages of transcripts you can read about it.  &gt; forced agricultural collectivization by the Soviet government worsened the effects of the famines  Do you have any proof of that? I'd say it reduced the effects of the famines."
Akenaten09,2020-01-05 14:40:40,fd9m3cn,t3_ek8p9v,t3_ek8p9v,"Yes. According to communists.  &amp;#x200B;  Which is the reason why, no matter how many times their efforts fail or the magnitude of failure, they will keep insisting that its worth it and every means is viable since the endgame is more or less a ""perfect"" society despite them trying to weezle out of it by saying ""no , its just better than capitalism"" or ""the next step of societal evolution""."
Akenaten09,2020-01-05 14:45:05,fd9mwvy,t3_ek8p9v,t1_fd8oy6v,"The problem is that to establish a socialist/communist society out of the dregs of a capitalist one, it requires exerting control over practically everything, to a point that ""authoritarian"" sounds like it can't do it enough justice.  And who is gonna relinquish that kind of control afterwards? The taste will be so sweet they will make sure to never get rid of the problems in order to retain it."
denversocialists,2020-01-05 15:18:15,fd9sez8,t3_ek8p9v,t3_ek8p9v,"""the end is justified if it leads to increasing the power of humanity over nature and to the abolition of the power of one person over another. Permissible and obligatory are those and only those means, we answer, which unite the revolutionary proletariat, fill their hearts with irreconcilable hostility to oppression...imbue them with consciousness of their own historic mission, raise their courage and spirit of self-sacrifice in the struggle.   Precisely from this, it flows that not all means are permissible.   When we say that the end justifies the means, then for us, the conclusion follows that the great revolutionary end spurns those base means and ways which set one part of the working class against other parts: or attempt to make the masses happy without their participation; or lower the faith of the masses in themselves and their organization, replacing it by worship for the ""leaders."""""
VOTE_TRUMP2020,2020-01-05 15:45:02,fd9xdb4,t3_ek8p9v,t1_fd7q898,"Funny how the economic planners whose *sole job* is to plan the economy (and all of the possible negative outcomes that come with it) couldn’t have possibly seen it coming that the Kulaks **might** be kind of pissed off that the government is taking their output away from them only to be redistributed. Were the planners really that shortsighted to think the Kulaks would just bend over and give the USSR their land and yield?   &gt; The Russian famine of 1921–22, also known as the Povolzhye famine, was a severe famine in the Russian Soviet Federative Socialist Republic which began early in the spring of 1921 and lasted through 1922. This famine killed an estimated 5 million people, primarily affecting the Volga and Ural River regions, and peasants resorted to cannibalism. The famine resulted from the combined effects of economic disturbance because of the Russian Revolution and Russian Civil War, exacerbated by rail systems that could not distribute food efficiently. One of Russia's intermittent droughts in 1921 aggravated the situation to a national catastrophe. Hunger was so severe that it was likely seed-grain would be eaten rather than sown. At one point relief agencies had to give food to railroad staff to get their supplies moved. **The United States sent food and medicine that fed about 11 million people.**  Also...the USSR had no problem with taking handouts from the “evil fascists”"
BlackCats93,2020-01-05 15:56:21,fd9z7sc,t3_ek6a0o,t3_ek6a0o,"It's literally not defending Iran. It's supporting Iran against an unjust and illegal war from an imperial Capitalist country. It's going against American imperialism which is driven by capitalism since Iran sits on a large reserve of oil that can be used to make tons of money (hence why the oil stocks have skyrocketed since the killing of the general). No one is going to say the Iranian government is good, hell the people are protesting their government. But they'll start burning American flags soon when their civilians and cultural spots start getting drone striked. If you're defending the US War Machine, you are a liberal."
BlackCats93,2020-01-05 15:58:22,fd9zha8,t3_ek6a0o,t1_fd7a2xm,I mean drone strikes are cowardly. Some drone operator in fucking Nevada or some bullshit just killed the #2 in charge of another country by a remote operated drone. That's pretty cowardly.
DMT57,2020-01-05 15:58:34,fd9zi93,t3_ek8p9v,t1_fd9xdb4,"Wrong famine there buddy, we were discussing the famine of 1932-33 not 21-22. The famine you mentioned occurred because of the damage from the civil war which destroyed the infrastructure and rail systems necessary to distribute food as well a severe drought."
Northernfrostbite,2020-01-05 16:04:51,fda0fz6,t3_ek6a0o,t1_fd9z7sc,"I quote ""an alternative other than unconditional support for Iran will get a ban.""  When they say Iran they don't mean the Iranian people. They specifically mean the Iranian fascist theocracy. They're supposed to get a free pass right now.  I'm out here burning US flags and Iranian flags while the mullahs are happy to take you Reddit kiddies out to ""lunch.""  So much for workers uniting against their common enemy. UsA bAd amirite?"
g_squidman,2020-01-05 16:22:38,fda3svx,t3_ek6a0o,t1_fd77iem,How can you hope to communicate your ideas when you massacre the dictionary like this?
Northernfrostbite,2020-01-05 16:42:59,fda794i,t3_ek6a0o,t1_fd9z7sc,"https://en.m.wikipedia.org/wiki/1988_executions_of_Iranian_political_prisoners  ""The majority of those killed were supporters of the People's Mujahedin of Iran, although supporters of other leftist factions, including the Fedaian and the Tudeh Party of Iran (Communist Party), were executed as well.""  ""Because of the large number, prisoners were loaded into forklift trucks in groups of six and hanged from cranes in half-hour intervals.""  The people involved in this then are in positions of power in Iran now.  Once again, Galaxy brain, I'm not defending the US war machine. I'm defending people against Capital here and everywhere."
BlackCats93,2020-01-05 16:45:48,fda7yih,t3_ek6a0o,t1_fda794i,"So you're okay with invading Iran and murdering the people because, I mean, it'll get a new leader in power.   You're too thick in the head to understand, we're not defending Iran. We're giving them support against US Imperialism. Sometimes a country sucks, but ya know what? That's their business. The US has no say in it and murdering hundreds of thousands of citizens and committing war crimes, isn't going to change anything."
Northernfrostbite,2020-01-05 16:52:48,fda8xtb,t3_ek6a0o,t1_fda7yih,"&gt;So you're okay with invading Iran and murdering the people because, I mean, it'll get a new leader in power.   Show me where I even remotely suggested that. *Please*.  You're falling into the false ideological narrative. The point isn't to defend Iran by cheering for their fascist dictatorship and *literally censoring all criticism of it*. The point is to call against the common enemy in the US, Iran and everywhere else.   &gt;That's their business.  Are you serious? Do you want to reconsider that? The execution of up to 30,000 communists is ""their business?"" We have ""no say in it?"" As resistance to Capital we have a say against it everywhere."
SternerStirner,2020-01-05 16:54:05,fda99u8,t3_ek6a0o,t1_fd7ao0l,"Anarchism is a lonely road.  I support Iran because I believe in national self determination.  It is an imperialist aggression.  But, yeah, Iran isn't exactly a sympathetic country.  Best to not give a fuck and watch the world burn."
BlackCats93,2020-01-05 16:57:54,fda9z87,t3_ek6a0o,t1_fda8xtb,"So let me clarify since I'm reading your comments to other people and you're too shitbrained to understand.   To sit back and not choose a side, is to allow America to murder hundreds of thousands of Iranian citizens and occupy Iran, which will continue the oppression of the working class and lead to decades of more deaths, i.e Iraq. As communists, we are in a conflict with Capitalism, that is true. But we are also in a conflict with imperialism. It is our duty as communists to go against the imperialist forces, even if the government we're defending is also a reactionary government. Choosing to do nothing, is siding with the oppressors because when you choose to do nothing, and just sit here and say ""Yeah well, they're bad too"" the main bad guys are going to get their way. There is no resistance to them slaughtering Iranian people and occupying that country until it's resources are used up, causing the deaths of hundreds of thousands during the war, and going to total to millions by time the occupiers are done.   Iranian people see their government as illegitimate. But they are going to defend their country to the death from US occupation, because that is seen as the bigger threat to them. Just because you don't like the Iranian government, doesn't mean we should support the US murdering people and overthrowing them because 100% the occupation will be worse."
Northernfrostbite,2020-01-05 17:00:01,fdaaa6g,t3_ek6a0o,t1_fda99u8,"Universal truth isn't measured by mass appeal.  You support Iran by denouncing *all* the thugs of Capital, not by talking up their thugs over the US thugs. To do so is to put nation *before* class, which is what communists were supposed to be against before Stalinist deviation."
VOTE_TRUMP2020,2020-01-05 17:00:10,fdaaavb,t3_ek8p9v,t1_fd9zi93,"All of the text before 1921-1922 famine **was** referring to the 1932-1933 famine. I was just pointing out that in **one** of the many famines that occurred throughout the USSR (at least) the USSR took aid from the US.   BUT, even if you all don’t believe me that I was talking about the 1932-1933 famine which was as a result of the Holodomor (which obviously all of the communists here will most probably say is “Western propaganda” anyways, so no reason to discuss that because we won’t get anywhere) my point still stands still yet to be refuted. Why couldn’t the all knowing extremely efficient economic planners foresee the Kulaks being pissed off by their policies? Also, while there were many natural famines pre Soviet Era...how do those somehow excuse man made famine brought on by reactions (by the Kulaks) to USSR domestic policy?"
GreekCommnunist,2020-01-05 17:07:40,fdabbep,t3_ek6a0o,t1_fd6gdfw,"Well,we don't have a war though?  Iran and Usa aren't in a war."
BlackCats93,2020-01-05 17:11:39,fdabuwm,t3_ek6a0o,t1_fdab4e5,"Alright so we're just going to go to insults because you just repeat the same things over and over.   We have chosen capital as the primary evil. We oppose capital. Alright cool. America still bombs Iran and kills civilians and occupies the country. Great. Your capital war sure stopped that.   We are not in a position to just completely overthrow the US government. We can oppose, and we can offer support to the threatened country. Your choice is to choose a war against Capital. A war that won't get anywhere by time the Iran war kicks off. Your choice is inaction to the imperial forces of the US. Right now, the way you're talking, is as if someone in the Star Wars universe saw the Empire just doing it's thing and chose to ignore all of it, because the resistance isn't much better. ""Oh they kill whoever on the other side. They're basically terrorists."" So you choose to not try and stop the FAR GREATER EVIL. By time we're able to really take the war to capital, Iran is going to be a glass parking lot. But you want that moral victory.   I'm just going to make an assumption here, and go by the way you disregard even quotes from Lenin and Iranian people (who said they would fight the US because the occupation is a bigger threat than the reactionary government), I'm assuming you're an AnCom?"
DMT57,2020-01-05 17:12:03,fdabwwr,t3_ek8p9v,t1_fdaaavb,"No one says that the people in charge of central planning were omniscient gods or anything, in fact I believe the fact that the ussr didn’t transition to cybernetic central planning akin to project cybersyn is a big issue. But in regards to your question the planners most likely anticipated pushback from the Kulaks but they had to collectivize in order to try and feed the rest of the population. If they hadn’t collectivized everyone else would have starved except the Kulaks, so it makes sense that they were willing to take the risk in order to secure food for the rest of the population. It’s also hilarious how you can shift the blame from the people who would rather destroy their food than feed their compatriots to the planners and the government that tried to secure food for the rest of the country. You also try and say that there were “many” famines during the Soviet period when in reality there were only 3 serious famines: 1922-23 caused by ww1 and the civil war, 1932-33  caused by poor harvest and sabotage, and 1947 which was a result of ww2 devastation. The Soviet Union ended the periodic famines that plagued Russia and the surrounding territories."
GreekCommnunist,2020-01-05 17:15:40,fdacelh,t3_ek6a0o,t3_ek6a0o,"Criticising the Bombing is necessary because USA just admitted that it killed a high ranking military personnel of a country during peace because it perceived the man as a threat to its national security.  And no one fucking cares.   If it was the other way around, we would have been bombarded all day about this hideous act of an agressor state and other similar stuff,but because is USA doing it, somehow people Think is normal.   That doesn't mean that i support the policy of Iranian Islamic Republic which has outlawed Tudeh and persecutes its members."
stretchmarx20,2020-01-05 17:21:21,fdadnc5,t3_ek8p9v,t1_fd9bo9o,Collectivization in the USSR killed millions of people. You sound like a holocaust denier and it's actually pathetic. Grow up and read some actual historians     [https://www.jstor.org/stable/2938412?seq=1](https://www.jstor.org/stable/2938412?seq=1)
BlackCats93,2020-01-05 17:38:33,fdagq9z,t3_ek6a0o,t1_fdagdwm,"Lol Alright, calm down Anarkiddy. We all know that you are just as reactionary as chuds, and that your whole ""Let's fight capital"" is basic LARPing like 95% of the Anarkiddies on reddit. You disregard Lenin, you disregard Iranian people. What do you want so you feel content and so we can drill this basic understanding into your thick ass head."
BlackCats93,2020-01-05 17:42:10,fdaha2r,t3_ek6a0o,t1_fdah2es,"Yes. I'm the one that made a fool out of himself, judging by all the other comments trying to explain how basic this is, and you being too stupid to understand and just repeating ""Yeah but what about capital."" No thanks.   I don't have the patience other people had with you. Go back to being a braindead lib, stop pretending to be a communist."
spookyjohnathan,2020-01-05 17:45:12,fdahzfj,t3_ek8p9v,t1_fdadnc5,"This is not an argument. If you have something to say or a reason to believe something explain yourself. If you have a reason to believe something you should be able to put it into your own words.  Describe the mechanism by which collectivization killed anyone.  The historians cited above are the premier anti-Communist voices of the 20th century. If you're not familiar with Robert Conquest, it's safe to say you're not going to be contributing very much to this discussion."
