author,created_utc,id,link_id,parent_id,body
Sag0Sag0,2019-12-31 19:55:01,fco0x4t,t3_ei7el2,t3_ei7el2,"On the women’s rights stuff, there’s a difference between theoretical rights in a constitution and rights in reality. One of the final things that started the insurgence was mandatory primary school education for girls.   (I can’t find the page right now but it’s from a book called bear trap written by the member of ISI in charge sending arms to the insurgents. )"
GhettoNeddo,2019-12-31 20:14:19,fco3a56,t3_ei7el2,t1_fco0x4t,Can you give me a source for when and who instituted mandatory primary school?
Sag0Sag0,2019-12-31 20:26:06,fco4lbk,t3_ei7el2,t1_fco3a56,I can’t as I don’t have my book with me and I cant find any info on it right now. However if it was one of the insurgents initial problems than it was pushed through under Taraki or Amin.
BalticBolshevik,2020-01-01 08:50:11,fcpob6r,t3_ei7el2,t3_ei7el2,"Well women experienced a period of rapid liberation through socialist literacy schemes, they were also granted the vote. On top of that the government re-distributed a lot of wealth which benefited many Afghanis. The problem was that ultra conservatives, primarily from the North opposed all those policies, hence the head of government started having protestors killed in droves. The Head of State realised the HoG was a nut job and was bleeding popular support so he asked the USSR to intervene against reactionaries and depose the HoG and the USSR did just that, but not before the Hog had the HoS killed. It’s all a mess really."
GhettoNeddo,2020-01-01 19:42:09,fcrwvqm,t3_ei7el2,t1_fcpob6r,"A lot of this is just false. Women were granted the vote in the early 20th century, just a year after the UK, by the monarchy. The socialists had nothing to do with that. Why you making shit up?   Reporting you to the mods"
BalticBolshevik,2020-01-01 19:57:01,fcryx86,t3_ei7el2,t1_fcrwvqm,"I literally studied the Cold War and even anti-Soviet documentaries from America cite the fact that women were given equal voting rights as a reason for Northern Afghani tribes opposing the socialists... It seems your ego is quite bruised, but by all means report me I couldn’t care less for what you do."
GhettoNeddo,2020-01-01 20:52:16,fcs61l3,t3_ei7el2,t1_fcryx86,"&gt;The 1964 Constitution of Afghanistan granted women equal rights and universal suffrage, and they could run for office.[27]   https://en.wikipedia.org/wiki/Women_in_Afghanistan  1964 was still during the Monarchy and had nothing to do with socialist. The communists didn't take power until 1978 almost 15 YEARS later. You're trying to claim for socialism, things that the monarchy and liberals did in their country and it's pathetic. Grow up"
GhettoNeddo,2020-01-01 21:25:36,fcsatp6,t3_ei7el2,t1_fcryx86,&gt; cite the fact that women were given equal voting rights as a reason for Northern Afghani tribes opposing the socialists...  This sentence literally doesn't even make sense. Wtf does this mean? Do you not speak english?
Lanfranc_di_Cambria,2020-01-02 00:10:07,fcss8rd,t3_ei7el2,t3_ei7el2,"Yes.   The communist government in Afghanistan was never intended to outlast the Soviet regime in Moscow. Yet it did, by about a decade.  When the communist regimes in Eastern Europe were falling without support from Moscow, the Kabul government was successfully consolidating power.  Arguably, the lack of foreign control is one of the reasons the communist government lasted so long."
GhettoNeddo,2020-01-02 00:42:00,fcsuwc8,t3_ei7el2,t1_fcss8rd,That’s your evidence? Successfully consolidating power isn’t proof that a government is popular. You’re joking right
Lanfranc_di_Cambria,2020-01-02 00:43:16,fcsv05s,t3_ei7el2,t1_fcsuwc8,"They were able to build a pretty broad coalition.  In all fairness, they weren’t exactly communist in any meaningful sense.  I don’t think they were all that interested in the support if anyone but the various warlords. But that’s the support they needed."
GhettoNeddo,2020-01-02 00:55:45,fcsw15c,t3_ei7el2,t1_fcsv05s,"So now your admitting that they didn’t have popular support. They just built coalitions with war lords. This post is asking for **evidence** that the communist government enjoyed popular support of **the masses**. I cited a book by a historian where he specifically details how the communist government never was popular, and therefore had to start imprisoning protesters in mass. I’m asking for evidence that contradicts that. So far no one has provided anything. Sound like it’s settled that the Communist government was very tyrannical. Thought this sub would at least try to defend them but I guess we can at least agree in this case"
Sag0Sag0,2020-01-02 01:11:19,fcsxc2n,t3_ei7el2,t1_fcsatp6,That sentence actually does make sense.
Sag0Sag0,2020-01-02 01:14:39,fcsxmd7,t3_ei7el2,t1_fco3a56,"On another note you can read through the book yourself, it’s a very interesting primary source on the kinds of people who were fighting the communists. (It’s interesting because he is a deeply religious man, which causes conflicts with the CIA)"
GhettoNeddo,2020-01-02 01:44:36,fct06by,t3_ei7el2,t1_fcsxc2n,Can you explain it then
BalticBolshevik,2020-01-02 02:28:40,fct3rtu,t3_ei7el2,t1_fcs61l3,"I’ll make a minor correction since I was both speaking in reductionist terms and not remembering every detail of the documentaries I watched a while back. Women might’ve had de jure universal suffrage but they didn’t have de facto universal suffrage, this is a common occurrence when oppressors try to score progressive points. In Northern Ireland after  Northern Irish locals were granted equal voting rights to English settlers they were regularly blocked from entering polling stations by the local governments previously elected by the settlers and by the settlers themselves. In the US even after African-Americans were given the vote, in the South literacy requirements were introduced for voters, Black people were disproportionally poorer due to slavery and due to how much of a failure reconstruction was, white people were given a way out through the Grandfather Clause which allowed people to vote if their parents or grandparents had voted meaning many poor/illiterate white people could vote too. In Afghanistan most women were housewives and didn’t have the opportunities to go out and vote, courts weren’t very widespread and therefore enforcement of universal suffrage wasn’t either. When in 1978 the socialists granted women equal rights in all areas, such as marriage, education, careers, etc, the Afghan Women’s Council was set up to help improve education and literacy rates among women and to encourage them to go out and vote, hence moving toward de facto equality."
GhettoNeddo,2020-01-02 02:35:30,fct4bg2,t3_ei7el2,t1_fct3rtu,Okay that makes sense
supercooper25,2020-01-02 04:23:25,fctcjgz,t3_ei7el2,t1_fcsuwc8,"&gt;Successfully consolidating power isn’t proof that a government is popular.  Every regime in the history of the world has required a certain degree of popular legitimacy to maintain power, that the Afghan communist government survived as long as it did without any foreign support is enough evidence to prove the existence of a significant support base. Now of course whether or not they had a majority backing is a different question entirely, it may very well be the case that they didn't, but Marxists aren't really interested in pure numbers so much as class, especially in semi-feudal countries like Afghanistan where the proletariat is only a small minority.  [https://www.reddit.com/r/DebateCommunism/comments/eh9fd4/what\_happened\_in\_afghanistan\_questions\_about\_the/](https://www.reddit.com/r/DebateCommunism/comments/eh9fd4/what_happened_in_afghanistan_questions_about_the/)  Edit: Your arguments and sources were already heavily scrutinized on a previous thread by u/ConsciousBook so I'm not sure why you thought you could present the exact same narrative here and expect to get away with it.  &gt;according to actual historians  Again, the validity of this book has been called into question due to the author's  Mujahideen background and you were provided with several counter-examples, here are some others:  [https://newbooksnetwork.com/rodric-braithwaite-afgantsy-the-russians-in-afghanistan-1979-89-oxford-up-2011/](https://newbooksnetwork.com/rodric-braithwaite-afgantsy-the-russians-in-afghanistan-1979-89-oxford-up-2011/)  [https://mltheory.files.wordpress.com/2017/06/austin-murphy-the-triumph-of-evil.pdf](https://mltheory.files.wordpress.com/2017/06/austin-murphy-the-triumph-of-evil.pdf)  [https://williamblum.org/chapters/killing-hope/afghanistan?fbclid=IwAR1Gaa8DjtXsYL0vJ1ojwbciOrGrirX\_tRXAfYARpup8Yb7ehNrn84VRed4](https://williamblum.org/chapters/killing-hope/afghanistan?fbclid=IwAR1Gaa8DjtXsYL0vJ1ojwbciOrGrirX_tRXAfYARpup8Yb7ehNrn84VRed4)  [http://www.michaelparenti.org/afghanistan%20story%20untold.html?fbclid=IwAR0ITkIvxyD5wHNABkT8uVVuibhhDoTZx3AYC2WKtZLqnx545j0Nu9r8RoY](http://www.michaelparenti.org/afghanistan%20story%20untold.html?fbclid=IwAR0ITkIvxyD5wHNABkT8uVVuibhhDoTZx3AYC2WKtZLqnx545j0Nu9r8RoY)  [https://gowans.blog/2010/08/09/women%E2%80%99s-rights-in-afghanistan/?fbclid=IwAR3XfV4Ndit1s7cQyA6Q4KDkFPWdWEZotaSCwjn6M6CTrJBPctF\_E\_EuVkA/](https://gowans.blog/2010/08/09/women%E2%80%99s-rights-in-afghanistan/?fbclid=IwAR3XfV4Ndit1s7cQyA6Q4KDkFPWdWEZotaSCwjn6M6CTrJBPctF_E_EuVkA/)  [https://www.globalresearch.ca/afghanistan-forgotten-proxy-war/5676045](https://www.globalresearch.ca/afghanistan-forgotten-proxy-war/5676045)  [https://www.globalresearch.ca/afghanistan-is-right-here-lies-myths-and-legends/5602208?fbclid=IwAR2oABsn039WaSuVTou\_r0Vp3EutF8pirJ14vQ9d2I3Y-E2Fa7-YC2lBR70](https://www.globalresearch.ca/afghanistan-is-right-here-lies-myths-and-legends/5602208?fbclid=IwAR2oABsn039WaSuVTou_r0Vp3EutF8pirJ14vQ9d2I3Y-E2Fa7-YC2lBR70)  [https://www.revolutionarycommunist.org/asia/afghanistan/714-a-revolution-betrayed-frfi-166-apr-may-2002?fbclid=IwAR0OcTrYlfY1udN-kFH9ZiyWhQYNKAZebuI3NccVW4sp0wZSzjKNi5RwTVo](https://www.revolutionarycommunist.org/asia/afghanistan/714-a-revolution-betrayed-frfi-166-apr-may-2002?fbclid=IwAR0OcTrYlfY1udN-kFH9ZiyWhQYNKAZebuI3NccVW4sp0wZSzjKNi5RwTVo)"
Lanfranc_di_Cambria,2020-01-02 05:15:05,fctg1vc,t3_ei7el2,t1_fcsw15c,"Here is a quote from Afghanistan: A cultural and political history. It describes how the masses saw the Soviet regime and their opponents:  &gt;The international funders justified their support of the Afghan conflict in ways that had little relevance within Afghanistan. They portrayed the struggle in Afghanistan as a Manichaean conflict of competing ideologies (e.g., Islam versus atheism, socialism versus capitalism, freedom versus oppression, feudal reactionaries versus progressive patriots, modernists versus traditionalists).   &gt;Afghans never saw the war they were fighting in such black-and-white terms because politics in Afghanistan was less ideological and more personal. It was a world where yesterday's enemy might become today's ally, meaning you should take no one for granted.   &gt;The mujahideen parties, for instance, had good connections with Kabul government bureaucrats throughout the war and could generally get any information they needed from them. Such bureaucrats sent the message that no matter who held the top positions and set policy, they were the functionaries who kept a government running.   &gt;Defections from one side to another were based more on personal disputes and private interests than on any ideology. If a village son rose high in the PDPA's ranks, one could be sure that the district would throw its lot in with Kabul. If he defected or was purged, that district was sure to discover the merits of the resistance.   &gt;Even more common was spreading risk by placing different community members in rival camps to protect the group as a whole. At the national level, the philosophical differences between the resistance and the Kabul regime, which seemed so sharp when the war began, blurred with time.  It seems that *the masses* hedged their bets."
Sag0Sag0,2020-01-02 05:56:01,fctimsv,t3_ei7el2,t1_fct06by,Even anti soviet historians and analysts say that women being given the right to vote helped start the insurgency.
GhettoNeddo,2020-01-02 11:06:27,fctwjzm,t3_ei7el2,t1_fctimsv,"That’s not evidence that people supported the communist coup, which is what I’m asking"
Sag0Sag0,2020-01-02 12:13:49,fctzln1,t3_ei7el2,t1_fctwjzm,They weren’t responding to that. They were responding to your accusation that they were lying.
GhettoNeddo,2020-01-02 13:15:00,fcu2wt7,t3_ei7el2,t1_fctzln1,"Oh i see, still women were granted rights long before that in the 60s. I already proved that so the statement ""socailists gave women equal rights"" is still false"
Sag0Sag0,2020-01-02 13:20:18,fcu380j,t3_ei7el2,t1_fcu2wt7,"I don’t have any information on that so can’t respond.   However my guess is that those rights may have been more in theory than in practise, or they were optional so weren’t exercised much in practise."
flesh_eating_turtle,2020-01-05 02:16:27,fd6gdfw,t3_ek6a0o,t3_ek6a0o,"What do you mean ""refuse capital?"" It's impossible to avoid taking sides in this sort of conflict; attempting to remain neutral is just another way of complacently supporting your own government. Lenin wrote an entire piece dealing specifically with this issue:  * [Marxists Internet Archive | ""The Defeat of One's Own Government in the Imperialist War"" by V.I. Lenin](https://www.marxists.org/archive/lenin/works/1915/jul/26.htm)  As Lenin says:  &gt;Those who accept the “neither victory-nor-defeat” slogan can only be hypocritically in favour of the class struggle, of “disrupting the class truce”; in practice, such people are renouncing an independent proletarian policy because they subordinate the proletariat of all belligerent countries to the absolutely bourgeois task of safeguarding the imperialist governments against defeat. The only policy of actual, not verbal disruption of the “class truce”, of acceptance of the class struggle, is for the proletariat to take advantage of the difficulties experienced by its government and its bourgeoisie in order to overthrow them. This, however, cannot be achieved or striven for, without desiring the defeat of one’s own government and without contributing to that defeat.  During an imperialist war, a Marxist living in an imperialist country must support the defeat of their own government. To refrain from doing so is to take an essentially reactionary position."
Northernfrostbite,2020-01-05 02:24:14,fd6hei8,t3_ek6a0o,t1_fd6gdfw,All I see is dead people. And none of them are capitalists.
flesh_eating_turtle,2020-01-05 02:27:16,fd6ht0v,t3_ek6a0o,t1_fd6hei8,"No one is saying that you should *hope* a war occurs; the point is that if a conflict has to occur (which seems rather likely, given the current situation), a Marxist should take an anti-imperialist stance, supporting the defeat of their own government. We do not put the class struggle on hold in times of war; we continue and intensify it, even at the cost of our own country's war effort.  EDIT: Another good quote from Lenin's piece, which sums the issue up quite well:  &gt;Whoever is in favour of the slogan of “neither victory nor defeat” is consciously or unconsciously a chauvinist; at best he is a conciliatory petty bourgeois but in any case he is an *enemy* to proletarian policy, a partisan of the existing governments, of the present-day ruling classes."
Northernfrostbite,2020-01-05 02:34:40,fd6isry,t3_ek6a0o,t1_fd6ht0v,"I support the defeat of all governments.   Supporting Iranian theocrats is not supporting class struggle no matter what mental gymnastics you use to justify it. Defending the ""little guy"" nation state in foreign affairs is *not* defending working people.  &gt;""What if they gave a war and nobody came?""  -Bertolt Brecht"
flesh_eating_turtle,2020-01-05 02:41:02,fd6jnz3,t3_ek6a0o,t1_fd6isry,"I think this position is (to put it bluntly) short-sighted and dogmatic. When the world's largest imperialist power is bearing down on a less-powerful country (one which it has previously attacked numerous times, no less), refuting to support the smaller nation because we don't like its leaders is, in practice, a pro-imperialist position. Remaining neutral in a conflict with this sort of power imbalance is no better than giving your support to the imperialist power, just as refusing to take part in politics is no better than being a reactionary. If you refuse to *actively oppose* imperialism, then you might as well be supporting it.  Perhaps a historical example will clarify the point. Saddam Hussein was no great Marxist hero, but nonetheless, communists gave our solidarity to Iraq *against the imperialist invasion.* This is not because we all suddenly became Ba'athists; rather, it is because we oppose the actions of imperialist governments.  You say that you see too many dead working people? Well, so do we. That's why we oppose the imperialist governments who start the wars that kill them.  EDIT: You omitted the next line of that Brecht quote:  &gt;What if they gave a war and nobody came? **Well then, the war would come to you!**  Brecht supported the struggle against imperialism in his own time, despite his stridently anti-war views, because he understood that the end of war requires the end of imperialism."
Northernfrostbite,2020-01-05 02:44:09,fd6k4nq,t3_ek6a0o,t1_fd6jnz3,I disagree that the only way to oppose imperialism is to support the smaller capitalist nation. To think so is dogmatic.  The only way to oppose imperialism is to stop supporting all capitalist Nations. Everywhere.   You realize that with World War 3 we all end up dead right?
Kangodo,2020-01-05 02:46:27,fd6kigb,t3_ek6a0o,t1_fd6isry,"Oh, I am sorry. How exactly does it aid the working class if the entire world is suffering under a US dictatorship?"
Northernfrostbite,2020-01-05 02:48:31,fd6kug6,t3_ek6a0o,t1_fd6kigb,The Ayatollahs would like to take you somewhere.
flesh_eating_turtle,2020-01-05 02:50:50,fd6l7fq,t3_ek6a0o,t1_fd6k4nq,"As I've already said, nobody is saying that you should *hope* that a war occurs. The best-case scenario is that there is no war. However, if a war occurs, to refuse your support to the weaker nation when imperialists are attempting to crush it is to fail in our duty of solidarity to the oppressed.  Think of the logical extension of your position here. When Iraq was invaded, would you have advocated standing by and doing nothing? Or when the United States interfered in Libya to help overthrow Gaddafi, which led to the mass impoverishment and misery of the Libyan people; would you advocate neutrality on our part, because Gaddafi was not a Marxist? Nobody is saying that we have to love the Iranian government (I certainly don't), but to focus our criticism on Iran when they are being threatened with an all-out attack from the USA is counter-productive at the moment."
Kangodo,2020-01-05 02:54:12,fd6lrce,t3_ek6a0o,t1_fd6kug6,You did not answer the question.  How does it aid the working class to let the fascist US dominate the entire world?
Northernfrostbite,2020-01-05 02:54:32,fd6lt28,t3_ek6a0o,t1_fd6l7fq,"A good friend of mine's father was a leftist leader in the Iranian Revolution. After the revolution he was imprisoned and tortured by the Iranian theocrats. Yet, we're supposed to ""unconditionally support"" them now because they're fighting the US? Death to USA and death to Iran. That's what I'll work for."
Northernfrostbite,2020-01-05 02:55:35,fd6lzhw,t3_ek6a0o,t1_fd6lrce,Where did I say we should let fascist US dominate the entire world? I said people should refuse to support capitalists in their wars.
flesh_eating_turtle,2020-01-05 02:58:28,fd6mgmh,t3_ek6a0o,t1_fd6lt28,"&gt;Yet, we're supposed to ""unconditionally support"" them now because they're fighting the US?  Communists support Iran against the USA in the same way that we supported the USA against Nazi Germany. You don't *like* either government, but one is very clearly a greater threat to the oppressed people of the world, and to allow it to have its way with *yet another* country does not help anybody. Best-case scenario, there is no war, and the working people of both Iran and the USA rise up against their reactionary governments. But until that happens, the USA's warmongering has to be opposed.  &gt;A good friend of mine's father was a leftist leader in the Iranian Revolution. After the revolution he was imprisoned and tortured by the Iranian theocrats.  I've very sorry to hear that, but however much you hate the Iranian government (and however good your reason is for doing so), surely you can see that the USA currently poses a greater threat to the oppressed people of the world?  EDIT: The comrade below posted a good quote from *Foundations of Leninism* by Stalin:  &gt;It means that support must be given to such national movements as tend to weaken, to overthrow imperialism, and not to strengthen and preserve it.  We do not like or admire the Iranian government, but if it weakens imperialism and advances the struggle against capitalism, I don't see how a Marxist can take another position."
Northernfrostbite,2020-01-05 03:05:21,fd6no8d,t3_ek6a0o,t1_fd6mgmh,I'm not going to try to play the lesser of two evils game. It's suicidal.  This sort of geopolitical posturing amongst the Tankie left has time and time again proven to be a failure for people everywhere. To the point where we all face mass extinction and annihilation.
flesh_eating_turtle,2020-01-05 03:08:17,fd6o6tj,t3_ek6a0o,t1_fd6no8d,"When has this ""both sides bad"" faux-neutrality ever done any good? More over, when has the Marxist-Leninist position on this ever turned out to be wrong? Were we wrong in Iraq? Libya? Syria? Guatemala? Venezuela? Bolivia? None of these nations are Marxist states (four of them aren't/weren't even led by socialists), and yet when imperialism comes to their doorstep, we opposed it. We were proven correct *every time.* All of these nations have suffered tremendously from US imperialism."
Northernfrostbite,2020-01-05 03:17:07,fd6pr4y,t3_ek6a0o,t1_fd6o6tj,"Is it possible to oppose imperialist wars without supporting Sadaam, Gadahffi, Assad, etc?   I'm not gonna pick a side. I'm gonna work to undermine the society that gives rise to such a false premise in the first place.  I suppose you're free to join the Iranian foreign legion or whatever. You know.... it'll advance communism and stuff."
flesh_eating_turtle,2020-01-05 03:19:06,fd6q3b7,t3_ek6a0o,t1_fd6pr4y,"&gt; Is it possible to oppose imperialist wars without supporting Sadaam, Gadahffi, Assad, etc?  I'll put it simply. When the USA invaded Iraq, who did you want to win? Don't say nobody, because that's an impossible position (*somebody* has to win, so to wish that nobody would is just delusional). We ""tankies"" hope that the USA *loses* this war, just as we hoped it would lose all the others."
Northernfrostbite,2020-01-05 03:34:16,fd6srgi,t3_ek6a0o,t1_fd6q3b7,"Humanity won't be free until the last theocrat is hung with the guts of the last capitalist.  Choosing sides in a war in which ordinary people die for insane rich people doesn't achieve anything for a free society.  Is the game to choose for Iraq/Iran or the USA, or to choose for humanity over Capital?"
RedWingedKea,2020-01-05 04:17:10,fd702go,t3_ek6a0o,t3_ek6a0o,"No one is endorsing the Iranian state here. Its just that criticism *at this time is not useful* and is actually harmful as it helps to justify western intervention. It doesn't matter that Iran is bad. What matters is that the US is trying to overthrow their government, and an overthrow of the Iranian government by the US would be very bad for the people of Iran, just look at Afghanistan or Iraq for examples."
flesh_eating_turtle,2020-01-05 04:39:13,fd741ik,t3_ek6a0o,t1_fd6srgi,"&gt;Humanity won't be free until the last theocrat is hung with the guts of the last capitalist.  It's a good sentiment, but this is no reason to remain neutral while the USA bears down on another nation. As one comrade over on r/moretankiechapo put it:  &gt;As an Iranian I like many of my fellow compatriots do not consider the government legitimate and consider it brought up by the US to protect its interests against the Iranian proletariat as has been evident by the regime's behavior since the overthrow of the shah till the recent protests which met fascistic crackdown. HOWEVER, we will definitely not consider US occupation a better alternative and will fight to the death to keep US troops off our land.  The USA is not a liberating force, and our dislike for the Iranian regime is not an excuse to sit back and allow imperialism to claim more victims."
thewrench01,2020-01-05 04:41:05,fd74cir,t3_ek6a0o,t3_ek6a0o,"I don’t support Iran, I just don’t support war. That unconditional attack by the United States was a cowardice move that genuinely should be looked down upon by the globe. Iran is not good, but the United States is even worse. Unconditional support is too much to ask for, though I do see where they’re coming from"
Northernfrostbite,2020-01-05 04:45:13,fd750ef,t3_ek6a0o,t1_fd741ik,"Once again, you're creating a Strawman:  I never suggested the US would be a liberating force and I never suggested sitting back and allowing a US attack.  I do suggest international revolt against capital and refusing to side with Fascist governments. I suggest opposition to the US government, Iranian government and all States.  I assume that you believe not supporting Iran is defacto supporting the US war. In fact I suggest it's possible to oppose both in the name of humanity. You have not suggested a logical reason, IMO, of why that's not a valid option."
