author,created_utc,id,link_id,parent_id,body
theimmortalgoon,2020-01-09 08:41:42,fdmpf5z,t3_em5ewl,t3_em5ewl,"A few things to remember:  1. Bourgeois systems took centuries to take hold. In retrospect, when we look back at times when it seemed in place and inevitable, it was shakey. The English Civil War and French Revolution we’re both folded back and beaten down. We know now that the damage was done and can see what happened, but if you grew up in either of the restorations the idea that you were going to go back to feudalism would have seemed possible and the republican experiment being an American novelty that failed within a decade would seem downright likely.   In hindsight this period of time is almost invisible though. The match of history goes on.  2. Related and more direct to the question, at the moment it seems that socialism has stalled because it didn’t internationalize (same as the bourgeois revolutions above). Marx, Engels, and Lenin (among others) all expected a global revolution in one form of another. And they were wrong to do that. Germany, France, Ireland, Spain, Hungary, just about every country in Europe had a communist revolution in one way or another during or just after the Russian Revolution.  China, Vietnam, Central and South America, Africa, the Islamic World, it was (is?) a movement that went global.  We can (and do) nitpick about the utility of what should have been done when Germany and other big countries didn’t fall quickly. But in the broad spoke of history, the global movement cements the revolution.  It may have seemed to have failed now...as did capitalism, feudalism, and every other system that developed.   As for the West today, just remember the most backward, religious, rightwing and restrictive system in Europe ended up leading the communist revolution in a completely unforeseen way. We can’t count on this though, so we must study, organize, write, build, unionize, and spread the world. We have nothing to lose, after all."
Samehatt,2020-01-09 09:18:13,fdmr08t,t3_em5ewl,t3_em5ewl,What about organizing first?
bhenck123,2020-01-09 09:59:32,fdmsrnn,t3_em5ewl,t3_em5ewl,"&gt;The abolishing of the law of value  What law of value? Marxist tend to used labour theory of value... In capitalist doctrine, there is no value, there are just two line meeting on a plot.  &gt;Is the state supposed to wither away in a generation? How about in 2?  Clearly the socialist experiments since the 20th century have told us  the answer.  It cannot wither away if there is a capitalist imperial nation with a military willing to destroy you. Therefore the 20th century does not really tell us much about how the process from socialism to communism would look like.  &amp;#x200B;  &gt;How could the state wither away, and with it class distinctions, if the  threat of nuclear war looms and constant sabotage in basically all  strata of society persists?  It cannot... But I think you are using some historical picture which uses hindsight to justify that it always had to fail. Post '45, many billions lived in socialist countries of varying degree. Everywhere from Latin-America, Africa, also western Europe (Italy, Portugal, France (?)) to most of asia had communist parties, revolutions or forms of socialist states.    Yes, in hindsight the critical mass was not reached and western empires came out successful, but this was in no way necessary..    I would argue that without the sino-soviet split and thus a united anti-capitalist movement spanning most of the globe, the discussion today could be much different..."
Scum-Mo,2020-01-09 10:53:16,fdmv335,t3_em5949,t3_em5949,either or both is the same thing
Xx_JUAN_TACO_xX,2020-01-09 12:03:54,fdmyjwk,t3_em4o07,t3_em4o07,"If I abduct you and let you choose between 2 hour of torture, and 3 hours of torture, is it malign to torture you even if you agreed to be tortured for 2 hours only ?"
AriAncom,2020-01-09 13:17:35,fdn33nr,t3_em5ewl,t3_em5ewl,"In the modern world any communist revolution necessarily must start with the USA and its allies, and have the immediate goal of incapacitating the CIA and the American-based global corporations which orchestrate counter-revolutions whenever they see a need.   I would also personally recommend skipping the authoritarian section of the path to communism due to its tenacity against “withering” and general harm to the population (yes it is a lesser harm than capitalism, but that doesn’t mean it isn’t a problem), and skip straight to a classless moneyless society.   Workers’ Parties will always lead to a form of class division growing between the upper echelons of the party and the proletariat, unless so much power is stripped from the Party and given to the people that the Party becomes obsolete.   (Also side note why do people keep referring to the post-revolutionary population as “workers”? Couldn’t we just be people? If the term  doesn’t become obsolete after the Revolution then really what’s the point?)"
Kangodo,2020-01-09 14:05:51,fdn6ntd,t3_em4o07,t1_fdmyjwk,"Thank you, I wanted to make an analogy with getting kicked in the balls or hit in the face. But this is pretty good too."
Kangodo,2020-01-09 14:21:26,fdn7wab,t3_em5ewl,t3_em5ewl,"How long did it take for slave empires to change to feudalism, how long did it take feudalism to change into capitalism? And how long has it been taking capitalism to be replaced by socialism?  It will take a long time for communism to replace socialism and I doubt any of us can make a good prediction of how it will turn out to be.  &gt; But how, in any reasonable way, can socialist experiments achieve communism with the power of capital and imperialism in every space that has a shade waiting to pounce?  As long as the ruling powers in the world are capitalists, the socialists cannot achieve communism.  That's like expecting capitalism to turn into socialism while the power is in hands of feudalists.  Let's not forget that feudalism started to decline only after the French and the British turned into capitalist powers."
teasers874992,2020-01-09 15:56:37,fdngnaz,t3_em5949,t1_fdmgs01,It’s called communism. State owned not worker owned. Workers don’t own anything
doubledead22,2020-01-09 16:02:32,fdnh8dc,t3_em5ewl,t1_fdmsrnn,"Are we not trying to reach a society without money? Then at some point in the future the law of value must disappear for money to disappear.  Capitalism is way more complex than you are saying. I suggest trying to read Das Capital if you want to understand capitalist production better.  I agree with you, for the most part. In retrospect things were doomed to fail but at the time things probably seemed like communism was on its way.   We shouldn’t see this as a failure of socialism, rather we should see it as the temporary victory of capitalist propaganda."
doubledead22,2020-01-09 16:06:38,fdnhmyc,t3_em5ewl,t1_fdn33nr,"So how do we skip immediately o communism without some form of revolutionary phase which shapes people into the new society? Are we supposed to raise a red flag and then just hope for things to wither away by themselves, seriously asked not trying to sound like a dick."
doubledead22,2020-01-09 16:14:12,fdnieb0,t3_em5ewl,t1_fdmr08t,I live in USA and socialist parties here are fairly small. The only Americans who had the chance to organize socialism on a wide scale were killed off in the late 1800’s and early 1900’s.
Lemongrabsays,2020-01-09 16:14:34,fdnifmy,t3_em5949,t1_fdngnaz,oh no not gommunizm
spookyjohnathan,2020-01-09 16:17:40,fdniqvh,t3_em5949,t3_em5949,"We don't have to confiscate literally any property. You may think it's debatable whether it's justifiable to do so, but it's not even necessary, and the result is the same for the bourgeoisie one way or the other.  Our goal, and our right, is to build a socially owned means of production for the working class to use to work for themselves. It's our right because the public has the right to use public resources to build something for themselves, including a means of production so they can work for themselves, just like we build public education to educate ourselves and security and defense to defend ourselves.  If the workers have the choice to work for themselves on the socially owned means of production and keep the fruit of their labor to themselves, they'll never have a reason to choose to work for a capitalist on his private means of production and share their labor with him.  The end result, one way or the other, is that the capitalist will go out of business and his formerly private means of production will be redistributed.  No one's going to work for capitalists when they can choose to work for themselves.  Now, capitalists might use their privately owned means of production to work for themselves, and that's fine; after the revolution, socialism doesn't have a lot to say about petit bourgeoisie and personally I don't think many people care. The goal is to create a means of production for all the people who don't have a choice, not to take your means of production away from you."
McHonkers,2020-01-09 17:01:18,fdnn6ew,t3_em5949,t1_fdmgs01,"Well actually...  &gt;""... It must be pointed out that the 'actual seizure' of all the instruments of labor, the taking possession of industry as a whole by the working people, is the exact opposite of the Proudhonist 'redemption'. In the latter case the individual worker becomes the owner of the dwelling, the peasant farm, the instruments of labor; in the former case, the 'working people' remain the collective owners of the houses, factories and instruments of labor, and will hardly permit their use, at least during a transitional period, by individuals or associations without compensation for the cost. In the same way, the abolition of property in land is not the abolition of ground rent but its transfer, if in a modified form, to society. The actual seizure of all the instruments of labor by the working people, therefore, does not at all preclude the retention of rent relations.""  - Frederick Engels, The Housing Question. Quoted by Lenin in state and revolution."
McHonkers,2020-01-09 19:39:44,fdo4kfn,t3_em5949,t1_fdmk7x9,"Because we don't give a single fuck about individual cases. We care a about systematic structure.  How the fuck do you think you could reliably enforce a case by case evaluation of how just or unjust you use you private property.   Yes it all sounds nice puffy all the... 'but what ifp i'm fucking Jesus who only works my factory myself and i'm also shitting out surplus value that is healing the blind.'  And you know... Maybe you are. Maybe it would be fine if *you* can keep your private property. But then what about the next 500 million people that want to keep their private property. I guess we have to allow that to since we took your word for it.  Oh now, we also have 500 million people competing for being the best little Jesus that heals blinds people with the surplus value their privately owned and self operated factory are shiting out.  It. Is. Not. About. Your. Individual. Story.  You aren't the main character of a movie. You are just a  tiny tiny tiny tiny tiny barley noticeable part in incredible complex and gigantic system. And for the sake of the best achievable happnies and dignity for very tiny tiny tiny tiny barley noticeable part in the machinery... Not a single one can keep private property."
Samehatt,2020-01-09 19:44:03,fdo533h,t3_em5ewl,t1_fdnieb0,The socialist parties can organize though
MarxistLeninism2050,2020-01-09 19:46:14,fdo5cr9,t3_em5949,t3_em5949,"In the Soviet constitution, besides the two forms of socialist property (state enterprise and worker collectives) there was also allowed self employed people who owned and used their own small means of production, as long as they didn’t exploit the labor of others. But the description you gave above is impossible.  You physically cannot mine the metal, refine it (and build the mill to refine it) build a factory and machines with it, and work the machines by yourself. Labor in industrial society is by is nature collective labor, you are not a superhuman"
Sedan_Wheelman,2020-01-09 20:36:06,fdobglm,t3_el7jy2,t1_fdgx6oz,Welcome to capitalism. lol
AriAncom,2020-01-09 21:15:16,fdog87v,t3_em5ewl,t1_fdnhmyc,"If you’re able, you should have a read of The Conquest Of Bread by Peter Kropotkin (the title of which is where words such as “breadtube” and “breadpill” come from. The Ebook is free at most Ebook stores, and the audiobook is free from LibriVox). Kropotkin argues that in the event of a revolution, the most important goal (in joint with putting down the ruling class and their dogs) is to guarantee the means of comfortable living for the revolutionaries. This means that the bakeries (hence “conquest of bread”), the looms, the farms, the butchers, the mills, must all be liberated and immediately be given to community ownership that none will go hungry as the revolution wages, and the communal (not state) ownership of the means of production and all that is produced must continue from the start of the revolution, to the establishment of a communist society, and beyond.   I can’t remember if Kropotkin mentions this, but many people agree that the best way to shape society would be for everyone to sort themselves into communes of 100-500 people, who then collectively own their local means of production and share what they don’t need with their neighbours and the rest of society. Each commune would manage its own militia, who would also manage disaster response, and collaborate with other militias in times of crisis. Each commune would be managed through direct democracy, and send delegates (not to be confused with representatives in the current sense) to regional assemblies when necessary, who would send delegates to continental assemblies, etc.. There would also likely be smaller councils on various scales to address the concerns of various minorities, in case of oppression.  I hope that this has answered your question satisfactorily"
doubledead22,2020-01-09 21:29:34,fdohpun,t3_em5ewl,t1_fdog87v,"I’ve heard of him and I can’t say I’ve read much of his work. All I know is “read the bread book” lol  The model described sounds like it would eventually fall apart on large scales though. The various communes would contain diverging political lines or no political lines at all, so no eventual goal for society will be set. What if militias can’t be raised? What if a commune with no militia gets raided by another commune, who will step in to stop it?  This reminds me of the anarchist model in Spain during the civil war. At the beginning the various workers councils and factories were disorganized and often would end up producing too much of something because the other factory 4 miles away would make the same commodity, there wasn’t communication at times between the collectives, and sometimes workers of a factory wouldn’t care about anything beyond the factory, their workplaces are what mattered. In such a situation, some kind of centralized organs needs to be present to help organize everything.   Workers councils are great on small scales, but they work even better with a state."
AriAncom,2020-01-09 23:04:43,fdor7xw,t3_em5ewl,t1_fdohpun,"The point is that the councils on the larger scales would replace states, and provide the organisation you’re talking about. To a great degree modern technology will also greatly facilitate such organisation, and unions among similar workplaces will also facilitate cooperation and organisation between workplaces to make sure that work is equally distributed and not over-or-underproducing. Saying that Catalonia didn’t work so council communism wouldn’t work is like saying that the USSR collapsed so state communism wouldn’t work. Mistakes were made, but those are mistakes we can learn from  In regards to your problems with militias, if a commune democratically decides to not have a militia it’s their choice, but they’d likely be pressured to provide some other service to replace it, such as a hospital, or a detainment and treatment facility for people who are unable to safely interact with society. And why would one commune attack another? They’d be able to get anything they need just by asking, and proper education would counter the possibility of bigoted violence. And even if one commune did attack another, there’d be immediately embargoed by the rest of society, and the commune would likely be broken up, the members distributed to many other communes, and the instigators would be assessed for any further danger to society. I can’t see inter-communal violence being treated lightly   And the whole scale argument is rubbish, what do you even consider small scale? 100? 1,000? 10,000? 100,000? 1,000,000? Where does the idea begin to break down? Why does it break down there and not before or after? It’s exactly the same as the bourgeoisie argument that communism as a whole is a nice idea on small scales and becomes totalitarian if it’s implemented on a larger scale, except that you’re substituting totalitarianism for state communism. It doesn’t actually mean anything and the only evidence supporting it is that previous attempts made mistakes"
doubledead22,2020-01-09 23:20:41,fdosqti,t3_em5ewl,t1_fdor7xw,"I didn’t say Catalonia didn’t work, I just said at the beginning they had problems. The anarchists became more efficient as they centralized, as evident by many workers who began to complain later on that the CNT acted more like a state in itself and it became almost impossible to voice concerns to the elected administrators.   “Why would one commune attack the other?” Because conflict is inevitable, doesn’t matter how cheerful our slogans are my guy. The actions in case such a thing were to happen would be mediated by a central force which would decide what to do with the perpetrators, investigate, aid victims. A state.  The “rubbish” of the large scale argument was fixed when anarchists began consolidating their councils into state-like organs."
AriAncom,2020-01-09 23:51:46,fdovn0z,t3_em5ewl,t1_fdosqti,"As I said, the large scale councils would take the role of a state, and do all of the organising necessary to keep society functioning smoothly that can’t be done at smaller scales.  Are you really claiming that lack of accountability for elected officials is a good thing?? Wtf??   That’s a really depressing view of humanity. I’d argue that conflict is only inevitable where patriotism, bigotry, or unmet needs exist, which are all things that a communist society should avoid as a priority.   And you didn’t actually address my critiques of the scale argument, you just said that Catalonia fixed the problem you had with it"
doubledead22,2020-01-10 00:20:43,fdoyad6,t3_em5ewl,t1_fdovn0z,"Not claiming lack of accountability is good, just showing how rigid the councils became within the span of 1 year but they did become efficient.   Well, we would have to look at individual cases, unique material conditions, resources, but I believe the number of communes isn’t the right question, it’s the number of councils/communes and their diverging political lines and the lack of a singular goal for society holding everything together.  For example, say we have 10 workers’ councils operating but they are all working and producing under a single party line. Things would run smoothly here, in theory. Everyone is on the same page.  Now say you have 10 workers’ councils with 10 different political lines, but on top of that inside the councils the workers themselves have various ideologies or no ideologies at all. That one would seem extra tricky. Now imagine 100 councils with diverging political lines. Now 1000. 10000.  That is the case of the early anarchist experiments during the civil war. Over time they realized they had to consolidate power. My point is we all need the state in one way or another after the revolution, it works."
SvarogIsDead,2020-01-10 00:31:33,fdozadb,t3_em5ewl,t1_fdnbk1d,"&gt; And every day, existing infrastructure and institutions exist to validate and re-entrench their beliefs.   How so?"
TBTPlanet,2020-01-10 01:22:39,fdp3udg,t3_em5949,t1_fdo4kfn,"What I've been able to deduce out of your (fairly disorganized )argument is:  1) Collective punishment, as in seizing the means of production from all capitalists because a majority use them or will use them for exploitative purposes is justified, and  2) People who use their private property to better themselves and others cannot be distinguished from people who use their private property to exploit their labourers."
TBTPlanet,2020-01-10 01:26:45,fdp47hp,t3_em5949,t1_fdmlbuc,"If I were to (hypothetically speaking) be skilled enough to do the amount of work two people could do as one person in the same amount of time, then I would (theoretically) be throwing somebody else out of work. Would this be punishable? Also, would the primary objective of state-operated factories be to employ as many people as possible, or to create more profit to better the lives of the already employed labourers?"
kingsuperbop,2020-01-10 01:31:19,fdp4ma2,t3_em5949,t1_fdnn6ew,"That's why this is that autistic type of scenario that is literally not ever going to happen, so trying to imagine what philosophers hundreds of years ago might think about it is incredibly ridiculous. Marxists need to stop thinking the man (and Engels) wrote scripture. So fucking dumb. I answered the guys question is philosophically succinct way which just shows that his hypothetical is silly. In reality, a new socialist system would be just that...NEW. Of course we should learn what the original vision of communism was, but there is absolutely no reason we should force it to apply to our modern time, especially when we are not even there yet to begin with, still doing retarded hypotheticals on the internet instead of actually doing the work of revolution."
flesh_eating_turtle,2020-01-10 01:54:53,fdp6qal,t3_em5949,t1_fdp47hp,"No, you would not be punished for being productive, nor would you be throwing somebody else out of work. The reason why socialist economies did so well in times of labor surplus (Robert Allen from Oxford did good work on this) was that they could employ people according to plan, rather than market dynamics.  The primary goal of socialist production is to meet human needs. This is done by setting plans, and working to fulfill them."
AfredPeek,2020-01-10 02:10:12,fdp83ua,t3_emjxyg,t3_emjxyg,"the revolution wont win until the masses are already on the side of socialism. red authoritarianism wont do anyone any favors in getting those still on the fence to come over it. look to the fall of the ussr, yes the west certainly had a driving force in it, but shit like the warsaw pact invasion is unacceptable. in other words, tankies bad, true democracy good."
doubledead22,2020-01-10 02:22:03,fdp95tw,t3_emjxyg,t1_fdp83ua,"What happened in eastern bloc is interesting. You have USSR in principle communist but “acquired” land after beating the nazis. So the communists propped up workers parties in all the acquired lands and tried helping the growth of workers’ soviets that way.  It didn’t work so well, I think socialist organization springing up organically is easier to hold on to then whatever organization comes about by intimidation. More importantly I mean a foreign country is exerting power over your country and way of life, everything from the start had a bad taste.  This explains why Russians tend to have a favorable view of the soviet era while most former blocs don’t. The reason being because the structure of soviet democracy existed in Russia before 1917, it was something that had been agitated by the Russians and had time to mature."
newnote713,2020-01-10 02:22:11,fdp96bl,t3_emjxyg,t3_emjxyg,"I mean like prisons are still inhumane tho, and like i dont think its a good strategy to get people to like your new rad society by imprisoning them. Sure you could say its for the better good but if their material conditions get worse then they just think youre bullshitting anyway. Maybe you could say theres no better way, but that doesnt change the fact that this way is still doodoo.   Especially when we think about socialism in the future i think we should try to think of better ways to do these things than just throwing them away in a prison because this undermines the revolution. Whats the fucking point of throwing a revolution if were just going to recreate a good amount of the same problems of the previous society.   I think one of the goals of the new society especially with our current material conditions is to make the most people free possible or were doomed to failure. Make less things illegal, and make peoples lives better (which we could do now with an essentially post scarcity world), integrate everyone into the communites they live in, and the stubborn bourgois who still get angry you can separate from the general population and just let them hang out. Say what you will about the nordic model of social democracy but the prison reforms they did are objectively amazing. We dont really need to have them do forced labor (essentially making us slave owners) because we dont really need that much labor in general now, so why not just let them hang out and eventually (hopefully) understand that this new society is good if it treats its prisoners so well."
