author,created_utc,id,subreddit,title
GhettoNeddo,2019-12-31 19:16:48,ei7el2,DebateCommunism,Is there any evidence that the people of Afghanistan supported the Communist Coup and new government
Northernfrostbite,2020-01-05 01:59:09,ek6a0o,DebateCommunism,"Bans for ""anything other than unconditional support for Iran?"""
TBTPlanet,2020-01-05 05:29:13,ek8p9v,DebateCommunism,Do the means justify the ends?
Diazepapst,2020-01-07 06:18:50,el7jy2,DebateCommunism,I am inheriting an apartment and becoming a landlord. What do I do?
periodicchemistrypun,2020-01-07 18:32:38,elfiyz,DebateCommunism,Do people here believe American prisons can be equated to gulags
TBTPlanet,2020-01-09 04:35:01,em4o07,DebateCommunism,"Do communists believe that all exploitation (as in: paying someone for less than the value of what they produce) is malign, even if it is 100% consensual?"
TBTPlanet,2020-01-09 05:30:41,em5949,DebateCommunism,"Do communists believe that all of the means of production should be seized, or only those which are used to exploit workers?"
doubledead22,2020-01-09 05:46:20,em5ewl,DebateCommunism,Why we never achieved Communism
doubledead22,2020-01-10 01:53:49,emjxyg,DebateCommunism,Gulags are a good thing
doubledead22,2020-01-12 00:22:39,enfxyp,DebateCommunism,The rate of profit and its apparent fall
