author,created_utc,id,link_id,parent_id,body
kad24601,2020-01-07 08:06:08,fdg8dtw,t3_el7jy2,t3_el7jy2,Is living in the apartment yourself not an option? Private property and Personal property are two different things.
Diazepapst,2020-01-07 08:06:59,fdg8f7l,t3_el7jy2,t1_fdg8dtw,No it unfortunately isn't. The apartment is in Germany and I live in Austria where I've built up my life and don't want to give that up...
kad24601,2020-01-07 08:12:57,fdg8pgy,t3_el7jy2,t1_fdg8f7l,"Maybe you could charge rent and donate the money to the poor?   I'm not sure if that's exploitation, but it's certainly a form of wealth redistribution."
Diazepapst,2020-01-07 08:16:30,fdg8v9t,t3_el7jy2,t1_fdg8pgy,That is probably a viable option :)
alixoa,2020-01-07 08:19:11,fdg8zlj,t3_el7jy2,t3_el7jy2,Use the money for communist groups.
Devin_907,2020-01-07 08:30:19,fdg9hpp,t3_el7jy2,t1_fdg6r6m,"only barely, landlords are motivated by the profit motive and are incentivized to push their tenants to the financial brink to get as much money as possible just like any other business."
Devin_907,2020-01-07 08:30:57,fdg9iqt,t3_el7jy2,t1_fdg7ow0,that is an interesting proposal
Devin_907,2020-01-07 08:32:45,fdg9lkv,t3_el7jy2,t1_fdg8pgy,"it would be wealth redistribution only if he rented out the house to a member of the bourgeoisie...though they tend to own their homes. someone else mentioned finding a rich college kid to rent it out to, but i like the idea of renting it out at cost to comrades a bit more."
3bdelilah,2020-01-07 08:35:12,fdg9pei,t3_el7jy2,t3_el7jy2,"&gt;If I just sell it then some other person will exploit the renter...  That's the biggest reason why I'm very reluctant to call people in your situation class traitors (meaning socialists suddenly finding themselves in ultra-capitalist circumstances). If it's not you, it's someone else who probably gives little to no shit about the tenants.  More specifically what you could do is try to be as reasonable as you possibly can. Since you claim to be in debt, the money will be of use to you, and I doubt you'd sit on it hoarding it. However, when you're debt-free and live off a decent income, you could consider lowering the rent for your future tenants (or at least not unreasonably increasing them), prioritizing society's marginalized people searching for housing, or overall just making the entire experience better than many landlords that crack down on the tenants."
MadLadThatsATadRad,2020-01-07 08:44:01,fdga3ba,t3_el7jy2,t1_fdg7jp8,"Good point. I wish you best of luck, comrade"
Diazepapst,2020-01-07 08:46:07,fdga6nt,t3_el7jy2,t1_fdg9pei,Thank you! I've thought something along those lines as well. If I should make a profit after I'm debt-free I would put the money to a good cause such as funding my local communist party.
Diazepapst,2020-01-07 08:46:34,fdga7gb,t3_el7jy2,t1_fdga3ba,Thank you comrade :)
prohibitedmeatbag,2020-01-07 08:47:44,fdga9am,t3_el7jy2,t1_fdg46pv,Why rent at all? You can probably work with a charity to use the house for charitable purposes.
Diazepapst,2020-01-07 08:53:46,fdgairx,t3_el7jy2,t1_fdga9am,I would be fine with that but I will have to check out the laws and my options. The Apartment is in a bigger Apartment complex and somehow I doubt that they would just be cool with that.
Diazepapst,2020-01-07 09:10:53,fdgb8mh,t3_el7jy2,t1_fdg9lkv,"Posting an Ad saying ""looking for a rich kid"" would be pretty funny..."
g_squidman,2020-01-07 09:11:24,fdgb9dn,t3_el7jy2,t1_fdg6r6m,"It's complicated. I have some friends who want to become landlords. They also want to start a business, a nuclear holocaust, the zombie apocalypse, win the lottery, move to the middle of nowhere and live off the land, develop superhuman abilities, get an expensive and difficult degree, invent something that will change the world... They just bounce from one fantasy to another, whatever will get them to escape capitalism.  But not all landlords are these individuals who got enough to buy extra property. Everywhere I've rented was owned by a real estate investment corporation. At some point, that human element gets removed."
420ohms,2020-01-07 09:29:39,fdgc0q6,t3_el7jy2,t3_el7jy2,Do you know anything about the neighborhood? What does it need? Maybe find some lovely anarchists to rent it to for below market rate?  You have been given power over land for no good reason. I think would be foolish to waste it purely on principal.
Diazepapst,2020-01-07 09:42:54,fdgck59,t3_el7jy2,t1_fdgc0q6,I agree! I know it's a very expensiv neighborhood and I've had the thought of advertising for it to comrades in the local communist party and rent it out at the lowest possible price. There are also still quite a few Syrian and Afghan refugees in the area that I would like to rent it out to but that might not be possible due to their status. I will check out the laws on that.
420ohms,2020-01-07 09:47:52,fdgcrcb,t3_el7jy2,t1_fdgck59,&gt; might not be possible due to their status  The secret ingredient is crime :P
Diazepapst,2020-01-07 09:50:43,fdgcvg5,t3_el7jy2,t1_fdgcrcb,"A few years ago I would totally agree with you and I used to do things that would not be accord with the law but now I'm old, in a serious relationship with a child and I have a job that I can't lose because if I did that would threaten my existence. I can only act within the confines of the stupid fucking laws that capitalism has laid upon us :("
smile-bot-2019,2020-01-07 09:50:45,fdgcvih,t3_el7jy2,t1_fdgcvg5,I noticed one of these... :(      So here take this... :D
DanelRahmani,2020-01-07 09:51:06,fdgcvzx,t3_el7jy2,t1_fdgcvih,I saw a :( so heres an :) hope your day is good
DanelRahmani,2020-01-07 09:51:12,fdgcw4q,t3_el7jy2,t1_fdgcvg5,I saw a :( so heres an :) hope your day is good
420ohms,2020-01-07 10:01:39,fdgdb93,t3_el7jy2,t1_fdgcvg5,I understand this more and more every year I get older and progress in my career and life. I appreciate you.
Diazepapst,2020-01-07 10:08:14,fdgdkwj,t3_el7jy2,t1_fdgdb93,Aww thanks comrade! I appreciate you too! :D
DogeGroomer,2020-01-07 10:09:03,fdgdm4m,t3_el7jy2,t1_fdg8cs4,Except it’s not
ExcaliburClarent,2020-01-07 10:17:54,fdgdzif,t3_el7jy2,t3_el7jy2,Turn it into a co-op
gemandrailfan94,2020-01-07 11:08:40,fdgg671,t3_el7jy2,t1_fdg7ymq,Take that everyone who says socialism kills innovation and ideas!
embership,2020-01-07 11:40:42,fdghop8,t3_el7jy2,t3_el7jy2,"Only charge renters enough to break even. In other words, only charge enough to abide by your tax obligations for the property and maintenance obligations.   And constantly think of ways to make staying there less expensive for the renters...like encouraging off grid solutions."
Jmlsky,2020-01-07 12:25:07,fdgk24n,t3_el7jy2,t3_el7jy2,Why don't you simply move in ??
Diazepapst,2020-01-07 12:27:12,fdgk6j0,t3_el7jy2,t1_fdgk24n,"I live and have built up a life for myself about 700km away. Job, girlfriend and her son are here and I highly doubt they'd wanna move. I really don't want to, I'm happy where I am."
nicholasss008,2020-01-07 12:35:58,fdgkp73,t3_el7jy2,t1_fdg6dzu,"Don't put it at a price that's too high, don't be like the other greedy landlords that cooperate in pushing prices higher."
Jmlsky,2020-01-07 12:36:49,fdgkqyz,t3_el7jy2,t1_fdgk6j0,"Ok I thought it wasn't feasible but just wanted to be sure.  Indeed I see your dilemma.  Comrade as a French what advice I could give you is to rent it, here we have a huge problem with unrent empty building when there are plenty of homeless people and it is a shame, especially in this cold time.  What would be my best advice is to find a poor family or people who don't have the usual requirement to have access to housing, and rent them. This way you will at least help people who are in need. Just be sure to find someone who deserve it, especially if you take the risk for them. And do it only if your own income don't depend of this rent, but I guess it doesn't ?  For real, housing become a problem for a lot of people, especially the younger people who don't have enough guarantee to afford a housing. There are too much people working and sleeping in their cars because of some formality bullshit.   Anyway you're already a better landlord than most of the other just for asking yourself this kind of question.   Wishing you the best comrade"
Dog_--_--,2020-01-07 13:42:35,fdgp4a4,t3_el7jy2,t1_fdgairx,"Yeah, sadly some people get way too upset when others just try and help people down on their luck. Power to you, and good luck getting it sorted mate."
ian3harris,2020-01-07 13:46:23,fdgpebp,t3_el7jy2,t1_fdg8cs4,The fact that you compare raping your slaves to being complicit bin capitalism shows how you have no clue what you’re talking about
ExtensionPassenger,2020-01-07 13:49:24,fdgpmcd,t3_el7jy2,t3_el7jy2,"It's true that Engels was an industrialist and whatnot, and it's true that somebody else would be renting it if you weren't. That being said, I would still sell it if I were you, and then I'd donate the money to the party I support. That's not because I think the situation will be better if somebody else is renting it out, but because I realize that objective reality determines consciousness and I would rather maintain as proletarian a lifestyle as possible for that reason.  Additionally, we should account for the fact that the bourgeoisie in Engels's time, and particularly in a relatively backward nation like Germany, was much closer to a period in which it still had a progressive role to play. Marx and Engels lived through, and participated in, the bourgeois-democratic revolutions of 1848. That being said, I certainly don't think you'll automatically be a bad person if you rent it out."
ian3harris,2020-01-07 13:50:48,fdgpq1x,t3_el7jy2,t3_el7jy2,"I know I’m late but here my two cents. As the saying goes there is no ethical consumption under capitalism, in fact anything you do under capitalism is by nature unethical. Technically speaking you now are a class traitor, but not in the way you think. By owning private property that you will lend out for profit you are no longer a proletariat. So long as you continue being a leftist and make life not shit for your tenants then “your soul is clean”"
Augustinus77,2020-01-07 14:13:04,fdgrfg2,t3_el7jy2,t3_el7jy2,"You could rent it non-profit, or like fifty bucks a month for you so you get at least something, because the management will cost some time and you are in debt."
Zeikos,2020-01-07 14:34:49,fdgt6jt,t3_el7jy2,t1_fdgck59,"Be careful about excessive undercutting, some countries (mine for instance) assume you're evading taxes and getting paid a portion of the difference on the side.    It's a complicated mortal stance to take, be mindful of the economic context you're getting involved in.    By the way, I'll eventually be in the same boat you are on, my mother is a landlady (it's inheritance going three generations back).   Be respectful of your tenants, do keep the place up to standards and be kind.    As other stated, selling doesn't really accomplish much, you'll end up transferring the property to somebody else that will mostlikely rent it themselves (and then you still run in the issue of what doing with that money, if you invest it you are in the same ethical dilemma)."
treebodyproblem,2020-01-07 14:46:09,fdgu47v,t3_el7jy2,t3_el7jy2,"Perhaps you could talk to your tenants about forming a co-op to buy the building from you.   You could probably work out a kind of financing scheme where you sell them the building by lending them the money on paper. Then they can continue to make payments in the short term as loan payments instead of rent and eventually own it outright. Of course, some of the “rent” needs to be kept by the cooperative for maintenance.  IANAL and I don’t know what state you are in, but someone here might be able to suggest a legal resource that can help you explore this idea further."
Velifax,2020-01-07 15:12:19,fdgwbyv,t3_el7jy2,t3_el7jy2,"Fun scenario. I would keep the property, rent it at Cost Plus your time, preferentially to people who really need it, and be super clear about everything. Give monthly statements about your expenses for renting the property, explanations about local laws and how they apply, and push your tenants to be involved locally. Make a very public pool for upgrading the playground or whatever. When considering whether to subscribe to lawn maintenance or snow shoveling involve the tenants and allow them to decide collectively to pay or handle it themselves. Have them ""employ"" local children with General cleanup, and inform everyone of local government votes that would bear on the situation."
Pigeonofthesea8,2020-01-07 15:22:11,fdgx6oz,t3_el7jy2,t1_fdga9am,OP is in debt and needs to live somehow
unsuspectingmuskrat,2020-01-07 16:31:21,fdh3nt2,t3_el7jy2,t3_el7jy2,"To defeat the Capitalist, you have to think like the Capitalist. Good luck comrade! Service guarantees citizenship."
Deltaboiz,2020-01-07 16:39:57,fdh4hxx,t3_el7jy2,t3_el7jy2,"You exist in a Capitalist system and, as a result, need to play by the Capitalist rules for your own material interest.   Being a landlord isn't that great of a financial investment. Contrary to popular belief here, being a landlord is usually not a great return on your money compared to the opportunity costs of what you can be doing with it otherwise. There are obvious exceptions depending on various market conditions, but for the most part it's a profitable investment with modest returns and a large assumed risk. On a time scale of decades being a landlord can grow a big portfolio... But so can dumping money into mutual funds every month.   There is advice on this post about renting it below market price to someone else who might need it - this might be good advice for anyone you can personally vet, but if you are going through a third part to find a renter? It won't be a good idea. Lets say someone rents the unit, does some sort of large damage to it, and you are left with the bill? Where is this money going to be drawn from?  More importantly even for unintentional damages, these can add up quickly. Appliances, plumbing bills, a major electrical issue? All of these have huge costs that can eat up multiple months worth of rent and drop you in the hole.   What you should be doing is finding a way to sell the unit you inherited and find some other way to use the money, or you should approach being a landlord in a way that is conducive to your values without putting you at financial risk. Part of the reason a number of landlords are aggressive to tenants is for the above risk/reward reasons, and just being an understanding, human landlord goes a long, long way. If your tenant does fall ill and needed to take a few weeks off work? Just deferring until they can pay it (or forgiving) that months rent already puts you in the top .1% of dope landlords. There are ways to be both a landlord and not a heartless monster... But just remember, these people also exist in a capitalist system in which you can be taken advantage of.   My advice would be that you should just sell the property and put it in some other investment."
LeninisLif3,2020-01-07 18:41:27,fdhh210,t3_elfiyz,t3_elfiyz,"That claim isn’t wrong. Percentage wise, the United States has a higher prison population percentage wise than the Soviet Union, especially if one only counts the Gulags."
Nonbinary_Knight,2020-01-07 18:46:00,fdhhigt,t3_elfiyz,t3_elfiyz,"Of course not, gulags much better."
JueJueBean,2020-01-07 19:06:01,fdhjhm2,t3_el7jy2,t3_el7jy2,Go with the flow and become a slum Lord and just enjoy ur overpriced rent for that sweet sweet passive income..... /s
Elliottstrange,2020-01-07 19:09:33,fdhju4t,t3_el7jy2,t1_fdgx6oz,Off the work of others?
HelloTims,2020-01-07 19:23:57,fdhl9ck,t3_el7jy2,t1_fdg401q,"Would it be more moral to charge the rentee the market rate, but donate the extra amount charged to a charity, e.g one that buys mosquito nets for Africans in malarial areas?"
periodicchemistrypun,2020-01-07 19:58:31,fdhopro,t3_elfiyz,t1_fdhhigt,"You gotta gimme more than that, a /s or a reason"
Diazepapst,2020-01-07 20:02:08,fdhp30u,t3_el7jy2,t1_fdhju4t,That is what I don't want to happen. I will not exploit anyone to get rid of my debt.
aethelwyrd,2020-01-07 20:02:21,fdhp3ug,t3_elfiyz,t1_fdhh210,"[https://en.wikipedia.org/wiki/List\_of\_countries\_by\_incarceration\_rate](https://en.wikipedia.org/wiki/List_of_countries_by_incarceration_rate)  Russia has roughly half the prison population per capita than the USA. USA is #1 per capita.   Also, found this gem. ""Approximately half of the U.S. jail population consists of pretrial detainees who have not been convicted or sentenced.""  Not only does the US have the largest prison population, half of that population is being held WITHOUT TRIAL.    [https://en.wikipedia.org/wiki/Prisons\_by\_country](https://en.wikipedia.org/wiki/Prisons_by_country)"
periodicchemistrypun,2020-01-07 20:03:19,fdhp7bf,t3_elfiyz,t1_fdhh210,"Nah, I looked it up as I replied to the other guy, it’s .79 to 0.94 %, gulags were a bigger percentage.  Do you have any source that says other than these numbers:  170mil USSR pop 1939  1.6 mil gulag pop 1939  290 mil USA pop 2003  2.3 mil Prison pop 2003  If so I’m wrong and there’s something to be said for mortality rates if not then where are you getting your information from?  I’ll admit freely to assuming it was common knowledge what I believed before researching it but the numbers seem clear.  1. https://www.marxists.org/history/ussr/government/1946/population.pdf  2. https://www.sciencedirect.com/science/article/pii/S0147596715000207  3.  https://www2.census.gov/library/publications/2004/compendia/statab/123ed/tables/pop.pdf#  4. https://www.bjs.gov/content/pub/pdf/p03.pdf"
PlatosCaveSlave,2020-01-07 21:47:42,fdi0pxp,t3_el7jy2,t1_fdgkp73,Exactly. Just be a the best landlord you can be . Make someone's living situation become a great experience.
Pigeonofthesea8,2020-01-07 21:54:03,fdi1fkl,t3_el7jy2,t1_fdhp30u,"look. Your mom worked for twenty years to secure this. That’s her life and time. She wants to leave this earth safe in the knowledge  you’re going to be ok, in part because of her work. That’s her legacy to you. Honour it.  You have a child who deserves to feel secure, and a partner who’s thrown her lot in with yours.   Neither of them are going to be in a position to help with any revolution if they’re struggling the way you are or worse.   You’re not a wealthy person who has bank to throw around on people you don’t even know.   You yourself are so wasted from the effort of surviving you don’t have energy for radical activities.   You’re a father. You have an obligation.   Do your mom, your child, your spouse, and yourself a favour. Use this money - your mother’s time - wisely. Pay your debts. Make sure your kid can go to school. Make sure your spouse doesn’t have to struggle. THEN use your position to help others. Once you’ve taken care of yourself and your family first. Oxygen mask on you, before you save a passenger, remember? Anything else is a suicide cult. Pretty sure Marx wasn’t for suicide."
MLPorsche,2020-01-07 22:12:07,fdi3leg,t3_ek6a0o,t1_fda8xtb,&gt;pacifism is objectively pro-fascist. This is elementary common sense. If you hamper the war effort of one side you automatically help that of the other.   - George Orwell
ihada_petlion,2020-01-07 22:40:48,fdi6zfk,t3_el7jy2,t1_fdgb9dn,"Aha, well thanks man! I don't know if I follow your argument that things like advanced degrees and starting a businesses are true fantasies. But I appreciate your distinction between human landlords and corporations. I see how that can remove the human element."
ihada_petlion,2020-01-07 22:42:18,fdi7670,t3_el7jy2,t1_fdg9hpp,But what's different about the OP? Aren't some landlords motivated to create a more pleasant financial situation for their tenants?
L00minarty,2020-01-07 23:16:51,fdib3nr,t3_el7jy2,t3_el7jy2,"If you have no use for it, you could rent it for a reasonable price that only covers the costs the apartment makes without making profit off your property. I don't see any moral issue with that. Similarly, you could sell it if you find someone who you can trust won't try to make a profit with it.  Or you could just live in it. I mean, you own it, so there's no moral reason to not use your personal property and you don't have to pay any more rent to some greedy landlord. Well, unless it's far away from where you currently live and work, then that's probably not an option."
Milena-Celeste,2020-01-07 23:24:04,fdibwkn,t3_elfiyz,t3_elfiyz,"G.U.L.A.G. System was on-par with the current US Prison System. *Of course the US coppers engage in over one-thousand extrajudicial killings every year, so US numbers are likely a bit lower than those of the peak G.U.L.A.G.S. One should also note the high count of fascist POWs in the G.U.L.A.G.S. during peak population.*   Honestly, I find it easier to compare the USSR to the US rather than the other way around (*in part due to the US having existed first and for far longer, but also in part due to US actions having profound effects on the leadership of the USSR and how they handled situations. Also also in part: because I was born in the US, so I'm more familiar with it.*)"
cichlidgold,2020-01-07 23:24:57,fdibzxm,t3_el7jy2,t1_fdi1fkl,"This needs to be the top rated comment.   Dude don’t price gouge your renters and keep the rate even in years to come when others are spiking because they can.   You can be a landlord and not be a pos. There will always be a needs for landlords, not everyone wants to take on the responsibility on owning and maintaining property.   Cover the taxes and a bit for your pocket with the rent, and take care of your renter with stable rent over years to come."
k317hbr0wn,2020-01-07 23:40:10,fdidgrd,t3_el7jy2,t3_el7jy2,"Try getting in contact w/ your local tenant union, they would probably have an idea as to what would be best."
periodicchemistrypun,2020-01-07 23:40:22,fdidhe3,t3_elfiyz,t1_fdibwkn,"You make a good point of POWs bloating the camps although not in their peak which appears in my simple research to be 1939.  With a mortality rate of about 1 in 10 surely that washes any comparison to the American legal system into irrelevance?  American cops are scary armed and notoriously enthusiastic, that’s known across the world, I wouldn’t even trade them for London’s cops that won’t even read a crime report. But to compare to the numbers the gulags put out would be absurd to me and they seem closer to reproach and recourse than any gulag could really be."
Milena-Celeste,2020-01-07 23:54:59,fdieu2n,t3_elfiyz,t1_fdidhe3,"&gt;not in their peak which appears in my simple research to be 1939.  That's odd, I was 99% certain it peaked in 1943. How strange, Perhaps there is something odd with the data... Or perhaps you are looking at the combined total of every SSR while I stare at only The Sister republics."
macaddictr,2020-01-08 00:29:41,fdii1ne,t3_el7jy2,t3_el7jy2,Who better to be a landlord that someone who wants this badly to not exploit other people? I don’t think it’s practical to not participate in capitalism but where you do you can do it the most ethical way possible.
