author,created_utc,id,subreddit,title
5th_Law_of_Robotics,2019-10-06 13:23:34,de36lh,Egalitarianism,"'I want patriarchy to fear women': Mona Eltahawy says the time for being civil, peaceful and polite is over"
5th_Law_of_Robotics,2019-10-06 13:54:11,de3j3e,Egalitarianism,A tragic story demonstrating the stigma resulting in few men go in to child care; harming men and children for no real benefit
Pro_Male_Vanguard,2019-10-08 00:34:43,desgzy,Egalitarianism,"Turkish boys genitally mutilated without anesthetics in the name of the ""manhood"""
gas_the_tradcons,2019-10-10 09:05:01,dfvaak,Egalitarianism,"I have decided to be rude to feminists, and fake concern tolls MRA's who love tone policing."
gas_the_tradcons,2019-10-11 10:24:27,dgd5r5,Egalitarianism,"A honest question, why are the trad cons here using the Egalitarian label?"
5th_Law_of_Robotics,2019-10-11 11:57:42,dge3jm,Egalitarianism,[Meta] The sub is being actively brigaded by r/ProMaleCollective
bkrugby78,2019-10-11 14:45:49,dgg72w,Egalitarianism,Enough Leaning In. Let's Tell Men to Lean Out.
J-Unleashed,2019-10-30 22:38:03,dpe6bi,Egalitarianism,"MATH is RACIST According To Super ""WOKE"" White Lady!"
Kore624,2019-11-05 00:24:19,drr0qt,Egalitarianism,"Tom Martin, noted MRA, doesn’t believe child prostitution is rape because they’re being paid for it, and that the children should in fact be punished for preying on ill men, and that pedophiles should be treated with compassion for their “condition”."
mtcapri,2019-11-07 01:46:37,dsqe29,Egalitarianism,"Exhaustive, Unbiased Summary of Title IX and Campus Sexual Assault Issue — An incredibly long read, but immensely informative and with no spin!"
JackFisherBooks,2019-11-13 11:39:33,dvqjqo,Egalitarianism,Not All Masculinity Is Toxic: Why communication in the bedroom often fails
Pro_Male_Vanguard,2019-11-20 06:49:18,dyya1z,Egalitarianism,Petition to End Conscription In Russia after 8 conscripts were killed for hazing
JackFisherBooks,2019-11-26 11:33:30,e1wqym,Egalitarianism,Why No One Should Have to “Take It Like a Man”
JohnKimble111,2019-12-02 20:57:31,e55e0i,Egalitarianism,Domestic abuse against men is Yorkshire's 'biggest taboo' with thousands too ashamed to report horrifying crime
Kore624,2019-12-06 16:55:56,e71amp,Egalitarianism,"Psychological abuse by a male caregiver is a powerful predictor of hypersexuality in juvenile sex offenders, suggests a new study (n=529). Those who reported higher levels of psychological abuse by a male caregiver tended to report more problematic and excessive sexual thoughts and behaviors."
JohnKimble111,2019-12-08 17:43:41,e7wq16,Egalitarianism,Rabbis mourn lack of tolerance in Sweden after anti-circumcision vote
5th_Law_of_Robotics,2019-12-14 16:19:53,ealms4,Egalitarianism,"Good discussion in unpopularopinion about the hypocrisy frequently exhibited by people complaining about ""toxic masculinity"""
Pro_Male_Vanguard,2019-12-15 00:38:32,earxnm,Egalitarianism,Egyptian anti-circumcision group calls for an end to 'male genital mutilation'
Pro_Male_Vanguard,2019-12-18 14:03:15,ecd0rr,Egalitarianism,Child Support is injustice &amp; sexism against men
JackFisherBooks,2019-12-19 11:09:16,ecrsg3,Egalitarianism,How (And Why) Boredom Undermines Gender Equality
Razorbladekandyfan,2019-12-22 11:39:31,ee40jp,Egalitarianism,World Health Organization Must Not Suspend HPV Vaccination of Boys! - petition
5th_Law_of_Robotics,2019-12-28 16:04:09,egse3o,Egalitarianism,Why Women Are The Worst Kind of Bullies
JohnKimble111,2019-12-31 04:27:44,ehxta8,Egalitarianism,"Schools too afraid to help white boys and the Lakes deemed not ethnic enough... this lunacy helps no one, writes TREVOR PHILLIPS, former head of the Equality and Human Rights Commission"
Kore624,2020-01-07 20:36:54,elhbg3,Egalitarianism,Texas judge rules male-only draft violates constitution
Razorbladekandyfan,2020-01-11 13:49:16,en7lv6,Egalitarianism,STOP Body Shaming Circumcised Men!
Razorbladekandyfan,2020-01-12 16:00:23,enp54o,Egalitarianism,True Gender Equality In Anime!
Razorbladekandyfan,2020-01-13 11:05:28,eo2pap,Egalitarianism,Strict Gender Equality for Women! Good riddance to Chivalry!
Covered-in-Thorns,2020-05-30 07:29:21,gta845,Egalitarianism,Waiting for the day when people realize feminism fucked everyone over and everyone acts sorry
lol1969,2020-05-30 15:58:43,gtggp1,Egalitarianism,"TIL In 2005, US army soldier LaVena Johnson was found shot to death inside of a burning tent with a broken nose, black eyes, broken teeth and acid burns on her genitals. The military ruled her death a suicide."
Kore624,2020-05-31 04:34:45,gtsnei,Egalitarianism,The truth is most people are against racism.
mhandanna,2020-06-01 16:13:09,guneq6,Egalitarianism,"Pink Tax Myth | Like many feminist myths, pink tax is simply done to create a general feeling of opression, resentment and injustice in women and an illusion how world is built for men - a perfect recipie for recruitment into feminism | It is also part of a feminist culture of whining about things"
Kore624,2020-06-01 17:56:37,gupcsg,Egalitarianism,Some of us wouldn’t have rights without protests and riots.
Kore624,2020-06-01 22:01:44,guu3tn,Egalitarianism,A great man once said
Kore624,2020-06-02 00:12:28,guwgtg,Egalitarianism,"Shout out to Halsey, and all other outspoken feminists, for donating to black charities and for being out on the frontlines peacefully protesting and helping those who are falling victim to police brutality."
Kore624,2020-06-02 17:52:56,gvc450,Egalitarianism,"This is why your excuse that “this is a male problem, not a black problem” is bullshit. Stand up for those who are oppressed. Men have real problems, and BLACK PEOPLE have real problems ✊🏽✊🏾✊🏿"
mellainadiba,2020-06-02 23:42:28,gviqhs,Egalitarianism,"The most powerful and reputable American feminist organisation kills another shared parenting bill: N.O.W.’s crusade against actual gender equality slips into the limelight. It also wants to keep lifetime alimony,."
Covered-in-Thorns,2020-06-03 03:51:42,gvmhfw,Egalitarianism,Hold Pornhub accountable for all the trafficking they’ve enabled
Kore624,2020-06-03 15:32:41,gvw3i3,Egalitarianism,Sad to see MRAs promoting gender roles and stereotypes.
LXXXVI,2020-06-03 18:05:34,gvz038,Egalitarianism,"FYI: It's not called a sex tourism destination anymore, now it's a romance hot spot destination"
Kore624,2020-06-04 01:11:32,gw7545,Egalitarianism,Breonna Taylor was shot and killed in her SLEEP months ago and the officers are still on the job! George Floyd’s murderer was arrested and charged within days. Are black women going to get justice too? We have to focus our attention and efforts on this now. Where are the feminists at on this case?!
RacelessSexlessName,2020-06-04 01:58:20,gw7wds,Egalitarianism,"Equality, egalitarianism, and current events..."
Sewblon,2020-06-04 03:29:12,gw9bea,Egalitarianism,Women bear brunt of coronavirus. But men die from it more. I don't get it.
lol1969,2020-06-04 17:15:24,gwlocw,Egalitarianism,"Police killings breakdown: It is right to focus on black men right now, but don't forget more than 57 percent of African American women were killed while unarmed; white males were the least likely to have been unarmed when killed at just under 20 percent."
lol1969,2020-06-05 04:44:18,gwxy8j,Egalitarianism,"Steve “Spez” Huffman is finally claiming that Black Lives Matter, but has spent years as CEO defending white supremacy and racism on Reddit"
Kore624,2020-06-07 01:04:00,gy2xsh,Egalitarianism,"Incel Accidentally Blows Off Hand Trying To Make Homemade Bomb — A Virginia man inspired by notorious “incel” mass shooter Elliott Rodger fantasized about blowing up a shopping mall and killing “hot cheerleaders,” according to an FBI affidavit."
Kore624,2020-06-08 15:46:09,gz1rgd,Egalitarianism,"Sometimes, when people get depressed, they smash their own face in, pour acid on their genitals, and shoot themselves. Apparently."
Covered-in-Thorns,2020-06-09 08:34:53,gzj40c,Egalitarianism,"If you believe ‘Men’s Lives Matter’, instead of bringing up statistics when people say BLM, go and protest with them while also spreading the word."
Covered-in-Thorns,2020-06-09 08:52:33,gzjbbk,Egalitarianism,Just replace a couple of those nouns with feminist
Kore624,2020-06-10 00:26:04,h000dm,Egalitarianism,This was a response to an article about incels. Thoughts? Are feminists who want to abolish gender roles the reason for incels?
JohnKimble111,2020-06-10 07:41:25,h065oh,Egalitarianism,BBC still refuses to report any cases of false rape accusations causing suicides in the UK
hendrixski,2020-06-11 16:40:38,h12tvb,Egalitarianism,"I made a better, more equal, chart of gender inclusive language than the U.N."
Strikester101,2020-06-13 09:50:27,h84lai,Egalitarianism,"How many of you have read the novel ""The Power""? What are your opinions on it?"
OkLetterhead9,2020-06-14 20:29:25,h913xz,Egalitarianism,I'm watching the red pill documentary for the first time ..
hermes369,2020-06-15 16:15:54,h9jdhu,Egalitarianism,BlackLivesMatter
mhandanna,2020-06-16 05:19:53,h9xbp6,Egalitarianism,"The Facts about Male Discrimination (Loads of different areas, includes some real cases of rape shield laws being used wrongly - e.g. to protect female paedophiles) (great comments too)"
mhandanna,2020-06-16 09:19:56,ha0jec,Egalitarianism,"""The feminist view of gender relations (victimhood and no personal responsibility) has become such a dominant narrative that when psychologists have tried to promote women’s careers by encouraging them to be more confident, it has been met with hostility from feminists."""
OkLetterhead9,2020-06-18 08:04:09,hbag1w,Egalitarianism,"So I did an experiment to test male employment discrimination, and it's real."
mhandanna,2020-06-18 12:02:39,hbdat7,Egalitarianism,"Most people, regardless of gender, prefer staying home to do chores / childcare instead of working a full-time job. Staying home instead of working is a privilege and women appear to enforce this gender role at least as often as men do, if not more."
rannerbeer,2020-06-19 03:22:29,hbt4r4,Egalitarianism,"Scientific Study: Feminsm Makes You More Man Hating. STUDY: Self-identified feminists are much more likely than other women to ""sacrifice"" men in a hypothetical ""Moral Choice Dilemma Task"" over women. Plus other studies proving gynocentrism is real and misandry among feminists is real"
JohnKimble111,2020-06-20 03:52:47,hcf94m,Egalitarianism,"California Approves ballot measure for removing discrimination protections (race, sex, color, ethnicity, etc). ""We are talking about legalizing racism and sexism."""
mhandanna,2020-06-21 18:33:21,hdbwyi,Egalitarianism,"Why do feminists discuss the idea of imposter syndrome? They have literally created it. Entire industries are filled with women who have been artifically hired/promoted/overpaid, simply due to their junk. Most will still claim they are ""discriminated against"" LOL the rest will suffer imposter syndrm"
mhandanna,2020-06-21 18:37:22,hdbzgd,Egalitarianism,Women receive $6Billion more per year in federal grants for college despite being the majority of college students! Feminism has no place in egalitarianism
rannerbeer,2020-06-22 03:36:40,hdkiq1,Egalitarianism,Some good news.
rannerbeer,2020-06-23 02:16:36,he60pu,Egalitarianism,"Men ""make better plasma donors than women"" and have ""more Covid-19 antibodies"", as appeal for male donors is made."
mhandanna,2020-06-24 18:33:51,hf6jc2,Egalitarianism,"Boys left to fail at school because attempts to help them earn wrath of feminists, says the head of the entire university application system in the UK, Mary Curnock"
Kore624,2020-06-25 18:08:54,hfqzit,Egalitarianism,"Comedian Daniel Sloss tells his personal story. If you see something, say something. No more ignoring or making excuses for loved ones’ problematic and dangerous behavior."
mhandanna,2020-06-26 00:41:45,hfxrjz,Egalitarianism,"A list about feminism misandry for anyone who thinks that feminism fights for men’s rights, for anyone who thinks that feminism was only a sexist movement starting from the third wave and for anyone who accuse the MRM of being a sexist movement, while still defending feminism."
OkLetterhead9,2020-06-27 05:43:43,hgo0t4,Egalitarianism,Apparently asking for gender diversity when the majority are women is sexist !!
Kore624,2020-06-27 15:24:06,hgvf22,Egalitarianism,Machismo culture at its finest. So many men in the comments praising this child and hoping he gets abused
Kore624,2020-06-27 15:35:03,hgvm0r,Egalitarianism,Rape still isn’t taken seriously
rannerbeer,2020-06-29 03:28:04,hhsgrc,Egalitarianism,"''Men should be forbidden from becoming doctors or nurses. Men are defective, shit, worthless and responsible for everything wrong in the world. They need to learn their place by being constantly beaten up and assaulted.''"
mhandanna,2020-06-29 18:16:26,hi5a5j,Egalitarianism,"How feminism aggresively and sometimes violenty assualts science - Good article, with real high profile examples. Examples of how feminists are blocking the publication of real scientific data - yet are the ones churning out countless women are wonderful fake science"
mhandanna,2020-07-06 10:55:38,hm5i8c,Egalitarianism,"UK domestic violence bill is CURRENTLY going through formulation - 7 ONLY female charaties &amp; ONLY female survivors (male ones barred) were allowed to help influence it despite governments own data in the report showing nearly 800,000 male victims per year! Sign petition also in comments"
OkLetterhead9,2020-07-07 10:45:46,hms9aj,Egalitarianism,"Now you feel how we feel as men when you tell us we are privileged ... 99 % of men have no power, working class who live paycheck to paycheck. the majority of the jobless and the homeless are men, the majority of suicide victims are men. etc ... And when we complain we are accused of hating women !"
mhandanna,2020-07-07 23:56:37,hn66wt,Egalitarianism,"Well known fact, for men to be promoted they must be far more qualified than women. Yet feminists twist reality (down is up) and suggest women are overlooked when the data and even the LAW is obvious for all to see.... NOTE YET AGAIN FEMINISTS TRY TO BLOCK THIS PUBLICATION - FULL STUDY IN LINK"
OkLetterhead9,2020-07-09 22:04:34,hocf5z,Egalitarianism,"It says: ""Your ballot is invalid if you choose one person twice or two male applicants""! And there is only one female applicant! In other words, if you pick two you HAVE to pick the woman or your vote is invalid."
mhandanna,2020-07-12 00:25:43,hpl1ol,Egalitarianism,FSW you realize that freedom speech actually matters.. once your constant demands for the silencing of dissenting opinions finally comes around to bite you.
OkLetterhead9,2020-07-13 12:31:47,hqef8c,Egalitarianism,Why feminists accuse men of being afraid of equality when we complain about female supremacy ?!
