author,created_utc,id,subreddit,title
LuminavonA,2019-11-01 15:14:47,dq5koj,feminisms,Mothers tend to have a bad press in media and literature. In fact the human race would not have perdured without their toil and labors.
burtzev,2019-11-22 04:13:46,dzvp5n,feminisms,Through Fatima's eyes: Jordanians take to streets against domestic violence
burtzev,2019-11-26 06:40:55,e1u51o,feminisms,Moscow residents protest against domestic violence as conflict over legislation heats up
burtzev,2019-12-01 23:47:40,e4q3kj,feminisms,If Only 19th-Century America Had Listened to a Woman Scientist
burtzev,2019-12-03 02:02:59,e59qtk,feminisms,"[India] ‘No sympathy, only justice’: Residents of Hyderabad rape victim’s colony turn away politicians"
womenopausal,2019-12-08 06:44:55,e7qkf6,feminisms,Black Women Have Never Had The Privilege Of Rage
_pitter_patter,2019-12-18 06:06:44,ec8og5,feminisms,Housing. Money. Benefits. Military Wives Can Lose It All When They Report Domestic Abuse.
burtzev,2019-12-20 00:24:03,ed24l7,feminisms,"If Current Trends Hold, Women Around the World Will Have to Wait 257 More Years for Gender Pay Gap to Close"
_pitter_patter,2019-12-25 13:36:02,efgjs8,feminisms,Don't Forget That Saudi Arabia Is Imprisoning and Torturing Women's Rights Activist Loujain al-Hathloul
_pitter_patter,2019-12-27 15:33:32,egcisi,feminisms,Reports That Bloomberg's Campaign Exploited Women's Prison Labor Spark Outrage
_pitter_patter,2020-01-16 03:44:53,epdquy,feminisms,The Reason Republicans Won't Even Vote on the Violence Against Women Act
LuminavonA,2020-03-04 14:23:05,fddp00,feminisms,"According to this woman, the creation of the world starts ... in her belly! A retelling of genesis for our daughters."
_pitter_patter,2020-03-08 23:34:55,fflcxa,feminisms,Sanders Unveils Plan to Ensure Universal Access to Reproductive Healthcare and Take on the Maternal Mortality Crisis
burtzev,2020-03-09 00:32:38,ffm56p,feminisms,International Women’s Day in St. Petersburg: Defying the Ban
yellowmix,2020-03-13 20:47:31,fi6jdb,feminisms,How Hillary Clinton Became a Postmodern Menace
burtzev,2020-04-03 14:10:10,fu92i8,feminisms,"“Your traditions, our blood!”: The struggle against patriarchal violence in Kyrgyzstan"
LuminavonA,2020-04-22 14:12:36,g61teh,feminisms,"Some doctors argue that when children get sick, that allows them to move to the next stage in their development. Similarly, epidemics allows opportunity for change. In what ways will our world emerge changed after covid19? The Plague led to women actually losing power, status and legal rights."
LuminavonA,2020-04-28 13:26:28,g9n5cd,feminisms,Feeling grateful about this group!
yellowmix,2020-06-06 17:43:19,gxvgod,feminisms,Feds: Accused Incel Bombmaker Wrote of Revenge on ‘Hot Cheerleaders'; Blew Himself Up
