author,created_utc,id,link_id,parent_id,body
birdinthebush74,2019-12-31 07:38:51,fcmjlr4,t3_ehzit5,t3_ehzit5,"Exactly. Both foetus and the women can’t have equal rights , term limits on abortion are that compromise. The women has a time frame to end the pregnancy, and the foetus has the right to use her body in later months"
-mercaptoethanol,2019-12-31 09:57:27,fcmptm3,t3_ehzit5,t1_fcmjlr4,&gt;term limits on abortion are that compromise.  Out of respect for the good sense in this comment I am going to make no posts for the rest of this year.
birdinthebush74,2019-12-31 11:27:12,fcmtlg5,t3_ehzit5,t1_fcmptm3,Take your upvote!
OceanBlues1,2019-12-31 12:54:44,fcmxrne,t3_ehzit5,t1_fcmjlr4,"&gt;*Both foetus and the women can’t have equal rights , term limits on abortion are that compromise.*  Exactly."
OceanBlues1,2019-12-31 13:01:43,fcmy5gw,t3_ehzit5,t3_ehzit5,"Dr. Gu rocks!  Unfortunately, many ""prolifers"" seem to believe a woman is ""supposed to"" be a walking incubator, and nothing else.  Which is why they have no problem whatsoever with stripping women of our most fundamental right; the right to decide for **ourselves** whether to be mothers or not."
pauz43,2019-12-31 15:00:59,fcn6dmj,t3_ehzit5,t1_fcmjlr4,"&gt;the foetus has the right to use her body in later months  Do all humans have the same rights as a seven-month fetus? Why should that fetus have more rights than a father of four or a woman who is a cardiac surgeon who saves lives *if both are in organ failure?*  If a fetus can use someone else's body against that person's wishes ""in later months"" then adults in kidney failure should have the right to demand a healthy kidney from the nearest donor -- whether the ""donor"" agrees or not!   Tell us, birdinthebush74, if *you* would willingly hand over one of your non-vital organs to another human... on demand. How about all those who agree with bitb74's statement? Are YOUR organs up for grabs? Or just the organs belonging to pregnant *women?*"
parkahood,2019-12-31 15:28:39,fcn8ntq,t3_ehzit5,t1_fcn6dmj,"Yeah, um. What? You can revoke consent to an organ donation until you can no longer raise an objection. Like, they can be wheeling you into the suite and you can say no and they have to stop, even if the recipient is already in surgery and doesn’t have another shot.  Suddenly we give the fetus rights to someone else’s body when it wouldn’t apply in any other situation? We don’t compromise on human rights like that. Either everyone has the same rights or they don’t.   Some places don’t have term limits, are those places violating the fetus’ human rights?"
FairyKite,2019-12-31 16:47:32,fcnfupg,t3_ehzit5,t1_fcmjlr4,"I respectfully disagree that the fetus should ever have rights to the woman’s body. Nobody else has the rights to anybody else’s body at any point, no matter how developed they are. If a dying five-year-old doesn’t deserve access to his parents’ kidneys, or a dying pregnant woman doesn’t deserve an organ donation from the person who got her pregnant (despite it saving the life of the fetus too), why would the fetus eventually gain more rights than the woman?"
birdinthebush74,2019-12-31 16:58:56,fcnh17s,t3_ehzit5,t1_fcnfupg,"I agree with you, but pragmatically we need a cut off date to appease the 'middle' of the debate.  Also  after 24 weeks the foetus can be delivered anyway. I of course do not include threats to the health of the women or severe foetal abnormalities in this restriction"
birdinthebush74,2019-12-31 17:07:15,fcnhvg6,t3_ehzit5,t1_fcn8ntq,"I am looking at this as from a pragmatic point of view, later abortions are unpopular with the majority, even those identify as prochoice. Obviously this does not include severe foetal abnormalities or threats to the women's health or life."
parkahood,2019-12-31 17:19:34,fcnja6w,t3_ehzit5,t1_fcnhvg6,"I would argue that this sort of cut off gives the fetus rights we don’t want to give it. Can fetuses be victims of neglect? Are women violating their rights if they continue to take their medication or have a glass or wine?   And abnormalities and threats to life have proven to be so subjective, and that puts people in danger.  Both of those concerns are just as pragmatic. I don’t think that kind of concession does anything but allow for people to shove a foot in the door. Pro-lifers already do that; using a few edge cases to push and push. I see your point; I just don’t agree."
pauz43,2019-12-31 17:26:38,fcnk7av,t3_ehzit5,t1_fcn8ntq,"&gt; Either everyone has the same rights or they don’t.   Apparently, the fetus is more ""special"" than the rest of humanity. OR... restrictions on abortion are a clever way to punish women for not wanting to be pregnant and refusing to do fulfill their ""biological destiny"".  Somehow, women always end up holding the brown end of the stick when men make the rules."
VampireStereotype,2019-12-31 18:57:30,fcnugk4,t3_ehzit5,t1_fcmjlr4,"I normally have a lot of respect for you, Bird, but this is absolutely not okay.  Conditional human rights aren't rights, they are privileges. We, pro-choice people - pro-women people - believe that women deserve basic human rights. Agency, bodily-autonomy, self-ownership. All of these things are rights our culture grants as a matter of course to men. And yet even here it's apparently controversial to suggest that women should have these same most basic rights.  ""Term limits"" are a denial of women's most basic human rights.  The foetus categorically does *not* have the right to use ""her"" body, my body, your body at any stage."
manatorn,2019-12-31 18:59:25,fcnunsf,t3_ehzit5,t3_ehzit5,"I always come back to this excerpt from PP v. Casey:  &gt;Men and women of good conscience can disagree, and we suppose some always shall disagree, about the profound moral and spiritual implications of terminating a pregnancy, even in its earliest stage. Some of us as individuals find abortion offensive to our most basic principles of morality, but that cannot control our decision. Our obligation is to define the liberty of all, not to mandate our own moral code.   &gt;   &gt;...   &gt;   &gt;These matters, involving the most intimate and personal choices a person may make in a lifetime, choices central to personal dignity and autonomy, are central to the liberty protected by the Fourteenth Amendment. At the heart of liberty is the right to define one's own concept of existence, of meaning, of the universe, and of the mystery of human life. Beliefs about these matters could not define the attributes of personhood were they formed under compulsion of the State.   &gt;   &gt;These considerations begin our analysis of the woman's interest in terminating her pregnancy but cannot end it, for this reason: though the abortion decision may originate within the zone of conscience and belief, it is more than a philosophic exercise. Abortion is a unique act. It is an act fraught with consequences for others: for the woman who must live with the implications of her decision; for the persons who perform and assist in the procedure; for the spouse, family, and society which must confront the knowledge that these procedures exist, procedures some deem nothing short of an act of violence against innocent human life; and, depending on one's beliefs, for the life or potential life that is aborted. Though abortion is conduct, it does not follow that the State is entitled to proscribe it in all instances. ***That is because the liberty of the woman is at stake in a sense unique to the human condition and so unique to the law. The mother who carries a child to full term is subject to anxieties, to physical constraints, to pain that only she must bear. That these sacrifices have from the beginning of the human race been endured by woman with a pride that ennobles her in the eyes of others and gives to the infant a bond of love cannot alone be grounds for the State to insist she make the sacrifice. Her suffering is too intimate and personal for the State to insist, without more, upon its own vision of the woman's role, however dominant that vision has been in the course of our history and our culture.***  (emphasis mine)"
sloweyarole,2019-12-31 19:18:47,fcnwn9a,t3_ehzit5,t3_ehzit5,They cannot give someone a right to life if it violates another persons right to life and bodily autonomy. Life isn’t worth living if you can’t control your own body.
hadenoughoverit336,2019-12-31 19:23:06,fcnx4u9,t3_ehzit5,t1_fcmjlr4,"Or, a doctor decides what's best for their patient at that point. If a doctor believes that continuing the pregnancy would be detrimental (mentally, or physically), they decide the best way to end the pregnancy. I think early induction should still be an option, if they think the pregnancy is viable. That makes the most sense. Otherwise, you will have women throwing themselves down the stairs. Guess what the end result is of that?"
hadenoughoverit336,2019-12-31 19:24:46,fcnxbuv,t3_ehzit5,t1_fcmjlr4,"I do get what you're saying, but the law would have to be written in such a way, that it gives doctors the right to use their discretion."
Ruefully,2019-12-31 20:23:50,fco4c2e,t3_ehzit5,t1_fcnh17s,"I agree with you. I think cut off dates are to appease fencesitters and moderates. If you actually think about it, PC slogans on a protest sign communicate so much and make such strong points. It's too bad they are ignored.  ""Trust Women"" There's so much meaning in two words. But we don't trust women (yes even many women, considering all the PL women or women who further their internalized misogyny). We don't trust women or PL wouldn't continuously attack abortion through late term abortions, despite the fact we all know that women seeking abortion at that stage are doing it for health reasons.   That's because we all know that if a woman has an unplanned pregnancy, she wants to abort as soon as possible. If late term abortions don't happen for health reasons (I have no data on how many late term abortions are elective in the one or states it is legal, back me up if you like) then you can bet PL had a hand in it. It is in no one's best interest to make abortions harder to get."
Ramesses-ll,2019-12-31 21:56:57,fcod9vk,t3_ehzit5,t1_fco4c2e,"&gt;We don't trust women or PL wouldn't continuously attack abortion through late term abortions, despite the fact we all know that women seeking abortion at that stage are doing it for health reasons.  Why fight for a right you have no intention of using, and in the process of fighting risk alienating the middle?   Uk has 24 week limit unless health.     The straw man of ‘aborting viable pregnancy’ can’t be used in uk cos it isn’t asked for by reasonable advocates."
birdinthebush74,2019-12-31 22:28:26,fcofyzd,t3_ehzit5,t1_fcnugk4,I will send you a DM
o0Jahzara0o,2020-01-01 00:19:41,fcopas8,t3_ehzit5,t1_fcnugk4,"I think she was more commentting on the spirit of Roe v. Wade.    I personally believe abortion should be legal and accessible at any point during pregnancy. At no point does a woman stop owning her body based off the gestational age of the fetus.     But I accept how Roe is set up because I think that the issues Pro-life are concerned about with late term abortions tend to resolve themselves. They think that women just randomly decide they change their mind and will kill viable fetuses. But we all know that doesn't happen. Those abortions tend to take place on women with wanted pregnancies who no longer can continue because of health problems or the fetus is no longer viable.    So I think Roe sets it up to where women most certainly do have full human rights, but let's Pro-life know that their (ignorant) fears aren't being carried out."
nosleepforthedreamer,2020-01-01 04:02:05,fcp5pzq,t3_ehzit5,t3_ehzit5,"Not a Gu fan, but well said."
nosleepforthedreamer,2020-01-01 04:04:27,fcp5v8e,t3_ehzit5,t1_fcmy5gw,"Right, they keep saying stuff like it’s biology and women are made to give birth. The latter is a lie from hell, but neither of these statements have anything to do with their taking people’s rights that they should have had from birth."
nosleepforthedreamer,2020-01-01 04:05:47,fcp5y92,t3_ehzit5,t1_fcnh17s,Cutoff dates will have to be abolished once we have it in the Constitution that no one can use another person.
nosleepforthedreamer,2020-01-01 04:10:31,fcp68vg,t3_ehzit5,t1_fcnunsf,"I don’t think trashing one’s body and throwing away freedom to give life to a nonexistent being is noble. I do see why people want to see it in that light. Society has always come first, not the individuals who are the reason for society’s existence. So to make themselves comfortable with humanity depending on these things from people, they had to tell themselves that the incubators were heroes."
Brownie-1234,2020-01-01 05:10:41,fcp9sgq,t3_ehzit5,t1_fcp5y92,"More like when we have it in the Constitution that women are full people. The Equal Rights Amendment simply states “Equality of rights under the law shall not be denied or abridged by the United States or by any State on account of sex”. Yet misogynists won’t allow it to be passed because if women are considered full people under the law you can’t force them to be used as reproductive slaves, irrespective of what day of pregnancy they’re in."
nosleepforthedreamer,2020-01-01 05:26:44,fcpaq28,t3_ehzit5,t1_fcp9sgq,"That would also allow women to be lawfully kidnapped to serve in war. That’s a draft problem, though."
Brownie-1234,2020-01-01 05:42:09,fcpbmvf,t3_ehzit5,t1_fcpaq28,"[Right, we still have people arguing that women shouldn’t have to register for the draft because of “traditional gender roles” and women being meant to bare and raise children, even when a court says the law is unconstitutional](https://www.stripes.com/news/us/should-women-register-for-the-draft-experts-debate-as-trump-administration-challenges-court-ruling-1.578544) 🙄. Ridiculous, not that anyone should ever be drafted."
birdinthebush74,2020-01-01 08:30:55,fcpme1z,t3_ehzit5,t1_fcopas8,Yes it was Roe I was commenting I see it ( from a non Americans prospective) as a compromise
birdinthebush74,2020-01-01 08:33:32,fcpmnn3,t3_ehzit5,t1_fcnunsf,That’s a brilliant quote
OceanBlues1,2020-01-01 12:29:18,fcq9t51,t3_ehzit5,t1_fcp5v8e,"&gt;*Right, they keep saying stuff like it’s biology and women are made to give birth.*  Which is a big **so what** in my book.   It doesn't -- and shouldn't -- mean that women are to be restricted from doing anything else.  You know, like getting a college degree and beyond that, if some women choose.  Like getting a high-income career, which allows women to have their own money.  Like buying, if they choose, their own house, **without** a man having to ""provide"" it for them, and choosing to avoid marriage and motherhood entirely in favor of living as single, financially-independent women.   That last choice really seems to make some male ""prolifers"" go ballistic."
birdinthebush74,2020-01-01 12:59:31,fcqd0co,t3_ehzit5,t1_fcp5y92,Do you think that will ever happen?
nosleepforthedreamer,2020-01-01 14:33:09,fcqnp0e,t3_ehzit5,t1_fcqd0co,"It could, if we make it happen."
nosleepforthedreamer,2020-01-01 14:36:44,fcqo4dt,t3_ehzit5,t1_fcnh17s,"There is no “delivered anyway.” Birth in itself is use, to which the fetus is not entitled."
imbalancedMortician,2020-01-01 17:02:41,fcr83rl,t3_eik826,t3_eik826,"The religious spin on the natural law one, where they insist that you're ""frustrating the purpose of your uterus"". Like, Lauren I'M gonna be the one that's frustrated if I have to gestate a pregnancy! The only purpose I have is the one I give my own damn self, fuck off!   Edit: Changed a name to the other one."
SadisticSienna,2020-01-01 17:04:54,fcr8fdx,t3_eik826,t1_fcr83rl,"Thats definitely the worst. The only thing thats being frustrated is my brain listenin to that rubbish lol. Definitely frustrated as a woman hearing that garbage as well lol.  ""Hey im going to keep this pregnancy I dont want so I dont frustrate the purpose of my uterus"" - said no woman ever 🤣🤦‍♀️"
VampireStereotype,2020-01-01 18:09:14,fcri81n,t3_eik826,t3_eik826,"I think the worst argument *I* personally ever heard was ""but you'd be a great mother"".  Putting me in charge of a baby would be catastrophically negligent.  But that's sort of very specific to me.  I think the worst general argument is the religious variety. Anything founded on ""my favourite god says X"" is just a terrible argument for anything."
SadisticSienna,2020-01-01 18:11:04,fcriiex,t3_eik826,t1_fcri81n,Iv never had that argument used against me lmao 🤣😅
birdinthebush74,2020-01-01 18:21:01,fcrk4eg,t3_eik826,t3_eik826,Its against God for women not to  be mothers  Or 'think of all the infertile women who would love to be pregnant'
peroidcrampsbegone,2020-01-01 18:32:27,fcrlyo9,t3_eik826,t3_eik826,When the pro-life movement resorts down to religion and making God mad or you're going to go to hell. It just comes off that they can't support their argument at all to me.
nerdywall,2020-01-01 18:48:35,fcroj4t,t3_eik826,t3_eik826,"""It's God's will""  Or   ""Any doctor who can't save an ectopic pregnancy isn't trying hard enough"""
sloweyarole,2020-01-01 18:53:29,fcrpbja,t3_eik826,t3_eik826,I had a forced birther link this story in defense to their argument that women at 8 months pregnant do have abortions. He made himself look like a complete fool LMAO. He obviously didn’t read the story.    https://www.thecut.com/2018/06/she-had-an-abortion-at-8-months-then-a-surprise-pregnancy.html
Teutiaplus,2020-01-01 18:53:34,fcrpbzs,t3_eik826,t3_eik826,"How is sex is consent to a fetus a bad argument? I would like some explanation of your reasoning.  Edit: oh boy here I go ""trolling"" people with questions again!  Edit 2: also yeah I agree a lot of what you said made sense, that's why I like to use different wording."
Wolvesrfun,2020-01-01 18:53:47,fcrpd3v,t3_eik826,t1_fcrk4eg,"OOOOH that one pisses me off. We aren't baby-making machines for infertile couples, BRENDA! They can adopt from the kids already needing a home!"
sloweyarole,2020-01-01 18:54:12,fcrpfeu,t3_eik826,t1_fcr83rl,Yeah the religion stance is completely irrelevant. No one can force us to follow their wack beliefs.
SadisticSienna,2020-01-01 18:59:13,fcrq7ks,t3_eik826,t1_fcrpbzs,Consent is a permissional agreement between  people. The fetus wasnt part of the permissional consent agreement
SadisticSienna,2020-01-01 19:00:54,fcrqhdn,t3_eik826,t1_fcroj4t,So baddd
SadisticSienna,2020-01-01 19:01:27,fcrqkj2,t3_eik826,t1_fcrlyo9,They are kinda hard to argue against because these arguments are next level crazy
mind_slayer_,2020-01-01 19:01:32,fcrqkyy,t3_eik826,t3_eik826,It’s not a clump of cells it’s a BaBy. LiFe Is PrEcIoUs. It’s MURDER.
SadisticSienna,2020-01-01 19:02:23,fcrqpur,t3_eik826,t1_fcrk4eg,I never got that. Its like pregnancy envy
SadisticSienna,2020-01-01 19:03:01,fcrqtw0,t3_eik826,t1_fcrqkyy,Also being called a murderer lol
calladus,2020-01-01 19:04:07,fcrr0eb,t3_eik826,t3_eik826,"""You're killing a baaaby!"""
mind_slayer_,2020-01-01 19:04:11,fcrr0rn,t3_eik826,t1_fcrqtw0,Honestly there are many. Too difficult to choose.
SadisticSienna,2020-01-01 19:07:47,fcrrl6i,t3_eik826,t1_fcrr0rn,"Then the ""you killed your baby"", which isnt exactly an argument persay but its often used"
mind_slayer_,2020-01-01 19:09:59,fcrrx2x,t3_eik826,t1_fcrrl6i,They seriously compare murderers to women getting abortions.
cockroachvendor,2020-01-01 19:12:36,fcrsb8n,t3_eik826,t3_eik826,every single one of them ngl
SadisticSienna,2020-01-01 19:15:32,fcrsrtm,t3_eik826,t1_fcrrx2x,Yeah its insaneee
Coreymiconius00,2020-01-01 19:22:14,fcrttv9,t3_eik826,t3_eik826,"“Science says it’s alive, therefore it deserves rights.” Totally ignoring a woman’s right to her own body or the fact that everything on this planet is or was alive."
nerdywall,2020-01-01 19:34:10,fcrvoof,t3_eik826,t1_fcrqhdn,Ikr! Like there is literally no way an ectopic pregnancy is viable but this guy tried debating that it was. Like oh honey no...
SadisticSienna,2020-01-01 19:35:13,fcrvuc5,t3_eik826,t1_fcrttv9,They go on about how life starts at conception but um the woman is also alive 🤦‍♀️
SadisticSienna,2020-01-01 19:37:46,fcrw7ky,t3_eik826,t1_fcrvoof,Usually they dont really know anything about pregnancy
nerdywall,2020-01-01 19:38:33,fcrwbul,t3_eik826,t1_fcrw7ky,Oh yeah that much was obvious 🙄
VampireStereotype,2020-01-01 19:43:45,fcrx4k5,t3_eik826,t1_fcrpbzs,"I don't consent to pregnancy.  Is that clear enough for you?  I realise that you don't think women have the right to give or refuse consent to sex or pregnancy ( https://www.reddit.com/r/prochoice/comments/e9hl22/consent_and_forcedbirther_ethics/fajvj4w/ ), but **I do not consent to pregnancy**."
GooseTriedToKillMe,2020-01-01 19:44:01,fcrx60w,t3_eik826,t3_eik826,natural law? so is dying from pneumonia and yet ya'll just run to hospital and chug antibiotics if you get sick
pauz43,2020-01-01 19:45:17,fcrxclc,t3_eik826,t1_fcrpfeu,"Sadly, they can -- if they can get laws passed that promote their theology.   I do wonder why the rules of their faith always seem to affect women far more than men, though."
SadisticSienna,2020-01-01 19:45:31,fcrxdsv,t3_eik826,t1_fcrwbul,Usually also 15 year old male virgins 🤷‍♀️
pauz43,2020-01-01 19:46:35,fcrxjni,t3_eik826,t1_fcrpbja,&gt;He made himself look like a complete fool  All it takes is for them to open their mouths!
nerdywall,2020-01-01 19:46:42,fcrxk7l,t3_eik826,t1_fcrxdsv,Oh no unfortunately this was a male college senior.
vavaune,2020-01-01 19:47:44,fcrxq4p,t3_eik826,t3_eik826,"that ""everyone against abortion has already been born"" if a kid was born bc of rape, would you support rape? if a kid was born from a 15 year-old, would you support your teenager having sex? oh, that's what i thought."
sloweyarole,2020-01-01 19:48:04,fcrxs3o,t3_eik826,t1_fcrxjni,"They have nothing to support their argument. Every time I would present them with facts, they would twist my words and jump to a completely separate issue. They cannot answer questions directly because they cannot come up with a good enough response."
pauz43,2020-01-01 19:49:01,fcrxxma,t3_eik826,t1_fcrpbzs,You give consent to obeying traffic laws when you drive on the roads. You do NOT give consent to being hit and injured by a drunk/distracted driver.
vavaune,2020-01-01 19:49:21,fcrxzi9,t3_eik826,t1_fcrvoof,&gt;but this guy tried debating that it was.  &gt;but this guy  &gt;this guy  that explains a lot.
sloweyarole,2020-01-01 19:49:37,fcry0zt,t3_eik826,t1_fcrxclc,"Yeah me too. If men were the ones with the bodies the government was trying to control, they’d be singing a different fucking tune."
SadisticSienna,2020-01-01 19:55:08,fcryq49,t3_eik826,t1_fcrx60w,Ikr!!! Hypocrites.
SadisticSienna,2020-01-01 19:55:27,fcryrcm,t3_eik826,t1_fcrxk7l,Raree
nerdywall,2020-01-01 20:00:35,fcrzash,t3_eik826,t1_fcrxzi9,"Yea I tried bringing that up, he just did the ""holier than thou"" act and ignored any counter arguments 🙄"
247planeaddict,2020-01-01 20:08:36,fcs0787,t3_eik826,t3_eik826,"""But birth is the most beautiful thing on earth""  Not it isn’t, it’s the worst."
vavaune,2020-01-01 20:17:18,fcs180f,t3_eik826,t1_fcrzash,"""hurr durr i am a dude and i dont even know the location of a clitoris but here is how an ectopic pregnancy works"" ewww"
parkahood,2020-01-01 20:18:39,fcs1dxl,t3_eik826,t1_fcrpbja,"The comments are ignorant AF. ‘*My* high risk pregnancy came out fine because *I* trusted God so everyone should do that, even though I am completely unaware of how illogical this stance is, and most of the time all you’re going to get is a dead baby, but LIFE DESERVES A CHANCE.’   That really pisses me off, *and* it’s selfish."
nerdywall,2020-01-01 20:21:26,fcs1psl,t3_eik826,t1_fcs180f,Yep. He thought he was soooo knowledgeable I almost felt bad for him if he wasn't berating rape victims
SadisticSienna,2020-01-01 20:22:30,fcs1ulx,t3_eik826,t1_fcs0787,My untorn vagina is the most beautiful thing on earth 🤣🤷‍♀️
curious--owl,2020-01-01 20:41:39,fcs4dk7,t3_eimpnf,t3_eimpnf,"When I found out I was pregnant, I was terrified and fully prepared to ingest poison, starve myself, boil myself alive, throw myself down stairs, or whatever it would’ve taken to end the pregnancy. Luckily, I live in a blue state and none of that was necessary. If I had been in a red state or somewhere without a clinic, I know without a doubt I would’ve hurt myself if it meant no longer being pregnant.   This is was forced-birthers don’t seem to understand. When we don’t want a pregnancy, we will find a way to stop being pregnant, period. Accessible, safe, and legal abortion is the only logical option."
Bitter-ish,2020-01-01 20:43:34,fcs4o1h,t3_eimpnf,t3_eimpnf,"""Pro life except rape"" ""Fine and rehabilitate women""  There's alot to unpack here, but frankly I'd rather throw the suitcase away."
sloweyarole,2020-01-01 20:44:30,fcs4t66,t3_eimpnf,t1_fcs4dk7,I’m so glad you had access to a safe abortion! Forced birthers make pregnancy and childbirth seem like unicorns and rainbows. Both of mine were hell. I had a c section and a natural birth. I can’t understand their stance because they do not consider the life and well being of the mother. To them her life is not even worth considering and that’s sad.
sloweyarole,2020-01-01 20:45:33,fcs4yua,t3_eimpnf,t1_fcs4o1h,Oh the whole time I was arguing with him he kept twisting my words and switching subjects to avoid answering my questions. That’s all forced birthers know how to do.
Bitter-ish,2020-01-01 20:47:37,fcs5a4o,t3_eik826,t1_fcrvuc5,"Unfertilized eggs are also alive, but we don't give them human rights. Why? Because that's fucking insane."
