author,created_utc,id,link_id,parent_id,body
Veigar_Senpai,2020-01-09 02:47:04,fdm261q,t3_elyyuo,t3_elyyuo,"This week on ""Women aren't allowed to be happy unless they breed"""
PMMEYOURGUAYCARDS,2020-01-09 02:54:50,fdm2uul,t3_elyyuo,t1_fdlrsp7,"...how? She already has a kid, and one more on the way."
vikingprincess28,2020-01-09 03:15:54,fdm4qks,t3_elyyuo,t3_elyyuo,I’m so sick of the pro-lifers losing their shit over her speech. It is HER life. And everything she said was true. We are fortunate to have a right to choose and we need to keep it that way. Fuck women who don’t support other women.
UniverseIsAHologram,2020-01-09 03:27:42,fdm5r74,t3_elyyuo,t1_fdl835a,"Stupidest thing I'm hearing is, ""How is she going to tell her child that she killed their older sibling?"" Is that a conversation you have with your children? And I'm guessing her daughter watched the speech, so I doubt there's an issue. If your parent is pro-choice, odds are you are, too."
dietxrooty,2020-01-09 03:37:10,fdm6k4p,t3_elwrdg,t3_elwrdg,"This is tmi  I don't recommend a c section to anyone.  I had to an emergency c section because my labour was going south, and my son was in distress.  I was paralyzed from the epadueral, I could not feel my legs at all. I had to have a  catheter in because I could not walk at all.  I was so full of drugs that I could not hold my son once he was out. (not that I was given the choice, he was rushed to nicu)  I had to stay in the hospital for 2 days.  Once the  catheter was out, I was asked every 2 hours how much I peed.   If I didn't pee enough I couldn't leave the hospital and a catheter had to go back in.   I was not allowed to do anything for 6-8 weeks, all I could do is hold the baby.  I had to get the staples removed, oh btw I couldn't drive so I had to have someone take me to all my appointments. I was 100% useless.  It's been 4 months and I still don't have all the feeling back, and I have to keep up matiance as there are bald spots.  OH and my abs don't exists anymore, I have to do physio too.   So yes a c section is way better than labour and pregnancy."
thedeecee,2020-01-09 03:39:41,fdm6roz,t3_elyyuo,t3_elyyuo,The stupidity of that cartoon made me laugh out loud. As a mom too! Ew
Atomwafflehaus,2020-01-09 03:51:35,fdm7rs4,t3_elyyuo,t1_fdm2uul,I don't know anything about her. The meme is implying that women would rather be mothers than accomplish something exceptional. That makes me want to get my tubes tied.
SadisticSienna,2020-01-09 04:24:48,fdmafz5,t3_elwrdg,t1_fdl9z5f,C section is literally worse than vaginal birth. They are such fuckwits 🤦‍♀️
SadisticSienna,2020-01-09 04:26:15,fdmajyj,t3_elwrdg,t1_fdm6k4p,Wow Im so sorry :(
SmileBot-2020,2020-01-09 04:26:21,fdmak78,t3_elwrdg,t1_fdmajyj,I saw a :( so heres an :) hope your day is good
DanelRahmani,2020-01-09 04:26:25,fdmakfn,t3_elwrdg,t1_fdmajyj,I saw a :( so heres an :) hope your day is good
DanelRahmani,2020-01-09 04:26:41,fdmal7k,t3_elwrdg,t1_fdmak78,I saw a :( so heres an :) hope your day is good
SmileBot-2020,2020-01-09 04:27:03,fdmam8d,t3_elwrdg,t1_fdmal7k,I saw a :( so heres an :) hope your day is good
DanelRahmani,2020-01-09 04:27:26,fdmana3,t3_elwrdg,t1_fdmam8d,I saw a :( so heres an :) hope your day is good
TuxedoPocket,2020-01-09 05:28:12,fdmeyyq,t3_elyyuo,t1_fdm261q,💀💀💀
Ruefully,2020-01-09 06:08:48,fdmhjm9,t3_elwrdg,t1_fdlsq39,"The theoretical part refers to the fact that it is not autonomous. It cannot sustain itself on its own. Without the woman, it's nothing. In the same way one might call a gamete a theoretical human."
Ruefully,2020-01-09 06:09:45,fdmhlot,t3_elwrdg,t1_fdlncyo,Stop assuming ProChoicers are okay with circumcision to fit your narrative.
Shan132,2020-01-09 06:38:09,fdmj8cj,t3_elyyuo,t3_elyyuo,Wtf this is terrible
Shan132,2020-01-09 06:38:17,fdmj8l9,t3_elyyuo,t1_fdl7m83,Exactly
TheGrilledChimp,2020-01-09 06:53:02,fdmk1jk,t3_elyyuo,t3_elyyuo,"Honestly, nothing has ever wanted to make me throw up more in my life."
TuxedoPocket,2020-01-09 07:01:43,fdmki3s,t3_elyyuo,t1_fdmj8cj,Yeah the Pro Lifer’s are spreading this crap all over my social media accounts and the sick thing is they’ll never be convinced that their convictions are anything other than benevolent.
birdinthebush74,2020-01-09 07:16:48,fdmlaou,t3_elyyuo,t1_fdlfckn,Spot on
birdinthebush74,2020-01-09 07:20:37,fdmlhoc,t3_elyyuo,t1_fdllpy2,Emma Thompson keeps her Oscar in the toilet which is rather cool https://www.theguardian.com/film/2014/feb/25/where-oscar-winners-keep-their-awards
birdinthebush74,2020-01-09 07:24:37,fdmlowx,t3_elyyuo,t3_elyyuo,Woman = Must have children
birdinthebush74,2020-01-09 07:38:45,fdmmf8j,t3_elyyuo,t1_fdm261q,😂
birdinthebush74,2020-01-09 07:40:56,fdmmj9i,t3_elyyuo,t1_fdm4qks,She really triggered them . Their “ change the culture so that abortion is unacceptable” is a failure
birdinthebush74,2020-01-09 07:48:43,fdmmxgv,t3_elyyuo,t1_fdm7rs4,"Sensible move if Trump wins another term , the Evangelicals want abortion and some forms of contraception banned . The childfree sub has a list of friendly Drs that willl sterilise women"
Egolith,2020-01-09 08:22:40,fdmok4m,t3_elwrdg,t1_fdmhjm9,"What??? You all know what theoretical means right? Even while ignoring that first part, if we base it off of what you are saying about autonomy and humanity, then the elderly, disabled, and infants can fall under the category of being nothing. Since there are people that can't be autonomous, they are stripped of their humanity, under this presumption."
o0Jahzara0o,2020-01-09 08:28:46,fdmou6k,t3_elyyuo,t3_elyyuo,"Yes... because nothing else can ever fulfill you except motherhood...    If the roles in this were reversed, they would be pissed at how insensitive it is. No empathy..."
Egolith,2020-01-09 08:36:07,fdmp61x,t3_elwrdg,t1_fdmhlot,"I'm not assuming, I am just repeating the initial statement and just modifying it to a similar topic of bodily autonomy. The narrative is similar to the initial comment, yet you are defensive?"
TuxedoPocket,2020-01-09 10:14:44,fdmteaq,t3_elyyuo,t1_fdmou6k,"Yeah notice how it doesn’t depict two men.  Celebrity: “I abandoned my unborn kid but I got an award and it was worth it.”  Father: “No it wasn’t.”  I bet if men could get pregnant, they’d be selling abortion pills at all the gas stations across the nation tbh."
o0Jahzara0o,2020-01-09 10:26:33,fdmtwsc,t3_elyyuo,t1_fdmteaq,"Oh, I didnt even think of reversing it that way. Hah. That works too.    I was thinking of the woman holding the baby saying ""I won!"" &amp; the woman holding the award saying ""No you didnt."""
TuxedoPocket,2020-01-09 10:30:19,fdmu2t2,t3_elyyuo,t1_fdmtwsc,"Oh that’s an even better analogy. No one thinks that motherhood &gt; success is offensive but reverse the roles and everyone loses their shit.   Yeah if these PLer’s took a moment to edit and revise their own shit before posting it out there, perhaps they could become more aware of how anti-women having careers they sound."
o0Jahzara0o,2020-01-09 10:37:03,fdmudb5,t3_elyyuo,t1_fdmu2t2,"Yup! I wouldnt mind seeing the reverse comic with the title ""This is what it feels like when the roles are reversed"" or something to that effect. Because they are so blind to the insensitivity. We dont do that to them. We dont tell them they are stupid for desiring to be mothers and that they are giving up their lives to be a mom. We dont make their decision out to be worthless &amp; pointless &amp; *wrong.*    I have no doubts that motherhood is fulfilling. But that is not what this is saying... This is saying nothing else is fulfilling other than motherhood."
TuxedoPocket,2020-01-09 10:38:49,fdmug25,t3_elyyuo,t1_fdmudb5,"Agreed. Women deserve much better than this redundant jargon that’s consistently shoved down their throats. Like, it’s 2020 why haven’t we all grown up yet??"
o0Jahzara0o,2020-01-09 11:38:41,fdmx8ox,t3_elyyuo,t1_fdmug25,"I ask myself the same question...    Women 47 years ago are probably sick of hearing this shit. So many of our ancestors died or were forced into motherhood when they didnt want to be. Some have turned a blind eye to their struggles as a species and those that didnt, those that created birth control, distributed it, learned how to do abortions, were ostracized. We as a species became so used to the status quo, the thought of women not wanting motherhood as a given at any point in her life just disgusted some of us. We couldnt deal with this existential dread at the thought of our loving mothers, submissive wives, not wanting to play that role. So we demonized them. And oppressed them.    Indeed, it is 2020. Time to join the rest of the human race and accept that women have the same rights as everyone else, the same rights to their own bodies."
OceanBlues1,2020-01-09 11:56:09,fdmy4we,t3_elyyuo,t3_elyyuo,"*|""* ***STFU, not everyone relishes motherhood. This meme makes me sick.*** *""|*  Agreed.  What's obvious, to me at least, is the blatant attempt by forced-birthers to enforce the ""**real** women want to be mothers"" B.S.  Which, of course, implies that any woman who doesn't want to be a mother isn't ""real.""  What nonsense!    Personally, I'd much rather have an award than a baby, and the forced-birthers can go jump."
OceanBlues1,2020-01-09 12:09:56,fdmyvpo,t3_elyyuo,t1_fdmmxgv,"&gt;*""... the Evangelicals want abortion and* ***some forms of contraception*** *banned.*  Yep.  And I think some Evangelicals would love to see **all** forms of contraception banned, not just a few of them.  There was one ""prolife"" poster on AD who actually compared contraception to an eating disorder, which was bad enough.  What was worse in my view was this poster saying something like ""I believe it is immoral to have sex without consent to pregnancy.""  Which seems to be another way of saying, ""if you never want a baby, you should never have sex.""  It never seems to occur to forced-birthers that if they personally believe birth control is bad or ""immoral,"" no one is forcing **them** to use it.  It doesn't -- and shouldn't -- mean they get to make that choice for all women."
Ruefully,2020-01-09 12:20:55,fdmzi4i,t3_elwrdg,t1_fdmp61x,"&gt; The narrative is similar to the initial comment, yet you are defensive?  &gt;I'm not assuming  Yes you are. You just did with the first sentence I quoted. You could have just left it at ""I'm not assuming"" but you had to add in the next bit.  There is more to communication than stating whatever it is you wish without regard to how others might interpret it. What you said was extremely off topic to the point of being dismissive. It would be like showing up to a cancer fundraiser and then asking ""Why doesn't anyone care about diabetes?"""
birdinthebush74,2020-01-09 12:22:27,fdmzlgq,t3_elyyuo,t1_fdmug25,Religion
OceanBlues1,2020-01-09 12:25:44,fdmzse2,t3_elwrdg,t1_fdl34jd,"&gt;*Idk why prolifers minimize pregnancy and childbirth so much.*  My guess; they don't want young women and girls to know how really bad pregnancy and birth can be in some cases.  Because if more girls and women do know, they could decide to go the childfree route, and the ""prolifers"" don't want that happening.    So, they purposely minimize or even dismiss the dangers of pregnancy and childbirth, saying anyone who calls attention to those dangers is ""demonizing pregnancy"" or ""fearmongering."""
birdinthebush74,2020-01-09 12:34:38,fdn0bo2,t3_elyyuo,t1_fdmyvpo,"It they get their way by overturning Roe ‘ personhood ‘ for zygotes will be next ,it wouldn’t surprise me if they try to criminalise sex for people who are unmarried . They want a Christian theocracy"
Ruefully,2020-01-09 12:36:07,fdn0etu,t3_elwrdg,t1_fdmok4m,"The elderly, disabled, and infants are dependent on basic care. They are not dependent on someone's organs. They are fully formed and exist without being attached to another person. Their bodies function on their own. Their existence is an autonomous one.   This is not the case for a fetus. It cannot become autonomous without first being nonautonomous."
OceanBlues1,2020-01-09 13:19:17,fdn37st,t3_elyyuo,t1_fdn0bo2,"&gt;\*It they get their way by overturning Roe ‘ personhood ‘ for zygotes will be next ,\****it wouldn’t surprise me*** *if they try to criminalize sex for people who are unmarried.*   &gt;   &gt;They want a Christian theocracy.  It wouldn't surprise me either, because they want the ""old days"" back.  Which is why I can only hope Roe will never be overturned.  That would be catastrophic for all women still in their reproductive years.  As to the Christian theocracy idea, I have no doubt that's the case for many of them.  In one of the AbortionDebate threads, the ones who strongly opposed making birth control free -- or at least very low-cost -- were, I think, those most influenced by some form of Christian religion.   You know, the type that says stuff like ""women must bear children."""
birdinthebush74,2020-01-09 13:36:05,fdn4eum,t3_elyyuo,t3_elyyuo,R/childfree would like some words
nosleepforthedreamer,2020-01-09 14:31:27,fdn8qae,t3_elwrdg,t1_fdmzse2,"It’s always really bad. Our perception of badness has been shifted because people growing something inside themselves, pushing it through their genitals and suffering harm as a result is a daily occurrence in society."
OceanBlues1,2020-01-09 14:32:03,fdn8s1d,t3_elyyuo,t1_fdmlowx,"&gt;*Woman = Must have children*  Yep, that's their mindset, whether a woman wants to or not.  They really don't like women ""noping"" out of motherhood (or out of having more kids) by using birth control or abortion to prevent pregnancy or birth from happening."
nosleepforthedreamer,2020-01-09 14:32:23,fdn8t0b,t3_elwrdg,t1_fdmafz5,O.O
OceanBlues1,2020-01-09 14:34:41,fdn8zvk,t3_elyyuo,t1_fdmtwsc,"&gt;*I was thinking of the woman holding the baby saying ""I won!"" &amp; the woman holding the award saying ""No you didnt.""*  This works more for me than the reverse, even though I've never won any awards."
Shan132,2020-01-09 15:33:49,fdneefw,t3_elyyuo,t1_fdmki3s,Yep exactly  Their stance is anything but “pro life” it’s just pro forced birth
ActualFaithlessness0,2020-01-09 16:49:57,fdnm0jj,t3_elyyuo,t3_elyyuo,"Oh come on.  Listen, I love babies. (Of course, I've never actually been responsible for one, but...) My favorite part of working at a pool when I was younger was watching families bring their babies. I watch YouTube videos of babies. The other day, I got drunk and ended up cuddling my favorite baby doll from childhood and promising to give it a good life as though it contained the ""spirit"" of my eventual child. (I'm weird, and probably depressed.)  It took me a while to realize that not every girl/woman is like this- some *never* want kids, and that's fine! Forcing them to be mothers is how we get adults who hate themselves and have to exert an enormous amount of energy just to function in society. Even if the mother sucks it up, provides for the kid, doesn't abuse them, etc, the child can *always* tell if they're not wanted.  Furthermore, implying that motherhood is more important than career for a woman is sexist, full stop- you would NEVER see a meme like this with a man holding a trophy vs. a man holding a baby."
ActualFaithlessness0,2020-01-09 16:55:50,fdnmm7l,t3_elyyuo,t1_fdm5r74,"&gt;Is that a conversation you have with your children?  This is a conversation you should *not* have with your children if you can avoid it.  &gt;If your parent is pro-choice, odds are you are, too.  This is not a guarantee. Children grow up (or at least reach an age where they know how to Google) and have exposure to different opinions, and can pick up ones they were not raised with at all. Another reason why you should *not* tell your children that you had an abortion."
nosleepforthedreamer,2020-01-09 17:00:50,fdnn4p4,t3_elyyuo,t3_elyyuo,"Okay so this mom knows “what’s really important” but instead of deciding that’s what is meaningful *to her*, instead of just being happy that someone else is happy, she feels the need to put down that other person’s accomplishment?  What a smug, nasty attitude this “cartoonist” has, to find joy in putting others down.  I have nothing against parents. If people have children without hurting themselves or another person, ie by adopting one of the many children who need a home, more power to them. I can’t say what others should find meaningful. I wish these people who pat themselves on the back for knowing “what’s truly meaningful” could find some grace and humility."
nosleepforthedreamer,2020-01-09 17:04:19,fdnnhhq,t3_elyyuo,t1_fdlhatu,"Unfortunately people spit on men who accidentally impregnate a woman but don’t want to be fathers or give up their income. Abortion rights are first and foremost about the self-sovereignty of pregnant individuals and those who can become pregnant. But they need to happen partly because when women have the absolute right to abort, men should have the right to walk away from a “responsibility” that it wasn’t their choice to create."
nosleepforthedreamer,2020-01-09 17:11:05,fdnoaqe,t3_elyyuo,t1_fdldsb7,"And if you don’t believe that, especially if you’re a woman, you’re laughed at by this resurgence of traditionalists. Who unfortunately are creating a false image to gain popularity. Called irrational, oversensitive, selfish, and probably a feminist.  It’s vile. If you’re female and know your worth, you are stupid, silly, petty and obnoxious. (Not all feminists but I’m referring to the stereotype.)"
nosleepforthedreamer,2020-01-09 17:11:33,fdnocso,t3_elyyuo,t1_fdl8epj,There are women preying on other women with this garbage.
nosleepforthedreamer,2020-01-09 17:12:52,fdnoirb,t3_elyyuo,t1_fdm261q,I love this.  “Let *us* define your happiness! We know what’s best for you. Because nature logic evolution and E G G S “
nosleepforthedreamer,2020-01-09 17:16:14,fdnoxyk,t3_elyyuo,t1_fdmmj9i,Change the culture so that women shuffle around with their heads down and apologizing for thinking they were worth defending from harm.
nosleepforthedreamer,2020-01-09 17:20:04,fdnpfhx,t3_elyyuo,t1_fdmou6k,Bring up any logical point about people being individuals who can decide their own happiness   and cue whiny screeching voice “B-b-but *children!!!*”  “Children” is a bomb word. Its introduction blows everything else away and disagreement with the person using the emotional argument makes you a terrible monster. I’m really starting to hate bomb words honestly.
nosleepforthedreamer,2020-01-09 17:21:54,fdnpnux,t3_elyyuo,t1_fdmki3s,“We hurt people and we’re still the good guys”
nosleepforthedreamer,2020-01-09 17:23:52,fdnpx0e,t3_elyyuo,t1_fdnm0jj,Self-made men are to be worshipped but self-made women are uppity broads who don’t know their place  -Molyneux and his drooling culty sycophants
hadenoughoverit336,2020-01-09 17:57:28,fdntqa6,t3_elyyuo,t1_fdl705h,"I love that idea! If there's any artists here, that would be really cool!"
vikingprincess28,2020-01-09 19:38:55,fdo4h9l,t3_elyyuo,t1_fdmmj9i,Sure did lol
ModularMollusc,2020-01-09 20:29:41,fdoaoca,t3_elyyuo,t3_elyyuo,"Forced-birthers show themselves to be obtuse, especially in relation to this. They took a moving thing of beauty and power, nearly sacred, and tore it to pieces, insulting along the way. If they could stone her, they would. There is no appreciation for her oratorial skill and skill of critical thinking, or for the glow of accomplishment and wanted motherhood. In the cartoon she's got curves, while the brood mare that never wanted that child is a potato in a sack.   Forced-birthers, please: get therapy, please."
Ruefully,2020-01-09 20:36:32,fdobins,t3_elyyuo,t1_fdmmj9i,"Abortion will never be considered unacceptable, at least by the women who need them. And they will continue to happen, legal or not. Women do not want to be forced into martyrdom. Having something inside you, growing, changing your body, damaging your body against your will is something many women find horrific. In no past, present, or future could it ever be acceptable to force someone to take on that burden."
birdinthebush74,2020-01-09 20:44:34,fdoci8q,t3_elyyuo,t1_fdobins,"That reminds me of an anecdote , I think from the book ‘ The common secret ‘.   It’s the story of an abortion Dr , Susan Wicklund . She performed an abortion and the patient wanted to know  when the mace would be used . The patient had been told that a mace like instrument would be inserted and painfully scrape her uterus  as part of the abortion .Still she was so desperate not to be pregnant she would of submitted to torture"
nosleepforthedreamer,2020-01-09 20:53:20,fdodm2f,t3_elyyuo,t3_elyyuo,Anyone else notice that cartoon Michelle has sexy hips while the woman on the right doesn’t have them exaggerated like that? Like they’re mocking successful women’s attractiveness as shallow?
imbalancedMortician,2020-01-09 21:30:02,fdohrn4,t3_elyyuo,t1_fdodm2f,"The mother character looks like a twelve or fifteen-year-old girl, not a woman."
TuxedoPocket,2020-01-09 21:44:06,fdoj88l,t3_elyyuo,t1_fdohrn4,What really bothers me is the looks on their faces. Like Michelle is supposed to be disappointed or something stupid like that.
phantomreader42,2020-01-09 22:06:41,fdolk0x,t3_elyyuo,t3_elyyuo,/r/GatekeepingYuri [has you covered](https://www.reddit.com/r/GatekeepingYuri/comments/emcgi0/saw_on_facebook/).
Yosoy666,2020-01-09 22:07:27,fdolmy7,t3_elwrdg,t1_fdlsq39,"Less than 50% if fertilized eggs successfully implant. There are just as many spontaneous abortions as induced ones. Then some result in a stillbirth. Permanent incontinence, uterine prolapse, depression, and torn genitals aren't normal. People choose not to talk about those things."
hadenoughoverit336,2020-01-09 22:17:40,fdomnyr,t3_elyyuo,t1_fdolk0x,Love it. Upvoted!
Atomwafflehaus,2020-01-10 01:55:34,fdp6sm9,t3_elyyuo,t1_fdmmxgv,"Abortion and birth control will never be banned, luckily. Republican candidates always promise that. It's like how Democrats promise universal this and that, yet never deliver. Remember when everyone thought Bush II was going to stop abortion? Yet here we are. The real fight is at the State level. More people need to vote in State elections, most don't! I will always vote pro-choice no matter if my candidate is for or against it."
hadenoughoverit336,2020-01-10 21:38:01,fds04d7,t3_emxaid,t3_emxaid,"Someone did another good one!  https://www.reddit.com/r/wholesomememes/comments/emsmkb/be_proud_of_the_goals_you_accomplish_and_join_in/?utm_medium=android_app&amp;utm_source=share  I love it! Such a positive, and constructive way to respond to the original picture!  Edit: When I said, ""First"", I meant ""original'."
VampireKabuto,2020-01-10 21:42:26,fds0wqt,t3_eixlsz,t1_fcve970,That's why I said metaphorically. Maybe my word choice wasnt the best. I'm a member so I'm aware they dont.
Nparallelopposite,2020-01-10 22:35:35,fds6xt0,t3_eixlsz,t1_fds0wqt,Same lol
Ruefully,2020-01-10 22:41:46,fds7i7s,t3_emxaid,t3_emxaid,"If PL aren't sexist, then why is the original a statement of not only women needing children to be happy, but also pitting women against each other?  Women supporting women, as it should be. Sexism towards women has a sad history of turning women against each other."
cand86,2020-01-11 01:26:48,fdsosxj,t3_emxaid,t3_emxaid,Love it!
Bitter-ish,2020-01-11 02:36:17,fdt02fs,t3_emxaid,t3_emxaid,There's another version where someone made them a couple.
GoldTorch,2020-01-11 03:15:27,fdt6fuz,t3_emxaid,t1_fdt02fs,That’ll really rustle their human rights denying jimmies.
SushiMelanie,2020-01-11 03:18:13,fdt6uxo,t3_en1ttl,t3_en1ttl,"But, you know, never ask daddy, because misogyny."
Ruefully,2020-01-11 03:29:45,fdt8pgz,t3_en1ttl,t3_en1ttl,"Shouldn't it look look like a shrimp? Last I checked, abortions don't happen 6 months postpartum."
VampireStereotype,2020-01-11 04:27:36,fdthjqe,t3_en1ttl,t3_en1ttl,Why does it have chicken pox?  And why is a few week old embryo an 18 month old baby in heaven? And why is an 18 month old baby talking like a five year old?  I am more confused than chastened.
imbalancedMortician,2020-01-11 05:12:50,fdto1vj,t3_en1ttl,t3_en1ttl,"Pfft, if there's a line of babies in heaven waiting to be born or some shit I'd say it was worth it to keep them away from my uterus. Pick someone else!"
VampireStereotype,2020-01-11 06:01:05,fdtum98,t3_en1ttl,t1_fdto1vj,"&gt;Pfft, if there's a line of babies in heaven waiting to be born  Don't Mormons literally believe exactly this?  And that those babies are already married."
breadandbunny,2020-01-11 07:27:29,fdu500d,t3_en1ttl,t3_en1ttl,Can someone explain to me who is in the meme? I keep seeing these but I'm out of the loop.
hadenoughoverit336,2020-01-11 08:14:02,fdualfr,t3_en1ttl,t1_fdu500d,"It's Michelle Williams. When she gave her speech at the Golden Globes, she went into how she wouldn't have been able to accomplish what she did, without the right to choose. If you're sorting by ""hot"", you should be able to see where someone posted the clip of her speech."
birdinthebush74,2020-01-11 08:14:09,fdualy3,t3_emxaid,t1_fds7i7s,The original was so dismissive of women with fertility issues
meowqct,2020-01-11 09:16:17,fduk69w,t3_emxaid,t3_emxaid,"They both ""won""."
Skeewishy,2020-01-11 09:39:34,fdun1gx,t3_en1ttl,t3_en1ttl,The baby is literally in heaven what is it even complaining about?
BaileysBaileys,2020-01-11 09:44:12,fdunl6l,t3_en1ttl,t3_en1ttl,"Apparently the baby is holy. He has an aureola.   As always, prolifers don't attach that same value to innocent women.  *edit: areola --&gt; aureola. there's a difference! hahaha"
GoldTorch,2020-01-11 13:43:35,fdvq7fb,t3_en1ttl,t3_en1ttl,"Yes, it was lmao"
HolaHulaHola,2020-01-11 15:45:39,fdwd5d9,t3_en1ttl,t1_fdthjqe,Logic beats pro-liar MEME every time.
HolaHulaHola,2020-01-11 15:46:15,fdwdail,t3_en1ttl,t3_en1ttl,I should have titled this pro-liar logic.  My bad!
