author,created_utc,id,link_id,parent_id,body
serenity_calamity,2020-01-16 03:50:57,feitb5o,t3_ep3ygz,t1_feipgn3,"*rage*  Please don't do this argument, ever. I have seen 'a fetus isn't human' (then what is it?) and 'viability is what matters (no. Just no.) so many times it makes me want to pull my hair out."
VampireStereotype,2020-01-16 04:02:34,feiu8jj,t3_ep3ygz,t1_feitb5o,"To be honest, I don't remember the last time I actually saw someone stooping to this terrible argument. I sort of told them off about it.  It really does do more harm than good."
dunn_with_this,2020-01-16 18:36:40,fekgwn3,t3_ep3ygz,t1_feib5a1,Maybe try a different example. Even Guttmacher uses this 99% statistic: https://www.guttmacher.org/journals/psrh/2005/reasons-us-women-have-abortions-quantitative-and-qualitative-perspectives
Gullible-Confection,2020-01-16 21:02:41,fekvoo2,t3_ep3ygz,t3_ep3ygz,My displeasure with the “consent to sex is consent to pregnancy” has less to do with abortion than it does with the misuse of the word “consent”. Even if the statement was true that agreeing to sex meant a woman agreed to become pregnant it isn’t a meaningful anti-abortion argument because it doesn’t address that consent is ongoing and may be withdrawn.
d3dgirlwalking,2020-01-16 22:51:39,fel6htl,t3_ena525,t1_fdzj6ns,"i saw a forced birthed on facebook say this is a stupid argument, because it's women's faults for being pregnant so why should the government pay to raise her (unwanted) child? it's so sad that not ONLY do they want us to be used as incubators, but then we need to pay for the thing they forced us to push out."
Wolvesrfun,2020-01-16 23:56:05,felcitr,t3_ena525,t1_fel6htl,"1. Takes two to tango. If women should be forced to be parents, force the men too. 2. If government didn't help pay to support kids, a lot of your shit would be hella expensive. Then you'd be bitching about that.  2b. Your ""poor precious uwu angel babies gifted from God themself"" will DIE when the mothers give birth if they are too poor to care for themselves or their unwanted kids. Congratulations, you killed a woman and an actual baby, instead of letting a mother abort before it could become one.   So they need to take that attitude and shove it up their ass. While they're at it, let them become the incubators. ""It's not fair to force someone to be pregnant."" NO SHIT!"
Eev123,2020-01-17 01:53:03,felmvwa,t3_ep3ygz,t1_feinanv,"It’s not worth engaging with that person. They told me over message “once a woman consents to one thing, they automatically consent to other things”  They are a straight up rape apologist"
FairyKite,2020-01-17 02:05:43,felnzrx,t3_ep3ygz,t1_felmvwa,"That's similar to what they said in their message to me. Basically that consent to sex is giving up one's bodily autonomy in order to ""create life"". Thank you for the heads' up, I won't be engaging with them further."
clairegordon,2020-01-17 09:25:13,femfpqk,t3_en1ttl,t3_en1ttl,Hella.
lilywilybily,2020-01-18 00:02:14,feouiy1,t3_ek3y7e,t1_fd9o09u,you assumed their gender for all you know they could be a girl
lilywilybily,2020-01-18 00:03:32,feouniq,t3_ek3y7e,t1_fd62nih,and the award to cringiest comment goes to...
TuxedoPocket,2020-01-18 00:12:39,feovlf5,t3_elyyuo,t1_feorgx6,I’d rather have the trophy. Fuck that baby
lilywilybily,2020-01-18 00:13:50,feovpjg,t3_elyyuo,t1_feovlf5,a trophy that you’ll just sit on your shelf and eventually forget about? 😂😂😂 get a life
TuxedoPocket,2020-01-18 00:14:24,feovrk6,t3_elyyuo,t1_feovpjg,A baby bitches and cries and takes all my money.  I have a life because I don’t have to cater to some stupid drool goblin.
TuxedoPocket,2020-01-18 00:15:41,feovw4a,t3_elyyuo,t1_feovru6,"dIsGusTinG  Look, no one’s impressed by your moral superiority complex here, and no one cares about you or your feelings in this sub.  The baby is dead. Die mad about it. Move on."
TuxedoPocket,2020-01-18 00:17:46,feow3fj,t3_elyyuo,t1_feovz7b,"Mocking is actually quite common in adults, but since you insist... Counterpoint:  You came to this sub to get attention. You got it. Quit bitching about how it’s presented. I gtg for a bit. Ttyl, I’ll be back later."
Juratory,2020-01-18 21:20:26,feu2bwj,t3_ekfk1i,t3_ekfk1i,"This is what I've been saying all along too! Moderates cannot be trusted when it comes to the debate of abortion or being pro-choice in general. Like, pick a fucking side already."
nosleepforthedreamer,2020-01-18 21:24:31,feu31bc,t3_ekfk1i,t1_feu2bwj,"Or, just pick the side that's against torturing innocent people and handing a thing the right to access them against their will.  Speaking of that, forced birth is no different than if the government announced that a special class of people has the special right to rape others and take their blood and organs."
Rose3Karina,2020-01-26 05:15:39,ffk4o2y,t3_elyyuo,t1_fdmy4we,"If a woman has to give birth in order to be ""real"" then I'll happily be a fake woman"
JJsGirl83,2020-02-25 11:43:50,fiq0u8i,t3_eik826,t3_eik826,"""But you could keep the baby and have it adopted""  ""It's natural for women to be mothers""  ""Think of all the women who are desperate for kids""  And any argument that involves religion or god(s)."
Canxan34,2020-06-08 09:42:25,ftcs88p,t3_gyw6y6,t3_gyw6y6,How prolife of them
pauz43,2020-06-08 13:51:47,ftdaofx,t3_gyw6y6,t3_gyw6y6,About what we'd expect from people who believe in punishing women for having sex.
suddenwoven-,2020-06-08 13:55:36,ftdb2dl,t3_gyw6y6,t1_ftcs88p,"Right? This isn’t my perspective, but to them should that not be two deaths?  You’d think they would advocate for as few deaths as possible given their ideology of what constitutes sentience."
ugh_wig,2020-06-08 14:41:40,ftdfzn1,t3_gyw6y6,t3_gyw6y6,So where’s the pro life sentiment is they’re trying to potentially kill the mom??
InsomniacEnglish,2020-06-08 16:00:47,ftdp5j5,t3_gyw6y6,t3_gyw6y6,"Just more glaring hypocrisy from the anti-choicers. Nothing shocks me anymore. They're pro-fetus and anti-womxn. It will always come down to this, no matter what mental gymnastics they do in their heads to justify their feelings."
touchybiscuit,2020-06-08 16:34:21,ftdt6e8,t3_gyw6y6,t3_gyw6y6,"This reminds me of one guy I spoke to who said that it's ""poetic justice"" when women die during back alley abortions :("
CanadianSweater,2020-06-08 20:10:25,ftejica,t3_gyw6y6,t3_gyw6y6,"Nono guys they have a point we made drugs illegal and nobody uses them anymore! ...oh wait...   Making abortion illegal literally wont stop them from happening they'll just be more dangerous. And taking away PP will take away affordable HEALTHCARE for millions of women. Congrats, on your quest to spread your own personal moral message you're hurting millions of women who you don't even know."
sharkslutz,2020-06-08 21:29:01,ftet4mm,t3_gyw6y6,t3_gyw6y6,"Or they'll say that even if it does, it's not that many and it will make us be more responsible. I had a guy tell me that if a woman dies from shoving a hanger up herself, it's her own fault for being that stupid. Uhhh, excuse me? Having sex doesn't make you a slut, and if you think that killing ourselves to not be pregnant isn't worth fighting to end, then you cannot call yourself pro-life because you don't give a shit about anyone else."
birdinthebush74,2020-06-08 22:16:34,fteypng,t3_gz93en,t3_gz93en,It’s a common argument from them.
Wolvesrfun,2020-06-08 23:35:25,ftf7h5s,t3_gz93en,t3_gz93en,"A toddler isn't using your organs, Brenda."
ITriedSoHard419-68,2020-06-08 23:39:47,ftf7y44,t3_gz93en,t1_ftf7h5s,"They’ll of course argue that the toddler or baby will use your breasts.  So add to that, “and if they are, you can still get rid of them in the most reasonable way available” (adoption)"
Wolvesrfun,2020-06-08 23:45:22,ftf8je7,t3_gz93en,t1_ftf7y44,"I always just spit back ""Formula."" And then they get mad at me because formula is a ""scam to poison my InNoCeNT bAAaAAbYYY."" Every once in a while you get a religious nut who gets pissed at the idea of a woman not breastfeeding like how God designed women, despite whatever reason the mother has."
AWeirdGuyOnAScooter,2020-06-08 23:52:30,ftf9aob,t3_gz93en,t1_ftf8je7,Yeah lol. My sister was just given formula instead of breastmilk and shes fine.
Wolvesrfun,2020-06-09 00:09:41,ftfb55j,t3_gz93en,t1_ftf9aob,"My sisters and I had formula too. It's a life saver for many mothers, since lots of women can't breastfeed."
lewd-spagghetti,2020-06-09 02:02:36,ftfmyjh,t3_gyw6y6,t1_ftdt6e8,what the actual f**k omfg do you have a screenshot or a link?
InsomniacEnglish,2020-06-09 06:33:24,ftga7sk,t3_gz93en,t3_gz93en,"They always draw a false equivalence by using born children or people in their silly ""so can we just kill _____ if we don't want them anymore?🥴"". It's a totally useless argument on their part."
touchybiscuit,2020-06-09 07:37:06,ftgedzi,t3_gzhwi3,t3_gzhwi3,I'm sick of these cunts hijacking the deaths of George Floyd and covid-19 victims. Fuck right off.
birdinthebush74,2020-06-09 07:56:15,ftgfkq2,t3_gzhwi3,t1_ftgedzi,"But it’s logical for them as they genuinely think a zygote has the same value as a newborn  It’s not great PR for them though, they will always  be linked to that and their support of the self proclaimed  ‘most prolife president ever’ Trump."
touchybiscuit,2020-06-09 08:04:04,ftgg20h,t3_gzhwi3,t1_ftgfkq2,Not all logic is good.
MLLE123,2020-06-09 11:16:29,ftgrn98,t3_gzhwi3,t3_gzhwi3,😡🤬knowing good and well they don’t give a fuck about George Floyd or Black lives until it’s convenient to use them against a Black woman (who they probably look down on when they’re happily pregnant to begin with)
areyouminee,2020-06-09 11:25:59,ftgsayi,t3_gzhwi3,t3_gzhwi3,Please tell me that what happened afterwards is that they beat her ass
OceanBlues1,2020-06-09 12:59:38,ftgzurp,t3_gz93en,t1_ftga7sk,"&gt; *It's a totally useless argument on their part.*  True, and I found (after a while) that it's just as useless for us to keep telling them that a fetus **isn't** a toddler or older child."
phantomreader42,2020-06-09 13:09:39,fth0ssg,t3_gyw6y6,t3_gyw6y6,Killing women is their GOAL.  The whole point of the forced-birth cult is to make sure more women suffer and die.
Yosoy666,2020-06-09 14:40:04,fthagni,t3_gzhwi3,t1_ftgfkq2,They pull the same thing all the time. They didn't get backlash from their side when they used Tamir Rice
MLLE123,2020-06-09 14:49:19,fthbj61,t3_gzl5pi,t3_gzl5pi,It should read “Can *someone* create a sort of “shame on you abortion protesters” flair?
asyouwish,2020-06-09 15:43:01,fthhx8v,t3_gzl5pi,t3_gzl5pi,I wonder what Lego thinks of that product placement! I smell a cease and desist.
Flyingtypewriter,2020-06-09 15:46:59,fthieuj,t3_gz93en,t3_gz93en,"Mr Weird Guy on a Scooter, just so you know birth is extremely painful so thank you for being empathetic on that end. Also, for every woman is different but in my personal experience the hormones of my pregnancy made me very suicidal and the postpartum depression was unbelievable, add hours of no sleep and other personal factors that was unbearable and I never want to be pregnant again.   But yes kill toddlers, who cares they were already born."
MLLE123,2020-06-09 15:49:18,fthip6t,t3_gzl5pi,t1_fthhx8v,Maybe it’s there for one of the dozens of protester’s kids that they bring to the protests. I sure as hell hope it’s not some “bonus” or “incentive” not to aBoRt yEr pReShus bAbYyy!!!”
asyouwish,2020-06-09 15:50:45,fthivp1,t3_gzl5pi,t1_fthip6t,"Right, but do you think Lego wants prominent display of their brand on any abortion-related topic? I doubt they do."
Yaroslavorino,2020-06-09 15:51:52,fthj0r0,t3_gzl5pi,t3_gzl5pi,"""I will adopt your baby""   I would bet that they wouldn't."
TrashleyRN,2020-06-09 15:51:58,fthj153,t3_gzl5pi,t3_gzl5pi,"The woman in blue:  “I was able to choose abortion two times when I didn’t want to be pregnant. Now, 21 years later, I regret both of my abortions. Because of my feelings, I don’t think you should get to choose what happens to your body.”  This image screams mental instability."
finnasota,2020-06-09 15:53:15,fthj6u7,t3_gzhwi3,t3_gzhwi3,"Even if she is an embarrassment to the overall pro-life movement, it takes courage to protest- unless she is regarded as heroic for this in her immediate social circle, then it would take courage to control her ego and find a more respectful way to articulate her thoughts."
MLLE123,2020-06-09 15:54:05,fthjajx,t3_gzl5pi,t1_fthivp1,Legally I guess the problem would be if they were advertising their services somehow using Legos
calladus,2020-06-09 15:56:20,fthjktz,t3_gzl5pi,t3_gzl5pi,"""We will adopt your baby""  pffft bwahahahahaha!  I wish we lived in some Science Fiction alternate universe where we could pop unborn fetuses into a small ""stasis box"" so they could be implanted in someone else.  The woman would walk out of Planned Parenthood with a small stasis box, push it football style into the chest of a protester, and say, ""Knock yourself out!""  It would be the end of all protests.  All you would see is abortion signs fluttering to the ground, and the assholes and elbows of fleeing protestors."
MLLE123,2020-06-09 16:02:10,fthkb21,t3_gzl5pi,t1_fthj153,"More like “Now that I was able to save myself from poverty and/or abuse and I’m in a better place that I’ve finished my education and have adequate income and a loving spouse directly as a result of those abortions, I’m can now comfortably look down on these women in society that were once in my shoes with some imaginary fairy tale bullshit “"
KatnissEverdeen190,2020-06-09 16:06:59,fthkwuf,t3_gzl5pi,t1_fthj153,"&gt;I don’t think you should get to choose what happens to your body   The sad thing is that she doesn’t deny it’s your body when most pro-lifers deny that. I feel bad for her because although it’s not common, some women deeply regret abortions and I feel sympathize with them because it can be traumatic like a pregnancy. Although I think women should obviously be able to choose what they do with their body."
oueeeeeceane,2020-06-09 16:11:09,fthlfcu,t3_gzl5pi,t3_gzl5pi,"If he's willing to adopt this ""baby"" is he also willing to pay for a surrogate mother and embryo transfer ? Because I'm definitely not letting that thing grow inside of me"
bigandlittledog,2020-06-09 16:14:41,fthlv4l,t3_gzl5pi,t1_fthjktz,Well why should they be punished for a dirty pregnant slut for having sex??? Maybe they should’ve just kept their legs closed!!! /s I hope that’s obvious
TrashleyRN,2020-06-09 16:16:25,fthm2z6,t3_gzl5pi,t1_fthkwuf,"You don’t think she votes prolife? I’m willing to assume she does based on her taking the time from her day to picket an abortion clinic.   Some people do have negative experience with abortion but that’s the case with everything. Instead of trying to manipulate another person’s decision and emotions, why not push to change whatever it was that caused her regret. Was it uninformed consent? Did she feel manipulated or pressured by a partner? Was it a socioeconomic reason? Abortion isn’t the actual problem."
MLLE123,2020-06-09 16:19:22,fthmg6d,t3_gzl5pi,t1_fthm2z6,Spot on! Most women regret the stigma of abortion not the abortion itself. The actual procedure in a first trimester takes about 5 minutes. They regret the way people made them feel and think about it.
nerdywall,2020-06-09 16:31:40,ftho05u,t3_gzl5pi,t3_gzl5pi,"Hmmm let's see three of those people presumably have no ability to have children, one of them had an abortion but now thinks that that option should be taken away from other women, and one of them thinks that pro choice is anti woman...."
KatnissEverdeen190,2020-06-09 16:54:40,fthqyh2,t3_gzl5pi,t1_fthm2z6,Oh I absolutely think she’s voted pro-life and I don’t think she should let her hatred for her abortion (but in reality the situation that caused the abortion) stop women from not getting one when they need to. I feel she might have been forced to have an abortion or there were consent involved.
Starri-Knight,2020-06-09 17:03:29,fths3b0,t3_gzl5pi,t3_gzl5pi,They say they'll adopt my baby but even if I had to give birth to my baby I would love it too much to give it to those people and let my clump of cells grow up to be like them... I'll probably give it to someone better than them at least
pielady10,2020-06-09 17:13:47,fthtdf0,t3_gzl5pi,t1_fthj153,"wow.  proud to be a hypocrite!    So she had the right to choose what was right for her, but let's take that right away from someone else!"
netxnic,2020-06-09 17:18:56,fthu0xv,t3_gzl5pi,t1_fthj153,"Have you ever seen that article from a while back titled ""The only moral abortion is my abortion"" ?"
EarthEmpress,2020-06-09 17:31:54,fthvp4y,t3_gzl5pi,t3_gzl5pi,“We will adopt your baby”  No y’all won’t. Please go look at how many kids are in foster care just in the state of Texas.
sgsg30,2020-06-09 17:41:51,fthwyjx,t3_gzl5pi,t1_fthvp4y,my exact thoughts. i want to see all pro-lifers ONLY adopt since they think it’s such an ideal option as opposed to abortion.
curious--owl,2020-06-09 18:03:50,fthzq13,t3_gzl5pi,t3_gzl5pi,"“We will adopt your baby,” I’ll believe it when I see it"
curious--owl,2020-06-09 18:04:55,fthzuvf,t3_gzl5pi,t1_fthj153,&gt; I was able to choose abortion   You’re welcome. You had the choice. Not my problem you regretted your choice.
ctrlaltdeletemepls,2020-06-09 18:22:03,fti20go,t3_gzl5pi,t3_gzl5pi,"The girl on the left end. Pro-life is not pro-women, it is more so pro-men! What if the women could not handle giving birth? And Women are the one’s asking for abortions so how could pro-choice not be pro-women? It’s not fair to make everyone do what you want just because you’e privileged and a simp to men"
AhYesAName,2020-06-09 18:56:38,fti6e5o,t3_gzl5pi,t3_gzl5pi,"“Pro-life is pro-woman!”    Sure, wanting to force pregnant people who do not want to stay pregnant to endure pregnancy, and give birth painfully is pro-woman.   Sure, shaming women who want an abortion with “you can’t have an abortion! You should have kept your legs closed!” and “you’re a murderer!” is pro-woman.   Sure, thinking fetuses are babies and valuing those fetuses over living, breathing people is pro-woman.   Sure, a movement called “pro-life” thinking that people who die in coat-hanger abortions “deserve it” is pro-women.   Sure, someone who probably got an abortion and now regrets it, and thinks that all women should feel the same as they do is pro-woman.  Yeah, I don’t think so."
Rose3Karina,2020-06-09 19:19:16,fti996d,t3_gzl5pi,t3_gzl5pi,"In response to some of the signs here  Adoption doesn't fix an unwanted pregnancy. It's only an alternative to parenthood  You're not ""pro woman"" if you think women shouldn't have autonomy. Pro woman doesn't mean making women turn to suicide and unsafe abortions and making teen moms drop out of school  Abortion shouldn't be banned because of regret. There's also women who regret having kids, that doesn't mean we should prevent people from giving birth."
PurpleJaguar,2020-06-09 20:20:30,ftih0k8,t3_gzl5pi,t3_gzl5pi,I love the irony of pro-life people going out and protesting during a pandemic.  Risking spreading a potentially fatal viral infection to innocent people? Check.  Risking placing further pressure on an already strained health system and thereby putting even more lives at risk? Check.     Pro-life? Check.
Zora74,2020-06-09 20:29:24,ftii4sy,t3_gzus84,t3_gzus84,Because of course we just lock up people with mental illness instead of treating them.
PurpleJaguar,2020-06-09 20:30:09,ftii8bw,t3_gzl5pi,t1_fthj0r0,"Yeah, I love it when pro-lifers say things like this.      ""I will adopt your baby!!!!""      Go on then, show us how serious about that you are. Go to social services and start the process of adopting an unwanted child right now. No-one is stopping you. If you are serious, go do it.   But you won't. Because you aren't."
Sapphire9306,2020-06-09 20:40:16,ftijhg0,t3_gzus84,t1_ftii4sy,"What shocks me so much is the lack of empathy. For the one hundredth time: pregnancy is NOT an “inconvenience.” It’s nine debilitating months of nausea, back pain, weight gain, heartburn, fatigue, mood swings, and not to mention all of the unforeseen complications that could happen. The fact that this person believes we should lock up suicidal pregnant women for NINE MONTHS is downright evil. It’s *dehumanizing.* It shows how pro-“lifers” really *don’t* care about women. We’re nothing more than mindless incubators in their eyes. Anything less than death is considered an inconvenience to them."
Canxan34,2020-06-09 20:50:33,ftikr7a,t3_gyw6y6,t1_ftdb2dl,"Eh, if you want to take prolife at face value instead of recognizing it as a marketing ploy for an antichoice movement. Prolife sounds better than antiabortion or antichoice"
Ruefully,2020-06-09 20:57:16,ftill64,t3_gzl5pi,t3_gzl5pi,"Blue shirt is an idiot. Pregnancy is not a disease...and neither are a plethora of health conditions, injuries, or other issues. Healthcare is not just used for disease."
Clownose,2020-06-09 21:00:39,ftim0gj,t3_gzus84,t3_gzus84,&gt; Someone rational isn’t going to kill themselves to avoid a temporary situation.  Huh. Almost like it’s a *mental illness* or something.
Brownie-1234,2020-06-09 21:06:57,ftimrzk,t3_gzus84,t3_gzus84,"If I knew I was going to be forced to endure nine months of slavery and torture, gestational or otherwise, I would kill myself. I guess I should be locked up now since I refuse to endure slavery or torture.   Being childfree and female isn’t a mental disorder and women who refuse to endure pregnancy and birth should not be imprisoned."
Brownie-1234,2020-06-09 21:15:00,ftinrgn,t3_gzwbf4,t3_gzwbf4,"How dare the thinking, feeling woman not sacrifice her life so her body could be cut open and a fetus be removed. Like I’ve said before, pro-life my fucking ass, they just want to punish, torture, mutilate, and kill women."
I-ate-your-pony,2020-06-09 21:22:03,ftiomsw,t3_gzwbf4,t3_gzwbf4,"Whatever idiot said that, deserves a big slap in the face. Had the birth mother died during the pregnancy (which seemed like a very likely scenario), the fetus would have died regardless."
terragutti,2020-06-09 21:28:08,ftipdu8,t3_gzl5pi,t1_fthu0xv,"Ugh. Yeah this is the same mentality as, its okay if i do it, but not okay if other people do it."
Brownie-1234,2020-06-09 21:31:01,ftipqk9,t3_gzwbf4,t1_ftiomsw,"This seemed more like an emergency situation. Seems like the doctor chose a 27 week abortion as opposed to a c-section or inducing labor because the woman was dying and wouldn’t survive being cut open or enduring labor. It seems like this asshole didn’t even want to force the dying woman to continue the pregnancy and maybe die in the process, they wanted to cut the woman open and force her to bleed out on the table so the fetus might live (good chance not to at 27 weeks) and the woman could die.  While forcing a woman to continue a dangerous pregnancy (any pregnancy) is monstrous, this situation is even worse, they want to kill women in order to produce children."
emskiez,2020-06-09 21:32:57,ftipz00,t3_gzus84,t3_gzus84,I had no idea having your body permanently harmed and disfigured was a “temporary situation”.
sharkslutz,2020-06-09 21:47:21,ftirpjs,t3_gzwbf4,t3_gzwbf4,"I had a later one as well. While it may not have been life threatening, I did not know I was pregnant for a very long time. I hadn't gained any weight and it was very normal for me to go several months without a period. I should have realized sooner perhaps, but growing up in a religious family where the very thought of having sex outside of marriage meant you were going to hell also meant that I did not know my body the way I should have. I had just ended an abusive relationship, was in college, and also severely depressed. So mine wasn't medically necessary to keep me alive, but it was what was right for me and who knows how I would have handled pregnancy in that state. I hate the convenience angle so much because I've never been through anything harder and it was not convenient at all. And I would still do it all again."
jrw2868,2020-06-09 22:10:53,ftiuhv9,t3_gzwbf4,t3_gzwbf4,Didn't you hear? Women are *supposed* to sacrifice their lives for their children. It's part of being a mom!! /s
Equipoisonous,2020-06-09 22:24:13,ftiw1sg,t3_gzwbf4,t3_gzwbf4,"They love to claim they support abortion if necessary to save the woman's life, but when it actually happens, they never feel it was justified."
piutharbheag,2020-06-09 22:29:26,ftiwnm6,t3_gzwbf4,t3_gzwbf4,"""Yeah I am pregnant. Let's wait till I am 7months preggo and get a late term abortion. Because I've heard abortions are great! All my friends got at least two and said it was the best thing they ever did!""  That's what prolifers think prochoicers do."
Sapphire9306,2020-06-09 22:35:32,ftixcu5,t3_gzus84,t1_ftimrzk,WeLl YoU sHoUlD’vE kEpT yOuR lEgS sHuT.
VanillaGhoul,2020-06-09 22:47:39,ftiyqhf,t3_gzwbf4,t1_ftiomsw,"I knew someone who didn't care if the abortion saved their life. Abortion is still wrong to her. She is nice lady and I don't think I've ever heard a mean thing out of her.  I think she is very wrong, much so, but I can't help but be dumbfounded because of her general personality. Oh well, very few people think that way and have failed constantly so far to try and get abortion illegal in general.   Next thing she'll tell me is that we should imprison women who had a miscarriage like many south American countries.  Then again I haven't seen her since I graduated high school."
Louielouielouaaaah,2020-06-09 22:48:08,ftiyse4,t3_gzwbf4,t1_ftiwnm6,If I have read that late term abortions are women “using abortions for birth control” once I have read it a million times.   No. Nobody does that. And nobody WANTS to have one. Idiots.
