author,created_utc,id,link_id,parent_id,body
sselinsea,2020-06-13 03:25:35,fuo41de,t3_h0dzh7,t1_fuo3e34,"I find pro life to be naive, in that they can solve problems while taking away personal choice. Especially when they get upset about first trimester abortions.  I used to believe in pro life, which is essentially my way or the highway. Pro choice isn't like that.  Bans only serve to say ""it's wrong"" but in practice, it may not be effective in actually curbing problems.  Just like conservative parents who claim that teaching about sex and protection condones premarital sex, while in reality it protects more people than abstinence would.  In the same way, allowing abortion doesn't mean you have to like it, but recognise that various women and reasons can't be solved with a blanket ban.  You keep saying the fetus is denied a life. Guess what? The woman has a life and future too. I side with her."
sselinsea,2020-06-13 03:44:00,fuo5oi0,t3_h0dzh7,t1_fuo4pgz,"So what if the fetus is the most innocent, precious thing in the world to you? **Even if it were granted human rights, it doesn't have the right to involuntarily tether to my body 24/7**. That is the issue pro choice is having, not whether the fetus is human or alive. **A foetus needs me to live and in doing so, imposes on my body.** A newborn is no longer involuntarily attached to the mother and can be passed to someone else without dying.  You tell me a fetus is an incremental stage like a child, teenager or adult. You tell me you don't need brains for life. Guess what? Life begins at conception is a religious sentimentality. It barely has any functions yet, and the body is so strict, this gets flushed out naturally. That is why hating first trimester abortion is bizarre.  If I am knocked up or raped while in school and wish to attend class without morning sickness and other more serious stuff, I would abort. **Even if I wanted the baby, the end result is the same: the fetus imposes on my body and affects my health.** I don't care how petty I come across to you: it's my education and future.  I have no heart for kids, and I don't want any, ever. That doesn't mean I advocate for killing those who are already born, I advocate for people to decide whether they can and want to birth new life into this world."
sselinsea,2020-06-13 03:56:12,fuo6r0g,t3_h0dzh7,t1_fuo4pgz,"&gt;In the vast majority of cases, a woman’s life is the not the alternative to the baby’s life.  If the only good thing about your life is ""I'm not dead,"" there are serious issues going on. I don't get why a woman should be pressured into hanging onto her life tooth and nail for ""a precious new life"", over her choosing to accept that (or steer away from that through an abortion).  &gt;Also nobody is advocating for a blanket ban, we can understand cases of rape and risk to the life of the mother.  Courts and burreaucracy move slower than a pregnancy. I don't want anything besides the pregnant person to judge them worthy of an abortion. Most pro lifers object to abortion in the face of poverty. Let people do their family planning lol."
jrw2868,2020-06-13 04:14:04,fuo89zq,t3_h7zsxr,t3_h7zsxr,It’s really really hard getting them to even see or consider the woman in the situation. They genuinely don’t understand that women are people.
sselinsea,2020-06-13 04:27:09,fuo9da5,t3_h7zsxr,t3_h7zsxr,"it's a simplistic mindset of ""The newly fertlised zygote is its own person, and therefore a baby. Babies are innocent, vulnerable and need our care."" therefore they claim to sympathise more with a fetus and a pro life woman, than a pro choice woman.  they shrug their shoulders if the fetus's death is natural. Heck, they are nonchalant about zygotes that are naturally flushed out. But are mad at women who take action to end it.  You can bring a horse to water, but can't make it drink. Take it from a former pro lifer to say it's a person's choice to walk away from the pro-life mindset."
sharkslutz,2020-06-13 04:50:06,fuob8ma,t3_h7zsxr,t3_h7zsxr,They're basically never going to stop shouting that we only have bodily autonomy until we are pregnant. And when you say that nobody can use your body without your consent they fail to understand that consent to sex is not consent to pregnancy. I think they all just need to explore their sexual urges and have an orgasm.
vocalfreesia,2020-06-13 04:58:23,fuobvyr,t3_h7zsxr,t1_fuo9da5,"They're also, on the whole, chill about embryos being destroyed in IVF clinics. They just want to control and harm women."
sselinsea,2020-06-13 05:00:25,fuoc1qf,t3_h7zsxr,t1_fuo89zq,"or they naively believe they can solve women's problems by banning abortion and giving all the help in the world. i don't know if they genuinely believe in this, or stop helping women once abortion is banned.  when the naive, well meaning ones realise that the systems swell beyond their capacity, it's too late."
sselinsea,2020-06-13 05:04:30,fuocd1l,t3_h7zsxr,t1_fuob8ma,"I told a pro lifer this: "" A woman can like dick in her vagina. She may even like ejaculate. But that doesn't mean she wants to be pregnant.""  This was to sell the point that consent to sex is not consent to pregnancy. Or in simple terms, ""I like sex, I may even like jizz. But I don't want to be pregnant.""  They replied, ""If you like unprotected sex you have to understand that you may become pregnant"" and it's immoral to abort any pregnancy that results. The point of ""pro choice understands that sex might lead to pregnancy, we just don't want to be pregnant"" flew over their head."
InsomniacEnglish,2020-06-13 05:06:07,fuochiz,t3_h7zsxr,t1_fuoc1qf,"If they offered me a million pounds, and said that they would pay for every single thing the child needs until it is finished its education (including pay for university of they wanted to go) I still would not want to be pregnant again. They could offer me all the money in the world and I would refuse it. I cannot safely carry another Pregnancy, but if I could, I just don't want to. I don't want to do the baby stage again, I don't want the shit explosions and the vomit in my hair, being so tired I felt like I could sleep standing up, the standing up and swaying aide or side for hours... Hard pass.   They could solve every single one of society issues and pay 100% of the costs of raising the child and some people still would not want to be pregnant or raise a/nother child."
Ruefully,2020-06-13 05:35:36,fuoep2v,t3_h7zsxr,t3_h7zsxr,You can't. They're set in their way. Don't expect to change their minds. You can only change the minds of fencesitters or those who are not passionate on the subject.
JJsGirl83,2020-06-13 08:36:15,fuoq8h2,t3_h7zsxr,t3_h7zsxr,"I would also like them to realise that there is no way in the world that I would stay pregnant under any circumstances. It wouldn't matter if artificial wombs were actually viable, or if they offered to adopt the baby or if they offered me money to try and convince me to stay pregnant and keep the baby. None of those things are a good enough reason for me to stay pregnant."
Iewoose,2020-06-13 11:10:00,fuoywjs,t3_h7zsxr,t1_fuo89zq,They think women who don't want to gestate fetuses are mentally ill and it makes me want to throw up a little.
sselinsea,2020-06-13 11:59:06,fup1ybq,t3_h7zsxr,t1_fuoywjs,"or stupid, or evil"
Iewoose,2020-06-13 12:41:21,fup4wh4,t3_h7zsxr,t1_fup1ybq,Recently someone posted a poll there what punishment should be given for abortions and one commenter said 15 years in prison for the provider or pill distributor and mental help for a woman. Didn't stick around for longer.
VampireStereotype,2020-06-13 16:03:18,fupnhfn,t3_h8a1fc,t3_h8a1fc,"While most forced-birthers certainly do think that women are... ""incompetent and mentally ill dumbasses incapable of making their own decisions"" (eloquently put) I think we all can see this as a lie intended to make forced-birth seem more palatable to outsiders.  If forced-birthers were given their way, women who seek abortions would be punished harshly. They say as much when they think outsiders are not listening."
sselinsea,2020-06-13 16:09:33,fupo5kk,t3_h0dzh7,t1_fuplrr0,"&gt;The problem is: you think it imposes on you “without your consent”, but you were the one that failed to use protection, you were the one that went out and had unsafe sex.  Don't assume that pro choice does not understand cause and effect. I can dislike a natural consequence and do anything to keep it away. Who knows? The woman who likes jizz may have a partner who got himself snipped.  &gt;If you invite someone to a party and they stay the length of the party, that’s not imposing on you, that’s a completely normal result of your actions.  Pro life likes to say I *consciously* invite someone to my house only to kill him. But pregnancy is not a conscious decision, it happens whether I consciously wanted to be pregnant or not. It would be ideal if a pregnancy would only occur if both partners consciously want it, but we don't live in an ideal world. Sex and pregnancy is personal, and so is abortion.  Anyway, I don't agree that a foetus takes precedent over the woman no matter what, even if she hates condoms or forgets the pill. I won't wish the effects of pregnancy on my worst enemy.  &gt; A) The unborn develop in incremental stages the same way the born do, dosent mean a teenager is less human than an adult.  The issue here is a foetus squashing my organs and compromising my health. That is why we don't kill newborns, toddlers, children, *teenagers, and adults*: they don't need to compromise my body to survive. Even a newborn has all of its parts: most abortions are done first trimester where they don't have a brain to comprehend, and pain receptors to feel.  *But most importantly, it is easier to remove before it develops further, gives the woman nasty pregnancy symptoms and harder to remove.*  Heck, your problem isn't fetus death, because the body does flush zygotes and fetuses out. You care about the woman raising her hand against the course of nature.  &gt; Buddy, calling the fact that life begins at conception a ‘religious sentiment’ does not disprove the other things I told you, it’s just a last-resort accusation that has no actual meaning.  If life begins at conception, why aren't you mad about the zygotes that get flushed out of the body? There is a reason why trying for a baby isn't easy! Again, it's not about death: it's about what the woman does that you have a problem with.  I repeat: it having human rights doesn't mean I am obligated to be its donor 24/7. Bodily autonomy is a *personal matter.* It would be better if every child is a wanted child, but not every parent can grant that."
Brownie-1234,2020-06-13 17:30:07,fupx58f,t3_h8a1fc,t3_h8a1fc,"What if I buy black market abortion pills and ingest them? No doctor involved, so do I get life in prison for ingesting a pill or am I just an incompetent victim of my womanly brain?"
sselinsea,2020-06-13 18:06:08,fuq11ah,t3_h0dzh7,t1_ftrf0be,"&gt;Again, I gain absolutely nothing from you having a kid   &gt;   &gt;But FYI, I’m Gay, and I completely plan on adopting eventually.  I don't care if it's harder for you to have a kid. No one owes you a kid. And I don't owe the fetus my body and my life."
Sapphire9306,2020-06-13 18:15:19,fuq218s,t3_h8a1fc,t1_fupx58f,"One said that you should be charged for theft, but not murder."
Brownie-1234,2020-06-13 18:16:18,fuq257r,t3_h8a1fc,t1_fuq218s,Ingesting a pill that expels the contents of my uterus is theft to these people? 😂
jrw2868,2020-06-13 18:21:21,fuq2quz,t3_h8a1fc,t3_h8a1fc,"I LOATHE this viewpoint. As if women who want abortions are all helpless victims. I certainly wouldn't be if I had an abortion; I'd be choosing it knowing exactly what I'm doing and why, with all my mental faculties intact and not because someone is forcing me.   This is so condescending. I'd rather forced birthers just admit they hate women and think one in four women in America is a baby-murderer."
Sapphire9306,2020-06-13 18:24:37,fuq34lj,t3_h8a1fc,t1_fuq257r,Yep. Go on r/abortiondebate and click on the post asking pro-“lifers” how abortion laws would be written if it were up to them. I laughed so hard at the comments that I legit thought I would suffocate. 😂
sselinsea,2020-06-13 18:55:52,fuq6to0,t3_h0dzh7,t1_fuq5lpp,"&gt;Nobody in the pro life world has any vested interest in controlling women, we achieve nothing from it, we make no profit, it has zero benefit to us.  Controlling a woman's body, sexuality and life is a byproduct of pro life beliefs whether you believe in controlling women or not.  I haven't met one who doesn't want all or any of the following: to throw abortion doctors in jail, women in jail, women for ""counselling"" (telling her why she's ""wrong""), and the most egregious of all: shutting down save avenues for abortions.  **Who are you to tell her you know more about her, than herself?**  &gt;abortion is unnatural, unnecessary and artificially alters human life.  &gt;Abortion is unnatural, miscarriage is not.  Don't use nature to your own benefit when there is also syphilis. Access to contraception and abortion is unnatural, yet increases women's quality of life*. Life isn't just about popping out babies anymore: in developed, stable nations, women can choose when they want to have kids (or even if they want to have kids) to pursue education and greater career opportunities.  *Don't tell me hospitals giving maternal care increases my quality of life. You can pay off my hospital bills and the kid's expenses until they're an adult. It won't change the fact I don't want pregnancy and its negative effects.  &gt;Why do you think so many women are pro life.  Some feel love and connection to their fetus. Some are driven by religion. Some may think others should not abort because she can't have children of her own. It doesn't matter, as not even another woman is entitled to my body.  You think every pregnancy should happen like a wanted pregnancy? You think it's a woman's duty to carry any resulting pregnancy? **Dream on. Some women will never want one even if you made the world perfect for women.**"
jrw2868,2020-06-13 18:56:37,fuq6wre,t3_h7zsxr,t1_fuoc1qf,"Absolutely. There are a lot of self-styled ""feminist"" forced birthers who *say* they want to make the world so equal for women that no  women would ever consider aborting, because having a baby wouldn't ever be a burden on the woman. My responses are that:  1. They betray themselves in never actively fighting in a visible way to enact that world first; you don't see forced-birth ""feminists"" out in front to push better protections for workplace discrimination against moms and pregnant people, free childcare for all, free healthcare for all, stronger child support laws etc. etc. / whatever they support other than abortion. You'd think if they really cared about women they'd want to make the world perfect first, so no woman ever felt forced to abort. 2. They erase women like me who would never ever agree to carry a pregnancy to term even if conditions were perfect. I'm still the kind of woman a forced-birth ""feminist"" would strap to a table and force to give birth, because that's the only way I'd ever do it."
jrw2868,2020-06-13 18:59:29,fuq78xq,t3_h7zsxr,t1_fuo9da5,"I never got what was so great about ""innocence."" Like what does that mean? Why does ""innocence"" make fetuses a special class of people? Once you're born, do you lose your ""innocence"" and suddenly don't matter anymore?  I have long suspected that the more ""innocent"" someone is perceived to be, the more forced birthers value them and it doesn't take a lot of loss of ""innocence"" for them to feel like a human being is used tissue paper, fit to be thrown in the trash. That's how they feel about women who have sex, for example.  The  only people ""Innocent"" enough to matter to forced birthers are those in the womb."
jrw2868,2020-06-13 19:02:49,fuq7mw4,t3_h7zsxr,t1_fuobvyr,"Right. If they really cared about fetuses, they'd be picketing outside fertility clinics. A lot of forced birthers will claim they don't like IVF clinics, but the truth is that they destroy far more embryos than the typical abortion clinic and you don't ever see forced birthers getting worked up about it or forced birth lawmakers trying to legislate it.  I think it was Clyde Chambliss who said “The egg in the lab doesn’t apply. It’s not in a woman. She’s not pregnant.” Absolutely couldn't be clearer."
antlindzfam,2020-06-13 19:26:08,fuqa9mx,t3_h7zsxr,t1_fuq78xq,"I don’t understand how something non sentient can be innocent or guilty to begin with. Like a tree, or a rock. IMO, lack of moral intentionality =\= innocent."
o0Jahzara0o,2020-06-13 19:29:17,fuqame8,t3_h8dlkl,t3_h8dlkl,"I would have said “it’s a woman, not a human. It’s okay to control it.”  Edit: Obviously with a backdrop of prolifers to point out the atrocity."
o0Jahzara0o,2020-06-13 19:39:12,fuqbpxu,t3_h8a1fc,t1_fuq2quz,"The fact that they think we have been brainwashed by abortion culture proves how ignorant and self absorbed they are...  As if abortion is something new...  It’s been around for centuries. Abortion exists because women wanted it to exist and made it so. Unless Planned Parenthood are time lords and have a tardis, blaming our present day recognition of abortion on this new fangled, made up “abortion culture” is just pure ignorance."
Ruefully,2020-06-13 21:16:15,fuqmlnc,t3_h8dlkl,t3_h8dlkl,"I don't owe any human usage of my body, even if they would die without me."
birdinthebush74,2020-06-13 21:25:11,fuqnlrj,t3_h8a1fc,t3_h8a1fc,"Women are either naive and brainwashed by a non embryo centric society, so should not be punished, or  they are baby murdering sluts.   Yet  they call us hypocritical as we have the emotional intelligence to say baby when we are speaking to women with wanted pregnancies as to not cause offence  Medically its a zygote/embryo/foetus and neonate after birth , saying baby when referring to a pregnancy is merely a social nicety.  Personally the couples I know who had IVF would think I was an idiot if I referred to their frozen embryos as babies."
birdinthebush74,2020-06-13 21:28:18,fuqnz0i,t3_h8a1fc,t1_fuq34lj,Challenge accepted!
sharkslutz,2020-06-13 21:35:02,fuqorsz,t3_h7zsxr,t1_fuocd1l,"I love how you didn't even say you have unprotected sex, and that's immediately what they jump to. That happens to me all the time, or I'm called a slut just for being pro-choice. The immoral angle is stupid too, because we all have different morals and we shouldn't be forcing them on others."
birdinthebush74,2020-06-13 21:46:09,fuqq2m3,t3_h8dlkl,t3_h8dlkl,They are their own worst PR
Sapphire9306,2020-06-13 21:49:01,fuqqerl,t3_h8a1fc,t1_fuqnz0i,"Can you send me an update, please? I’d love to know if you have fun."
o0Jahzara0o,2020-06-13 21:54:08,fuqqzzr,t3_h8a1fc,t1_fuqnlrj,It’s interesting how we wouldn’t call frozen embryos in an IVF clinic “frozen babies.”   How the language changes once the embryo is placed in the womb.   It’s almost like the viewpoints of women and their involvement are important or something.
birdinthebush74,2020-06-13 22:03:28,fuqrz44,t3_h8a1fc,t1_fuqqerl,"Yes well worth the time! Its so obvious the ones that have not heard  the 'we wont punish women'  GOP/religious strap line.  https://www.theguardian.com/commentisfree/2018/jul/01/donald-trump-abortion-supreme-court  Quite a few on the prolife sub are teenage boys, its seem they have moved on, must be  a distraction from the nofap sub"
birdinthebush74,2020-06-13 22:27:04,fuquf8h,t3_h8a1fc,t1_fuqrz44,bugger ! sent you a duff link https://www.bbc.co.uk/news/av/world-us-canada-35912638/donald-trump-on-abortion-from-pro-choice-to-pro-prison
ITriedSoHard419-68,2020-06-14 01:01:49,fur9oha,t3_h8dlkl,t3_h8dlkl,"You ever feel the need to insult the suffering of blacks, Jews, and women all in the same photo? Obviously this person did. :/"
o0Jahzara0o,2020-06-14 03:25:01,furmq0u,t3_h7zsxr,t1_fupi1pc,What I heard from this is that she feels entitled to using a woman’s body to have a baby produced for her.   That would be something to address too.   Which means addressing this age old adage that women are meant to serve their husbands and mothers are meant to serve their children.
InsomniacEnglish,2020-06-14 06:09:10,furzex8,t3_h8dlkl,t3_h8dlkl,"Imagine thinking that comparing an embryo to cognizant people, who suffered horrible horrible things being done to them, is rational or comparable.  These people either don't understand science, or are choosing to be purposefully offensive in order to use emotional manipulation to further their agenda. Either way they need to get a grip and join the rest of us in reality, where we know there are differences between ZEFs and born people."
sselinsea,2020-06-14 06:52:27,fus293i,t3_h8dlkl,t1_furzex8,People used to judge life by quickening or first breath... They can now judge by saying sperm meets egg because of microscopes and scientists...
Iewoose,2020-06-14 08:31:56,fus8a7i,t3_h8a1fc,t1_fuqqzzr,"Petition to call embryos ""frozen babies"". 🤣🤣🤣"
Rose3Karina,2020-06-14 13:18:22,fusqm6c,t3_h8dlkl,t3_h8dlkl,Fetus is literally the correct term for it though. Calling it a baby is used for emotional appeal on the anti choice part
Rose3Karina,2020-06-14 13:19:53,fusqquw,t3_h8a1fc,t3_h8a1fc,Anti choicers either call women monsters or naive children who don't know what they're doing. I hate the ones who pretend like they have women's best interests at heart when in reality they couldn't care less
everyonesfavpotatoe,2020-06-14 13:48:39,fust75a,t3_h8dlkl,t3_h8dlkl,Oh i didn't know the slaves and the jews were using their killers body to survive like a fetus does to a woman. Oh what's that? They weren't? They were totally independent until being enslaved or captured then murdered? Well then i guess this and absolutely horrid comparison.
everyonesfavpotatoe,2020-06-14 13:48:59,fust85e,t3_h8dlkl,t3_h8dlkl,Oh i didn't know the slaves and the jews were using their killers body to survive like a fetus does to a woman. Oh what's that? They weren't? They were totally independent until being enslaved or captured then murdered? Well then i guess this and absolutely horrid comparison.
VampireStereotype,2020-06-14 17:52:08,futihze,t3_h8xylb,t3_h8xylb,"Not that I have any reason to doubt that this is a widely held view among forced-birthers, but what's the context here, and where was it?"
Sapphire9306,2020-06-14 18:21:52,futlruh,t3_h8xylb,t1_futihze,"It was on r/abortiondebate, and I think the post was asking how high maternal mortality rates would have to be before they became pro-choice."
sneakpeekbot,2020-06-14 18:22:00,futlsdj,t3_h8xylb,t1_futlruh,"Here's a sneak peek of /r/Abortiondebate using the [top posts](https://np.reddit.com/r/Abortiondebate/top/?sort=top&amp;t=year) of the year!  \#1: [Regretting your abortion doesn't give you the right to deny others the choice](https://np.reddit.com/r/Abortiondebate/comments/fwme0b/regretting_your_abortion_doesnt_give_you_the/)   \#2: [Want Less Abortions? Fix Sex Ed.](https://np.reddit.com/r/Abortiondebate/comments/g3vwnw/want_less_abortions_fix_sex_ed/)   \#3: [‘My body, my choice’](https://np.reddit.com/r/Abortiondebate/comments/esslnm/my_body_my_choice/)  ---- ^^I'm ^^a ^^bot, ^^beep ^^boop ^^| ^^Downvote ^^to ^^remove ^^| [^^Contact ^^me](https://www.reddit.com/message/compose/?to=sneakpeekbot) ^^| [^^Info](https://np.reddit.com/r/sneakpeekbot/) ^^| [^^Opt-out](https://np.reddit.com/r/sneakpeekbot/comments/fpi5i6/blacklist_vii/)"
AutoModerator,2020-06-14 21:01:03,fuu33nn,t3_h8xylb,t1_fuu33mk,"Your submission was automatically removed for the following reason - low karma  *I am a bot, and this action was performed automatically. Please [contact the moderators of this subreddit](/message/compose/?to=/r/prochoice) if you have any questions or concerns.*"
sharkslutz,2020-06-14 21:05:14,fuu3jz0,t3_h8xylb,t3_h8xylb,We'Re PRo LiFe as LoNg as ThAt LiFe Is UsInG sOmeOne ElSe's BoDy to SuRvIvE
mkarang,2020-06-14 22:27:11,fuuclsy,t3_h8xylb,t3_h8xylb,"If anti-abortion folks want to save life, there are so many homeless and starving people to save. If they don't focus on that, then why? Maybe because their religion says so. It's definitely NOT due to lack of homeless and starving people to save."
terragutti,2020-06-14 23:25:55,fuuixfe,t3_h8xylb,t3_h8xylb,Damn... id like to just label those pro-lifers as the extremist crazies who dont speak for majority of the group....  Man if these people really knew about morality....
Ahsokalives2223,2020-06-15 00:17:55,fuuoe8l,t3_h8xylb,t3_h8xylb,"This is, in no way, the majority."
mutatron,2020-06-15 00:23:41,fuup01i,t3_h8xylb,t3_h8xylb,The human race wouldn’t last long if there were only one birth per woman.
immibis,2020-06-15 00:36:00,fuuq9et,t3_h8xylb,t1_fuup01i,Irrelevant...
ArcaneShado,2020-06-15 01:12:16,fuutz6t,t3_h8xylb,t1_futlruh,Can you link it? I want to check out how they justify that bull
jrw2868,2020-06-15 01:40:54,fuuwtuv,t3_h8xylb,t3_h8xylb,The fact that ANY forced birther accepts ANY level of maternal mortality rate is completely unacceptable.
Sapphire9306,2020-06-15 02:03:36,fuuz38w,t3_h8xylb,t1_fuutz6t,"I think if you go on the sub you’ll find it. Sorry, I don’t know how to link posts"
Ahsokalives2223,2020-06-15 02:17:43,fuv0h7s,t3_h8xylb,t1_fuusxf8,"Yes, it is, but it is either trolls or extremists, I’m currently questioning position politically, but from what I’ve seen of the Pro-life community, most support abortion in cases of maternal death."
Coreymiconius00,2020-06-15 06:59:36,fuvnlla,t3_h8xylb,t3_h8xylb,So I’m assuming that person does not support self defense or the death penalty?
