author,created_utc,id,subreddit,title
WHOOPDEFUCKINGDO,2020-06-20 19:31:35,hcs9b9,progun,All of the people not in the U.S need to fight for their right to self defense
alc59,2020-06-22 11:10:48,hdqfec,progun,L.A. Times Editorial Board is Angry About the Recent Increases in Firearms Sales
perrierpapi,2020-06-28 20:25:13,hhlpr0,progun,10 Georgia mayors ask Legislature to repeal ‘stand your ground’ law
pongo000,2020-07-06 02:48:26,hlzl2g,progun,New Zealand Minister won’t take guns from gangs (but will gladly take them from law-abiding Kiwis)
Unpeasnt_Surprise,2020-07-10 16:31:51,hos45i,progun,If more black people are armed there will be much less gun control and here's why
Unpeasnt_Surprise,2020-07-12 01:10:30,hplpwq,progun,I detected a pattern. Do you?
Rednecker1,2020-07-13 20:07:54,hqmp9h,progun,Not necessarily a gun post but a pro self defense post. Change.org petition to decriminalize batons in California
